AI Verdict (unanimous),Difference Type,cve_id,published,description,cvss_score,cvss_version,cwe_ids,cpe_strings,Claude Judgment,Claude Confidence,Claude Reasoning,Codex Judgment,Codex Confidence,Codex Reasoning,Gemini Judgment,Gemini Confidence,Gemini Reasoning,Human Verdict,Human Notes
No,vendor_only,CVE-2007-1955,2007-04-11,"Multiple stack-based buffer overflows in the SignKorea SKCrypAX ActiveX control module 5.4.1.2 allow remote attackers to execute arbitrary code via a long string in unspecified arguments to the (1) DownloadCert, (2) DecryptFileByKey, and (3) EncryptFileByKey functions, a different module and vectors than CVE-2007-1722.  NOTE: the provenance of this information is unknown; the details are obtained solely from third party information.",10.0,2.0,,cpe:2.3:a:signkorea:skcommax_activex_control:5.4.1.2:*:*:*:*:*:*:*,No,High,,No,High,,No,High,,,
No,vendor_only,CVE-2007-1722,2007-03-28,Buffer overflow in the DownloadCertificateExt function in SignKorea SKCommAX ActiveX control module 7.2.0.2 and 3280 6.6.0.1 allows remote attackers to execute arbitrary code via a long pszUserID argument.,10.0,2.0,,cpe:2.3:a:signkorea:skcommax_activex_control:6.6.0.1_3280:*:*:*:*:*:*:*|cpe:2.3:a:signkorea:skcommax_activex_control:7.2.0.2:*:*:*:*:*:*:*,No,High,,No,High,,No,High,,,
No,vendor_only,CVE-2021-20715,2021-04-27,"Improper access control vulnerability in Hot Pepper Gourmet App for Android ver.4.111.0 and earlier, and for iOS ver.4.111.0 and earlier allows a remote attacker to lead a user to access an arbitrary website via the vulnerable App.",4.3,3.1,CWE-862,cpe:2.3:a:recruit-holdings:hot_pepper_gourmet:*:*:*:*:*:android:*:*|cpe:2.3:a:recruit-holdings:hot_pepper_gourmet:*:*:*:*:*:iphone_os:*:*,No,High,,No,High,,No,High,,,
No,vendor_only,CVE-2021-47743,2025-12-31,COMMAX Biometric Access Control System 1.0.0 contains an unauthenticated reflected cross-site scripting vulnerability in cookie parameters 'CMX_ADMIN_NM' and 'CMX_COMPLEX_NM'. Attackers can inject malicious HTML and JavaScript code into these cookie values to execute arbitrary scripts in a victim's browser session.,6.1,3.1,CWE-79,,No,High,,No,High,,No,High,,,
No,vendor_only,CVE-2021-47707,2025-12-09,"COMMAX CVD-Axx DVR 5.1.4 contains weak default administrative credentials that allow remote password attacks and disclose RTSP stream. Attackers can exploit this by sending a POST request with the 'passkey' parameter set to '1234', allowing them to access the web control panel.",,,CWE-1392,,No,High,,No,High,,No,High,,,
No,vendor_only,CVE-2021-47705,2025-12-09,COMMAX UMS Client ActiveX Control 1.7.0.2 contains a heap-based buffer overflow vulnerability that allows attackers to execute arbitrary code by providing excessively long string arrays through multiple functions. Attackers can exploit improper boundary validation in CNC_Ctrl.dll to cause heap corruption and potentially gain system-level access.,,,CWE-787,,No,High,,No,High,,No,High,,,
