Difference Type,cve_id,published,description,cvss_score,cvss_version,cwe_ids,cpe_strings
intersection,CVE-2021-22819,2022-01-28,"A CWE-1021 Improper Restriction of Rendered UI Layers or Frames vulnerability exists that could cause unintended modifications of the product settings or user accounts when deceiving the user to use the web interface rendered within iframes. Affected Products: EVlink City EVC1S22P4 / EVC1S7P4 (All versions prior to R8 V3.4.0.2 ), EVlink Parking EVW2 / EVF2 / EVP2PE (All versions prior to R8 V3.4.0.2), and EVlink Smart Wallbox EVB1A (All versions prior to R8 V3.4.0.2)",4.3,3.1,CWE-1021,cpe:2.3:o:schneider-electric:evlink_city_evc1s22p4_firmware:*:*:*:*:*:*:*:*|cpe:2.3:h:schneider-electric:evlink_city_evc1s22p4:-:*:*:*:*:*:*:*|cpe:2.3:o:schneider-electric:evlink_city_evc1s7p4_firmware:*:*:*:*:*:*:*:*|cpe:2.3:h:schneider-electric:evlink_city_evc1s7p4:-:*:*:*:*:*:*:*|cpe:2.3:o:schneider-electric:evlink_parking_evw2_firmware:*:*:*:*:*:*:*:*|cpe:2.3:h:schneider-electric:evlink_parking_evw2:-:*:*:*:*:*:*:*|cpe:2.3:o:schneider-electric:evlink_parking_evf2_firmware:*:*:*:*:*:*:*:*|cpe:2.3:h:schneider-electric:evlink_parking_evf2:-:*:*:*:*:*:*:*|cpe:2.3:o:schneider-electric:evlink_parking_evp2pe_firmware:*:*:*:*:*:*:*:*|cpe:2.3:h:schneider-electric:evlink_parking_evp2pe:-:*:*:*:*:*:*:*|cpe:2.3:o:schneider-electric:evlink_smart_wallbox_evb1a_firmware:*:*:*:*:*:*:*:*|cpe:2.3:h:schneider-electric:evlink_smart_wallbox_evb1a:-:*:*:*:*:*:*:*
intersection,CVE-2021-22820,2022-01-28,"A CWE-614 Insufficient Session Expiration vulnerability exists that could allow an attacker to maintain an unauthorized access over a hijacked session to the charger station web server even after the legitimate user account holder has changed his password. Affected Products: EVlink City EVC1S22P4 / EVC1S7P4 (All versions prior to R8 V3.4.0.2 ), EVlink Parking EVW2 / EVF2 / EVP2PE (All versions prior to R8 V3.4.0.2), and EVlink Smart Wallbox EVB1A (All versions prior to R8 V3.4.0.2)",9.8,3.1,CWE-613,cpe:2.3:o:schneider-electric:evlink_city_evc1s22p4_firmware:*:*:*:*:*:*:*:*|cpe:2.3:h:schneider-electric:evlink_city_evc1s22p4:-:*:*:*:*:*:*:*|cpe:2.3:o:schneider-electric:evlink_city_evc1s7p4_firmware:*:*:*:*:*:*:*:*|cpe:2.3:h:schneider-electric:evlink_city_evc1s7p4:-:*:*:*:*:*:*:*|cpe:2.3:o:schneider-electric:evlink_parking_evw2_firmware:*:*:*:*:*:*:*:*|cpe:2.3:h:schneider-electric:evlink_parking_evw2:-:*:*:*:*:*:*:*|cpe:2.3:o:schneider-electric:evlink_parking_evf2_firmware:*:*:*:*:*:*:*:*|cpe:2.3:h:schneider-electric:evlink_parking_evf2:-:*:*:*:*:*:*:*|cpe:2.3:o:schneider-electric:evlink_parking_evp2pe_firmware:*:*:*:*:*:*:*:*|cpe:2.3:h:schneider-electric:evlink_parking_evp2pe:-:*:*:*:*:*:*:*|cpe:2.3:o:schneider-electric:evlink_smart_wallbox_evb1a_firmware:*:*:*:*:*:*:*:*|cpe:2.3:h:schneider-electric:evlink_smart_wallbox_evb1a:-:*:*:*:*:*:*:*
intersection,CVE-2021-22821,2022-01-28,"A CWE-918 Server-Side Request Forgery (SSRF) vulnerability exists that could cause the station web server to forward requests to unintended network targets when crafted malicious parameters are submitted to the charging station web server. Affected Products: EVlink City EVC1S22P4 / EVC1S7P4 (All versions prior to R8 V3.4.0.2 ), EVlink Parking EVW2 / EVF2 / EVP2PE (All versions prior to R8 V3.4.0.2), and EVlink Smart Wallbox EVB1A (All versions prior to R8 V3.4.0.2)",8.6,3.1,CWE-918,cpe:2.3:o:schneider-electric:evlink_city_evc1s22p4_firmware:*:*:*:*:*:*:*:*|cpe:2.3:h:schneider-electric:evlink_city_evc1s22p4:-:*:*:*:*:*:*:*|cpe:2.3:o:schneider-electric:evlink_city_evc1s7p4_firmware:*:*:*:*:*:*:*:*|cpe:2.3:h:schneider-electric:evlink_city_evc1s7p4:-:*:*:*:*:*:*:*|cpe:2.3:o:schneider-electric:evlink_parking_evw2_firmware:*:*:*:*:*:*:*:*|cpe:2.3:h:schneider-electric:evlink_parking_evw2:-:*:*:*:*:*:*:*|cpe:2.3:o:schneider-electric:evlink_parking_evf2_firmware:*:*:*:*:*:*:*:*|cpe:2.3:h:schneider-electric:evlink_parking_evf2:-:*:*:*:*:*:*:*|cpe:2.3:o:schneider-electric:evlink_parking_evp2pe_firmware:*:*:*:*:*:*:*:*|cpe:2.3:h:schneider-electric:evlink_parking_evp2pe:-:*:*:*:*:*:*:*|cpe:2.3:o:schneider-electric:evlink_smart_wallbox_evb1a_firmware:*:*:*:*:*:*:*:*|cpe:2.3:h:schneider-electric:evlink_smart_wallbox_evb1a:-:*:*:*:*:*:*:*
intersection,CVE-2021-22822,2022-01-28,"A CWE-79 Improper Neutralization of Input During Web Page Generation (�Cross-site Scripting�) vulnerability exists that could allow an attacker to impersonate the user who manages the charging station or carry out actions on their behalf when crafted malicious parameters are submitted to the charging station web server. Affected Products: EVlink City EVC1S22P4 / EVC1S7P4 (All versions prior to R8 V3.4.0.2 ), EVlink Parking EVW2 / EVF2 / EVP2PE (All versions prior to R8 V3.4.0.2), and EVlink Smart Wallbox EVB1A (All versions prior to R8 V3.4.0.2)",6.1,3.1,CWE-79,cpe:2.3:o:schneider-electric:evlink_city_evc1s22p4_firmware:*:*:*:*:*:*:*:*|cpe:2.3:h:schneider-electric:evlink_city_evc1s22p4:-:*:*:*:*:*:*:*|cpe:2.3:o:schneider-electric:evlink_city_evc1s7p4_firmware:*:*:*:*:*:*:*:*|cpe:2.3:h:schneider-electric:evlink_city_evc1s7p4:-:*:*:*:*:*:*:*|cpe:2.3:o:schneider-electric:evlink_parking_evw2_firmware:*:*:*:*:*:*:*:*|cpe:2.3:h:schneider-electric:evlink_parking_evw2:-:*:*:*:*:*:*:*|cpe:2.3:o:schneider-electric:evlink_parking_evf2_firmware:*:*:*:*:*:*:*:*|cpe:2.3:h:schneider-electric:evlink_parking_evf2:-:*:*:*:*:*:*:*|cpe:2.3:o:schneider-electric:evlink_parking_evp2pe_firmware:*:*:*:*:*:*:*:*|cpe:2.3:h:schneider-electric:evlink_parking_evp2pe:-:*:*:*:*:*:*:*|cpe:2.3:o:schneider-electric:evlink_smart_wallbox_evb1a_firmware:*:*:*:*:*:*:*:*|cpe:2.3:h:schneider-electric:evlink_smart_wallbox_evb1a:-:*:*:*:*:*:*:*
intersection,CVE-2022-22807,2022-02-09,"A CWE-1021 Improper Restriction of Rendered UI Layers or Frames vulnerability exists that could cause unintended modifications of the product settings or user accounts when deceiving the user to use the web interface rendered within iframes. Affected Product: EcoStruxure EV Charging Expert (formerly known as EVlink Load Management System): (HMIBSCEA53D1EDB, HMIBSCEA53D1EDS, HMIBSCEA53D1EDM, HMIBSCEA53D1EDL, HMIBSCEA53D1ESS, HMIBSCEA53D1ESM, HMIBSCEA53D1EML) (All Versions prior to SP8 (Version 01) V4.0.0.13)",7.4,3.1,CWE-1021,cpe:2.3:o:schneider-electric:hmibscea53d1edb_firmware:*:*:*:*:*:*:*:*|cpe:2.3:h:schneider-electric:hmibscea53d1edb:-:*:*:*:*:*:*:*|cpe:2.3:o:schneider-electric:hmibscea53d1eds_firmware:*:*:*:*:*:*:*:*|cpe:2.3:h:schneider-electric:hmibscea53d1eds:-:*:*:*:*:*:*:*|cpe:2.3:o:schneider-electric:hmibscea53d1edm_firmware:*:*:*:*:*:*:*:*|cpe:2.3:h:schneider-electric:hmibscea53d1edm:-:*:*:*:*:*:*:*|cpe:2.3:o:schneider-electric:hmibscea53d1edl_firmware:*:*:*:*:*:*:*:*|cpe:2.3:h:schneider-electric:hmibscea53d1edl:-:*:*:*:*:*:*:*|cpe:2.3:o:schneider-electric:hmibscea53d1ess_firmware:*:*:*:*:*:*:*:*|cpe:2.3:h:schneider-electric:hmibscea53d1ess:-:*:*:*:*:*:*:*|cpe:2.3:o:schneider-electric:hmibscea53d1esm_firmware:*:*:*:*:*:*:*:*|cpe:2.3:h:schneider-electric:hmibscea53d1esm:-:*:*:*:*:*:*:*|cpe:2.3:o:schneider-electric:hmibscea53d1eml_firmware:*:*:*:*:*:*:*:*|cpe:2.3:h:schneider-electric:hmibscea53d1eml:-:*:*:*:*:*:*:*
intersection,CVE-2022-22808,2022-02-09,"A CWE-352: Cross-Site Request Forgery (CSRF) exists that could cause a remote attacker to gain unauthorized access to the product when conducting cross-domain attacks based on same-origin policy or cross-site request forgery protections bypass. Affected Product: EcoStruxure EV Charging Expert (formerly known as EVlink Load Management System): (HMIBSCEA53D1EDB, HMIBSCEA53D1EDS, HMIBSCEA53D1EDM, HMIBSCEA53D1EDL, HMIBSCEA53D1ESS, HMIBSCEA53D1ESM, HMIBSCEA53D1EML) (All Versions prior to SP8 (Version 01) V4.0.0.13)",8.8,3.1,CWE-352,cpe:2.3:o:schneider-electric:hmibscea53d1edb_firmware:*:*:*:*:*:*:*:*|cpe:2.3:h:schneider-electric:hmibscea53d1edb:-:*:*:*:*:*:*:*|cpe:2.3:o:schneider-electric:hmibscea53d1eds_firmware:*:*:*:*:*:*:*:*|cpe:2.3:h:schneider-electric:hmibscea53d1eds:-:*:*:*:*:*:*:*|cpe:2.3:o:schneider-electric:hmibscea53d1edm_firmware:*:*:*:*:*:*:*:*|cpe:2.3:h:schneider-electric:hmibscea53d1edm:-:*:*:*:*:*:*:*|cpe:2.3:o:schneider-electric:hmibscea53d1edl_firmware:*:*:*:*:*:*:*:*|cpe:2.3:h:schneider-electric:hmibscea53d1edl:-:*:*:*:*:*:*:*|cpe:2.3:o:schneider-electric:hmibscea53d1ess_firmware:*:*:*:*:*:*:*:*|cpe:2.3:h:schneider-electric:hmibscea53d1ess:-:*:*:*:*:*:*:*|cpe:2.3:o:schneider-electric:hmibscea53d1esm_firmware:*:*:*:*:*:*:*:*|cpe:2.3:h:schneider-electric:hmibscea53d1esm:-:*:*:*:*:*:*:*|cpe:2.3:o:schneider-electric:hmibscea53d1eml_firmware:*:*:*:*:*:*:*:*|cpe:2.3:h:schneider-electric:hmibscea53d1eml:-:*:*:*:*:*:*:*
intersection,CVE-2024-1707,2024-02-21,"A vulnerability, which was classified as problematic, was found in GARO WALLBOX GLB+ T2EV7 0.5. This affects an unknown part of the file /index.jsp#settings of the component Software Update Handler. The manipulation of the argument Reference leads to cross site scripting. It is possible to initiate the attack remotely. The exploit has been disclosed to the public and may be used. The identifier VDB-254397 was assigned to this vulnerability. NOTE: The vendor was contacted early about this disclosure but did not respond in any way.",6.1,3.1,CWE-79,cpe:2.3:o:garo:wallbox_glb\+_t2ev7_firmware:0.5:*:*:*:*:*:*:*|cpe:2.3:h:garo:wallbox_glb\+_t2ev7:-:*:*:*:*:*:*:*
intersection,CVE-2024-23968,2025-01-31,"This vulnerability allows network-adjacent attackers to execute arbitrary code on affected installations of ChargePoint Home Flex charging stations. Authentication is not required to exploit this vulnerability.

The specific flaw exists within the SrvrToSmSetAutoChnlListMsg function. The issue results from the lack of proper validation of the length of user-supplied data prior to copying it to a fixed-length stack-based buffer. An attacker can leverage this vulnerability to execute code in the context of root.",8.8,3.1,CWE-120,cpe:2.3:o:chargepoint:home_flex_nema_14-50_plug_firmware:-:*:*:*:*:*:*:*|cpe:2.3:h:chargepoint:home_flex_nema_14-50_plug:-:*:*:*:*:*:*:*|cpe:2.3:o:chargepoint:home_flex_hardwired_firmware:-:*:*:*:*:*:*:*|cpe:2.3:h:chargepoint:home_flex_hardwired:-:*:*:*:*:*:*:*|cpe:2.3:o:chargepoint:home_flex_nema_6-50_plug_firmware:-:*:*:*:*:*:*:*|cpe:2.3:h:chargepoint:home_flex_nema_6-50_plug:-:*:*:*:*:*:*:*
intersection,CVE-2024-23969,2025-01-31,"This vulnerability allows network-adjacent attackers to execute arbitrary code on affected installations of ChargePoint Home Flex charging stations. Authentication is not required to exploit this vulnerability.

The specific flaw exists within the wlanchnllst function. The issue results from the lack of proper validation of user-supplied data, which can result in a write past the end of an allocated buffer. An attacker can leverage this vulnerability to execute code in the context of root.",8.8,3.1,CWE-787,cpe:2.3:o:chargepoint:home_flex_nema_14-50_plug_firmware:-:*:*:*:*:*:*:*|cpe:2.3:h:chargepoint:home_flex_nema_14-50_plug:-:*:*:*:*:*:*:*|cpe:2.3:o:chargepoint:home_flex_hardwired_firmware:-:*:*:*:*:*:*:*|cpe:2.3:h:chargepoint:home_flex_hardwired:-:*:*:*:*:*:*:*|cpe:2.3:o:chargepoint:home_flex_nema_6-50_plug_firmware:-:*:*:*:*:*:*:*|cpe:2.3:h:chargepoint:home_flex_nema_6-50_plug:-:*:*:*:*:*:*:*
intersection,CVE-2024-23970,2025-01-31,"This vulnerability allows network-adjacent attackers to compromise transport security on affected installations of ChargePoint Home Flex charging stations. Authentication is not required to exploit this vulnerability.

The specific flaw exists within the CURLOPT_SSL_VERIFYHOST setting. The issue results from the lack of proper validation of the certificate presented by the server. An attacker can leverage this in conjunction with other vulnerabilities to execute code in the context of root.",6.5,3.1,CWE-295,cpe:2.3:o:chargepoint:home_flex_nema_14-50_plug_firmware:-:*:*:*:*:*:*:*|cpe:2.3:h:chargepoint:home_flex_nema_14-50_plug:-:*:*:*:*:*:*:*|cpe:2.3:o:chargepoint:home_flex_hardwired_firmware:-:*:*:*:*:*:*:*|cpe:2.3:h:chargepoint:home_flex_hardwired:-:*:*:*:*:*:*:*|cpe:2.3:o:chargepoint:home_flex_nema_6-50_plug_firmware:-:*:*:*:*:*:*:*|cpe:2.3:h:chargepoint:home_flex_nema_6-50_plug:-:*:*:*:*:*:*:*
intersection,CVE-2024-23971,2025-01-31,"This vulnerability allows network-adjacent attackers to execute arbitrary code on affected installations of ChargePoint Home Flex charging stations. Authentication is not required to exploit this vulnerability.

The specific flaw exists within the handling of OCPP messages. The issue results from the lack of proper validation of a user-supplied string before using it to execute a system call. An attacker can leverage this vulnerability to execute code in the context of root.",8.8,3.1,CWE-77,cpe:2.3:o:chargepoint:home_flex_nema_14-50_plug_firmware:-:*:*:*:*:*:*:*|cpe:2.3:h:chargepoint:home_flex_nema_14-50_plug:-:*:*:*:*:*:*:*|cpe:2.3:o:chargepoint:home_flex_hardwired_firmware:-:*:*:*:*:*:*:*|cpe:2.3:h:chargepoint:home_flex_hardwired:-:*:*:*:*:*:*:*|cpe:2.3:o:chargepoint:home_flex_nema_6-50_plug_firmware:-:*:*:*:*:*:*:*|cpe:2.3:h:chargepoint:home_flex_nema_6-50_plug:-:*:*:*:*:*:*:*
intersection,CVE-2024-23920,2025-01-31,"This vulnerability allows network-adjacent attackers to execute arbitrary code on affected installations of ChargePoint Home Flex charging stations. Authentication is not required to exploit this vulnerability.

The specific flaw exists within the onboardee module. The issue results from improper access control. An attacker can leverage this vulnerability to execute code in the context of root.",8.8,3.1,CWE-284,cpe:2.3:o:chargepoint:home_flex_nema_14-50_plug_firmware:-:*:*:*:*:*:*:*|cpe:2.3:h:chargepoint:home_flex_nema_14-50_plug:-:*:*:*:*:*:*:*|cpe:2.3:o:chargepoint:home_flex_hardwired_firmware:-:*:*:*:*:*:*:*|cpe:2.3:h:chargepoint:home_flex_hardwired:-:*:*:*:*:*:*:*|cpe:2.3:o:chargepoint:home_flex_nema_6-50_plug_firmware:-:*:*:*:*:*:*:*|cpe:2.3:h:chargepoint:home_flex_nema_6-50_plug:-:*:*:*:*:*:*:*
intersection,CVE-2024-23921,2025-01-31,"This vulnerability allows network-adjacent attackers to execute arbitrary code on affected installations of ChargePoint Home Flex charging stations. Authentication is not required to exploit this vulnerability.

The specific flaw exists within the wlanapp module. The issue results from the lack of proper validation of a user-supplied string before using it to execute a system call. An attacker can leverage this vulnerability to execute code in the context of root.",8.8,3.1,CWE-94,cpe:2.3:o:chargepoint:home_flex_nema_14-50_plug_firmware:-:*:*:*:*:*:*:*|cpe:2.3:h:chargepoint:home_flex_nema_14-50_plug:-:*:*:*:*:*:*:*|cpe:2.3:o:chargepoint:home_flex_hardwired_firmware:-:*:*:*:*:*:*:*|cpe:2.3:h:chargepoint:home_flex_hardwired:-:*:*:*:*:*:*:*|cpe:2.3:o:chargepoint:home_flex_nema_6-50_plug_firmware:-:*:*:*:*:*:*:*|cpe:2.3:h:chargepoint:home_flex_nema_6-50_plug:-:*:*:*:*:*:*:*
intersection,CVE-2025-31930,2025-05-13,"A vulnerability has been identified in IEC 1Ph 7.4kW Child socket (8EM1310-2EH04-0GA0) (All versions < V2.135), IEC 1Ph 7.4kW Child socket/ shutter (8EM1310-2EN04-0GA0) (All versions < V2.135), IEC 1Ph 7.4kW Parent cable 7m (8EM1310-2EJ04-3GA1) (All versions < V2.135), IEC 1Ph 7.4kW Parent cable 7m incl. SIM (8EM1310-2EJ04-3GA2) (All versions < V2.135), IEC 1Ph 7.4kW Parent socket (8EM1310-2EH04-3GA1) (All versions < V2.135), IEC 1Ph 7.4kW Parent socket incl. SIM (8EM1310-2EH04-3GA2) (All versions < V2.135), IEC 1Ph 7.4kW Parent socket/ shutter (8EM1310-2EN04-3GA1) (All versions < V2.135), IEC 1Ph 7.4kW Parent socket/ shutter SIM (8EM1310-2EN04-3GA2) (All versions < V2.135), IEC 3Ph 22kW Child cable 7m (8EM1310-3EJ04-0GA0) (All versions < V2.135), IEC 3Ph 22kW Child socket (8EM1310-3EH04-0GA0) (All versions < V2.135), IEC 3Ph 22kW Child socket/ shutter (8EM1310-3EN04-0GA0) (All versions < V2.135), IEC 3Ph 22kW Parent cable 7m (8EM1310-3EJ04-3GA1) (All versions < V2.135), IEC 3Ph 22kW Parent cable 7m incl. SIM (8EM1310-3EJ04-3GA2) (All versions < V2.135), IEC 3Ph 22kW Parent socket (8EM1310-3EH04-3GA1) (All versions < V2.135), IEC 3Ph 22kW Parent socket incl. SIM (8EM1310-3EH04-3GA2) (All versions < V2.135), IEC 3Ph 22kW Parent socket/ shutter (8EM1310-3EN04-3GA1) (All versions < V2.135), IEC 3Ph 22kW Parent socket/ shutter SIM (8EM1310-3EN04-3GA2) (All versions < V2.135), IEC ERK 3Ph 22 kW Child cable 7m (8EM1310-3FJ04-0GA0) (All versions < V2.135), IEC ERK 3Ph 22 kW Child cable 7m (8EM1310-3FJ04-0GA1) (All versions < V2.135), IEC ERK 3Ph 22 kW Child cable 7m (8EM1310-3FJ04-0GA2) (All versions < V2.135), IEC ERK 3Ph 22 kW Child socket (8EM1310-3FH04-0GA0) (All versions < V2.135), IEC ERK 3Ph 22 kW Parent socket (8EM1310-3FH04-3GA1) (All versions < V2.135), IEC ERK 3Ph 22 kW Parent socket incl. SI (8EM1310-3FH04-3GA2) (All versions < V2.135), UL Commercial Cellular 48A NTEP (8EM1310-5HF14-1GA2) (All versions < V2.135), UL Commercial Child 40A w/ 15118 HW (8EM1310-4CF14-0GA0) (All versions < V2.135), UL Commercial Child 48A BA Compliant (8EM1315-5CG14-0GA0) (All versions < V2.135), UL Commercial Child 48A w/ 15118 HW (8EM1310-5CF14-0GA0) (All versions < V2.135), UL Commercial Parent 40A with Simcard (8EM1310-4CF14-1GA2) (All versions < V2.135), UL Commercial Parent 48A (USPS) (8EM1317-5CG14-1GA2) (All versions < V2.135), UL Commercial Parent 48A BA Compliant (8EM1315-5CG14-1GA2) (All versions < V2.135), UL Commercial Parent 48A with Simcard BA (8EM1310-5CF14-1GA2) (All versions < V2.135), UL Commercial Parent 48A, 15118, 25ft (8EM1310-5CG14-1GA1) (All versions < V2.135), UL Commercial Parent 48A, 15118, 25ft (8EM1314-5CG14-2FA2) (All versions < V2.135), UL Commercial Parent 48A, 15118, 25ft (8EM1315-5HG14-1GA2) (All versions < V2.135), UL Commercial Parent 48A,15118 25ft Sim (8EM1310-5CG14-1GA2) (All versions < V2.135), VersiCharge Blue™ 80A AC Cellular (8EM1315-7BG16-1FH2) (All versions < V2.135). Affected devices contain Modbus service enabled by default. This could allow an attacker connected to the same network to remotely control the EV charger.",8.8,3.1,CWE-1188,
intersection,CVE-2025-5747,2025-06-06,"WOLFBOX Level 2 EV Charger MCU Command Parsing Misinterpretation of Input Remote Code Execution Vulnerability. This vulnerability allows network-adjacent attackers to execute arbitrary code on affected installatons of WOLFBOX Level 2 EV Charger devices. Authentication is required to exploit this vulnerability.

The specific flaw exists within the handling of command frames received by the MCU. When parsing frames, the process does not properly detect the start of a frame, which can lead to misinterpretation of input. An attacker can leverage this in conjunction with other vulnerabilities to execute arbitrary code in the context of the device. Was ZDI-CAN-26501.",8.0,3.0,CWE-115,cpe:2.3:o:wolfbox:level_2_ev_charger_firmware:3.1.17:*:*:*:*:*:*:*|cpe:2.3:h:wolfbox:level_2_ev_charger:-:*:*:*:*:*:*:*
intersection,CVE-2025-5748,2025-06-06,"WOLFBOX Level 2 EV Charger LAN OTA Exposed Dangerous Method Remote Code Execution Vulnerability. This vulnerability allows network-adjacent attackers to execute arbitrary code on affected installations of WOLFBOX Level 2 EV Charger. Although authentication is required to exploit this vulnerability, the existing authentication mechanism can be bypassed.

The specific flaw exists within the Tuya communications module software. The issue results from the exposure of a method allowing the upload of crafted software images to the module. An attacker can leverage this vulnerability to execute code in the context of the device. Was ZDI-CAN-26349.",8.0,3.0,CWE-749,cpe:2.3:o:wolfbox:level_2_ev_charger_firmware:3.1.17:*:*:*:*:*:*:*|cpe:2.3:h:wolfbox:level_2_ev_charger:-:*:*:*:*:*:*:*
intersection,CVE-2025-5749,2025-06-06,"WOLFBOX Level 2 EV Charger BLE Encryption Keys Uninitialized Variable Authentication Bypass Vulnerability. This vulnerability allows network-adjacent attackers to bypass authentication on affected installations of WOLFBOX Level 2 EV Charger devices. Authentication is not required to exploit this vulnerability.

The specific flaw exists within the handling of cryptographic keys used in vendor-specific encrypted communications. The issue results from the lack of proper initialization of a variable prior to accessing it. An attacker can leverage this vulnerability to bypass authentication on the system. Was ZDI-CAN-26295.",8.8,3.1,CWE-457,cpe:2.3:o:wolfbox:level_2_ev_charger_firmware:3.1.17:*:*:*:*:*:*:*|cpe:2.3:h:wolfbox:level_2_ev_charger:-:*:*:*:*:*:*:*
intersection,CVE-2025-5750,2025-06-06,"WOLFBOX Level 2 EV Charger tuya_svc_devos_activate_result_parse Heap-based Buffer Overflow Remote Code Execution Vulnerability. This vulnerability allows network-adjacent attackers to execute arbitrary code on affected installations of WOLFBOX Level 2 EV Charger. Authentication is not required to exploit this vulnerability.

The specific flaw exists within the handling of the secKey, localKey, stdTimeZone and devId parameters. The issue results from the lack of proper validation of the length of user-supplied data prior to copying it to a fixed-length heap-based buffer. An attacker can leverage this vulnerability to execute code in the context of the device. Was ZDI-CAN-26294.",8.8,3.0,CWE-122,cpe:2.3:o:wolfbox:level_2_ev_charger_firmware:3.1.17:*:*:*:*:*:*:*|cpe:2.3:h:wolfbox:level_2_ev_charger:-:*:*:*:*:*:*:*
intersection,CVE-2025-5751,2025-06-06,"WOLFBOX Level 2 EV Charger Management Card Hard-coded Credentials Authentication Bypass Vulnerability. This vulnerability allows physically present attackers to bypass authentication on affected installations of WOLFBOX Level 2 EV Charger. Authentication is not required to exploit this vulnerability.

The specific flaw exists within the handling of management cards. The issue results from the lack of personalization of management cards. An attacker can leverage this vulnerability to bypass authentication on the system. Was ZDI-CAN-26292.",6.8,3.1,CWE-798,cpe:2.3:o:wolfbox:level_2_ev_charger_firmware:3.1.17:*:*:*:*:*:*:*|cpe:2.3:h:wolfbox:level_2_ev_charger:-:*:*:*:*:*:*:*
intersection,CVE-2026-0778,2026-01-23,"Enel X JuiceBox 40 Telnet Service Missing Authentication Remote Code Execution Vulnerability. This vulnerability allows network-adjacent attackers to execute arbitrary code on affected installations of Enel X JuiceBox 40 charging stations. Authentication is not required to exploit this vulnerability.

The specific flaw exists within the telnet service, which listens on TCP port 2000 by default. The issue results from the lack of authentication prior to allowing remote connections. An attacker can leverage this vulnerability to execute code in the context of the service account. Was ZDI-CAN-23285.",8.8,3.0,CWE-306,
intersection,CVE-2026-4155,2026-04-11,"ChargePoint Home Flex Inclusion of Sensitive Information in Source Code Information Disclosure Vulnerability. This vulnerability allows remote attackers to disclose sensitive information on affected installations of ChargePoint Home Flex charging stations. Authentication is not required to exploit this vulnerability.

The specific flaw exists within the genpw script. The issue results from the inclusion of a secret cryptographic seed value within the script. An attacker can leverage this vulnerability to disclose stored credentials, leading to further compromise. Was ZDI-CAN-26340.",7.5,3.0,CWE-540,cpe:2.3:o:chargepoint:home_flex_cph50_firmware:*:*:*:*:*:*:*:*|cpe:2.3:h:chargepoint:home_flex_cph50:-:*:*:*:*:*:*:*
intersection,CVE-2026-4156,2026-04-11,"ChargePoint Home Flex OCPP getpreq Stack-based Buffer Overflow Remote Code Execution Vulnerability. This vulnerability allows network-adjacent attackers to execute arbitrary code on affected installations of ChargePoint Home Flex EV chargers. Authentication is not required to exploit this vulnerability.

The specific flaw exists within the handling of OCPP messages. The issue results from the lack of proper validation of the length of user-supplied data prior to copying it to a fixed-length stack-based buffer. An attacker can leverage this vulnerability to execute code in the context of root. Was ZDI-CAN-26339.",7.5,3.0,CWE-121,cpe:2.3:o:chargepoint:home_flex_cph50_firmware:*:*:*:*:*:*:*:*|cpe:2.3:h:chargepoint:home_flex_cph50:-:*:*:*:*:*:*:*
