Verdicts,Review Reason,cve_id,description,cpe_strings,Difference Type,published,cvss_score,cvss_version,cwe_ids,Claude Judgment,Claude Confidence,Claude Reasoning,Codex Judgment,Codex Confidence,Codex Reasoning,Gemini Judgment,Gemini Confidence,Gemini Reasoning,Human Verdict,Human Notes
C:No/High  X:Yes/High  G:No/High,judgments not unanimous,CVE-2013-5578,Buffer overflow in the ToDot method in the WINGRAPHVIZLib.NEATO ActiveX control in WinGraphviz.dll in StarUML allows remote attackers to execute arbitrary code via a long argument.,cpe:2.3:a:staruml:staruml:5.0.2.1570:*:*:*:*:*:*:*,vendor_only,2013-08-25,9.3,2.0,CWE-119,No,High,"The flaw is in WinGraphviz.dll bundled with StarUML (UML diagramming software); it matched 'NEATO', the Graphviz layout engine, not the Neato robot-vacuum brand. Unrelated to robot vacuums.",Yes,High,,No,High,,,
C:Yes/Low  X:Yes/High  G:No/High,judgments not unanimous,CVE-2024-12079,"ECOVACS robot lawnmowers store the anti-theft PIN in cleartext on the device filesystem. An attacker can steal a lawnmower, read the PIN, and reset the anti-theft mechanism.",cpe:2.3:o:ecovacs:deebot_900_firmware:-:*:*:*:*:*:*:*|cpe:2.3:h:ecovacs:deebot_900:-:*:*:*:*:*:*:*|cpe:2.3:o:ecovacs:deebot_n8_firmware:-:*:*:*:*:*:*:*|cpe:2.3:h:ecovacs:deebot_n8:-:*:*:*:*:*:*:*|cpe:2.3:o:ecovacs:deebot_t8_firmware:-:*:*:*:*:*:*:*|cpe:2.3:h:ecovacs:deebot_t8:-:*:*:*:*:*:*:*|cpe:2.3:o:ecovacs:deebot_n9_firmware:-:*:*:*:*:*:*:*|cpe:2.3:h:ecovacs:deebot_n9:-:*:*:*:*:*:*:*|cpe:2.3:o:ecovacs:deebot_t9_firmware:-:*:*:*:*:*:*:*|cpe:2.3:h:ecovacs:deebot_t9:-:*:*:*:*:*:*:*|cpe:2.3:o:ecovacs:deebot_n10_firmware:-:*:*:*:*:*:*:*|cpe:2.3:h:ecovacs:deebot_n10:-:*:*:*:*:*:*:*|cpe:2.3:o:ecovacs:deebot_t10_firmware:-:*:*:*:*:*:*:*|cpe:2.3:h:ecovacs:deebot_t10:-:*:*:*:*:*:*:*|cpe:2.3:o:ecovacs:deebot_x1_firmware:-:*:*:*:*:*:*:*|cpe:2.3:h:ecovacs:deebot_x1:-:*:*:*:*:*:*:*|cpe:2.3:o:ecovacs:deebot_t20_firmware:-:*:*:*:*:*:*:*|cpe:2.3:h:ecovacs:deebot_t20:-:*:*:*:*:*:*:*|cpe:2.3:o:ecovacs:deebot_x2_firmware:-:*:*:*:*:*:*:*|cpe:2.3:h:ecovacs:deebot_x2:-:*:*:*:*:*:*:*|cpe:2.3:o:ecovacs:goat_g1_firmware:-:*:*:*:*:*:*:*|cpe:2.3:h:ecovacs:goat_g1:-:*:*:*:*:*:*:*|cpe:2.3:o:ecovacs:airbot_z1_firmware:-:*:*:*:*:*:*:*|cpe:2.3:h:ecovacs:airbot_z1:-:*:*:*:*:*:*:*|cpe:2.3:o:ecovacs:airbot_ava_firmware:-:*:*:*:*:*:*:*|cpe:2.3:h:ecovacs:airbot_ava:-:*:*:*:*:*:*:*|cpe:2.3:o:ecovacs:airbot_andy_firmware:-:*:*:*:*:*:*:*|cpe:2.3:h:ecovacs:airbot_andy:-:*:*:*:*:*:*:*,vendor_only,2025-01-23,3.3,3.1,CWE-312,Yes,Low,"The description mentions ECOVACS robot lawnmowers, but the CPE list is ECOVACS Deebot 900/N8/T8 - which are robot vacuums - so it does affect home robot vacuums.",Yes,High,,No,High,,,
C:Maybe/Low  X:Maybe/Low  G:Yes/High,both strong reviewers low confidence; judgments not unanimous,CVE-2024-52329,ECOVACS HOME mobile app plugins for specific robots do not properly validate TLS certificates. An unauthenticated attacker can read or modify TLS traffic and obtain authentication tokens.,cpe:2.3:a:ecovacs:home:*:*:*:*:*:android:*:*|cpe:2.3:a:ecovacs:home:*:*:*:*:*:iphone_os:*:*,vendor_only,2025-01-23,7.4,3.1,CWE-295,Maybe,Low,"ECOVACS HOME is the companion mobile app for ECOVACS robot vacuums, but the vulnerability is in the app rather than within the vacuum device, so category fit is ambiguous.",Maybe,Low,Vulnerability appears in a companion app; unclear if the standalone robot vacuum device firmware/hardware is affected.,Yes,High,,,
C:No/Low  X:No/High  G:Yes/High,judgments not unanimous,CVE-2025-53649,"""SwitchBot"" App for iOS/Android contains an insertion of sensitive information into log file vulnerability in versions V6.24 through V9.12. If this vulnerability is exploited, sensitive user information may be exposed to an attacker who has access to the application logs.",,vendor_only,2025-07-29,5.1,3.0,CWE-532,No,Low,"SwitchBot's companion app spans many SwitchBot device types and the vulnerability is in the mobile app, not specific to (or within) a robot vacuum device.",No,High,,Yes,High,,,
C:Maybe/Low  X:Yes/High  G:Yes/High,judgments not unanimous,CVE-2025-2394,"Ecovacs Home Android and iOS Mobile Applications up to version 3.3.0 contained embedded access keys and secrets for Alibaba Object Storage Service (OSS), leading to sensitive data disclosure.",,vendor_only,2025-05-23,,,CWE-798,Maybe,Low,"ECOVACS HOME is the companion mobile app for ECOVACS robot vacuums, but the vulnerability is in the app rather than within the vacuum device, so category fit is ambiguous.",Yes,High,,Yes,High,,,
