Source File,Source Sheet,CVE,CVSS,CVSS Severity,CWE,CWE Name,Description
CategoryII_NetworkGatewayDeviceTypes.xlsx,wifi router,CVE-2022-38325,9.8,CRITICAL,CWE-120,CWE-120,Tenda AC15 WiFi Router V15.03.05.19_multi and AC18 WiFi Router V15.03.05.19_multi were discovered to contain a buffer overflow via the filePath parameter at /goform/expandDlnaFile.
CategoryII_NetworkGatewayDeviceTypes.xlsx,wifi router,CVE-2023-28760,7.5,HIGH,CWE-121,CWE-121,"TP-Link AX1800 WiFi 6 Router (Archer AX21) devices allow unauthenticated attackers (on the LAN) to execute arbitrary code as root via the db_dir field to minidlnad. The attacker obtains the ability to modify files.db, and that can be used to reach a stack-based buffer overflow in minidlna-1.1.2/upnpsoap.c. Exploitation requires that a USB flash drive is connected to the router (customers often do this to make a \\192.168.0.1 share available on their local network)."
CategoryII_NetworkGatewayDeviceTypes.xlsx,wireless router,CVE-2018-19037,7.5,HIGH,CWE-400,CWE-400,"On Virgin Media wireless router 3.0 hub devices, the web interface is vulnerable to denial of service. When POST requests are sent and keep the connection open, the router lags and becomes unusable to anyone currently using the web interface."
CategoryIX_IoTDeviceTypes.xlsx,dlink,CVE-2021-21266,6.4,MEDIUM,CWE-611,CWE-611,"openHAB is a vendor and technology agnostic open source automation software for your home. In openHAB before versions 2.5.12 and 3.0.1 the XML external entity (XXE) attack allows attackers in the same network as the openHAB instance to retrieve internal information like the content of files from the file system. Responses to SSDP requests can be especially malicious. All add-ons that use SAX or JAXB parsing of externally received XML are potentially subject to this kind of attack. In openHAB, the following add-ons are potentially impacted: AvmFritz, BoseSoundtouch, DenonMarantz, DLinkSmarthome, Enigma2, FmiWeather, FSInternetRadio, Gce, Homematic, HPPrinter, IHC, Insteon, Onkyo, Roku, SamsungTV, Sonos, Roku, Tellstick, TR064, UPnPControl, Vitotronic, Wemo, YamahaReceiver and XPath Tranformation. The vulnerabilities have been fixed in versions 2.5.12 and 3.0.1 by a more strict configuration of the used XML parser."
CategoryIX_IoTDeviceTypes.xlsx,wemo,CVE-2021-21266,6.4,MEDIUM,CWE-611,CWE-611,"openHAB is a vendor and technology agnostic open source automation software for your home. In openHAB before versions 2.5.12 and 3.0.1 the XML external entity (XXE) attack allows attackers in the same network as the openHAB instance to retrieve internal information like the content of files from the file system. Responses to SSDP requests can be especially malicious. All add-ons that use SAX or JAXB parsing of externally received XML are potentially subject to this kind of attack. In openHAB, the following add-ons are potentially impacted: AvmFritz, BoseSoundtouch, DenonMarantz, DLinkSmarthome, Enigma2, FmiWeather, FSInternetRadio, Gce, Homematic, HPPrinter, IHC, Insteon, Onkyo, Roku, SamsungTV, Sonos, Roku, Tellstick, TR064, UPnPControl, Vitotronic, Wemo, YamahaReceiver and XPath Tranformation. The vulnerabilities have been fixed in versions 2.5.12 and 3.0.1 by a more strict configuration of the used XML parser."
CategoryI_SmartHomeDeviceTypes.xlsx,smart device,CVE-2019-11336,8.1,HIGH,CWE-532,CWE-532,"Sony Bravia Smart TV devices allow remote attackers to retrieve the static Wi-Fi password (used when the TV is acting as an access point) by using the Photo Sharing Plus application to execute a backdoor API command, a different vulnerability than CVE-2019-10886."
CategoryI_SmartHomeDeviceTypes.xlsx,smart device,CVE-2019-11889,7.5,HIGH,NVD-CWE-noinfo,NVD-CWE-noinfo,Sony BRAVIA Smart TV devices allow remote attackers to cause a denial of service (device hang) via a crafted web page over HbbTV.
CategoryI_SmartHomeDeviceTypes.xlsx,smart device,CVE-2019-11890,7.5,HIGH,CWE-400,CWE-400,Sony Bravia Smart TV devices allow remote attackers to cause a denial of service (device hang or reboot) via a SYN flood attack over a wired or Wi-Fi LAN.
CategoryI_SmartHomeDeviceTypes.xlsx,smart device,CVE-2025-55971,4.7,MEDIUM,CWE-918,CWE-918,"TCL 65C655 Smart TV, running firmware version V8-R75PT01-LF1V269.001116 (Android TV, Kernel 5.4.242+), is vulnerable to a blind, unauthenticated Server-Side Request Forgery (SSRF) vulnerability via the UPnP MediaRenderer service (AVTransport:1). The device accepts unauthenticated SetAVTransportURI SOAP requests over TCP/16398 and attempts to retrieve externally referenced URIs, including attacker-controlled payloads. The blind SSRF allows for sending requests on behalf of the TV, which can be leveraged to probe for other internal or external services accessible by the device (e.g., 127.0.0.1:16XXX, LAN services, or internet targets), potentially enabling additional exploit chains."
CategoryI_SmartHomeDeviceTypes.xlsx,smart device,CVE-2025-55972,7.5,HIGH,CWE-400,CWE-400,"A TCL Smart TV running a vulnerable UPnP/DLNA MediaRenderer implementation is affected by a remote, unauthenticated Denial of Service (DoS) condition. By sending a flood of malformed or oversized SetAVTransportURI SOAP requests to the UPnP control endpoint, an attacker can cause the device to become unresponsive. This denial persists as long as the attack continues and affects all forms of TV operation. Manual user control and even reboots do not restore functionality unless the flood stops."
CategoryI_SmartHomeDeviceTypes.xlsx,set-top box,CVE-2017-9493,6.3,MEDIUM,NVD-CWE-noinfo,NVD-CWE-noinfo,The Comcast firmware on Motorola MX011ANM (firmware version MX011AN_2.9p6s1_PROD_sey) devices allows remote attackers to conduct successful forced-pairing attacks (between an RF4CE remote and a set-top box) by repeatedly transmitting the same pairing code.
CategoryI_SmartHomeDeviceTypes.xlsx,set-top box,CVE-2017-9497,6.8,MEDIUM,CWE-20,CWE-20,"The Comcast firmware on Motorola MX011ANM (firmware version MX011AN_2.9p6s1_PROD_sey) devices allows physically proximate attackers to execute arbitrary commands as root by pulling up the diagnostics menu on the set-top box, and then posting to a Web Inspector route."
CategoryI_SmartHomeDeviceTypes.xlsx,set-top box,CVE-2017-6631,7.5,HIGH,CWE-399,CWE-399,"A vulnerability in the HTTP remote procedure call (RPC) service of set-top box (STB) receivers manufactured by Cisco for Yes could allow an unauthenticated, remote attacker to cause a denial of service (DoS) condition on an affected device. The vulnerability exists because the firmware of an affected device fails to handle certain XML values that are passed to the HTTP RPC service listening on the local subnet of the device. An attacker could exploit this vulnerability by submitting a malformed request to an affected device. A successful attack could cause the affected device to restart, resulting in a DoS condition. Yes has updated the affected devices with firmware that addresses this vulnerability. Customers are not required to take action. Vulnerable Products: This vulnerability affects YesMaxTotal, YesMax HD, and YesQuattro STB devices. Cisco Bug IDs: CSCvd08812."
CategoryI_SmartHomeDeviceTypes.xlsx,set-top box,CVE-2017-9333,8.8,HIGH,CWE-20,CWE-20,"OpenWebif 1.2.5 allows remote code execution via a URL to the CallOPKG function in the IpkgController class in plugin/controllers/ipkg.py, when the URL refers to an attacker-controlled web site with a Trojan horse package. This has security implications in cases where untrusted users can trigger CallOPKG calls, and these users can enter an arbitrary URL in an input field, even though that input field was only intended for a package name. This threat model may be relevant in the latest versions of third-party products that bundle OpenWebif, i.e., set-top box products. The issue of Trojan horse packages does NOT have security implications in cases where the attacker has full OpenWebif access."
CategoryI_SmartHomeDeviceTypes.xlsx,set-top box,CVE-2017-12318,7.5,HIGH,CWE-399,CWE-399,"A vulnerability in the TCP state machine of Cisco RF Gateway 1 devices could allow an unauthenticated, remote attacker to prevent an affected device from delivering switched digital video (SDV) or video on demand (VoD) streams, resulting in a denial of service (DoS) condition. The vulnerability is due to a processing error with TCP connections to the affected device. An attacker could exploit this vulnerability by establishing a large number of TCP connections to an affected device and not actively closing those TCP connections. A successful exploit could allow the attacker to prevent the affected device from delivering SDV or VoD streams to set-top boxes. Cisco Bug IDs: CSCvf19887."
CategoryI_SmartHomeDeviceTypes.xlsx,set-top box,CVE-2020-11617,5.9,MEDIUM,CWE-295,CWE-295,"The RSS application on THOMSON THT741FTA 2.2.1 and Philips DTR3502BFTA DVB-T2 2.2.1 set-top boxes doesn't validate the SSL certificates of RSS servers, which allows a man-in-the-middle attacker to modify the data delivered to the client."
CategoryI_SmartHomeDeviceTypes.xlsx,set-top box,CVE-2020-11618,7.8,HIGH,NVD-CWE-noinfo,NVD-CWE-noinfo,"THOMSON THT741FTA 2.2.1 and Philips DTR3502BFTA DVB-T2 2.2.1 set-top boxes have their TELNET service hardcoded to start on boot, which allows an attacker on the local network to achieve root access via the TELNET protocol."
CategoryI_SmartHomeDeviceTypes.xlsx,set-top box,CVE-2020-7842,6.4,MEDIUM,CWE-20,CWE-20,Improper Input validation vulnerability exists in Netis Korea D'live AP which could cause arbitrary command injection and execution when the time setting (using ntpServerlp1 parameter) for the users. This affects D'live set-top box AP(WF2429TB) v1.1.10.
CategoryI_SmartHomeDeviceTypes.xlsx,set-top box,CVE-2021-41873,10.0,CRITICAL,NVD-CWE-noinfo,NVD-CWE-noinfo,Penguin Aurora TV Box 41502 is a high-end network HD set-top box produced by Tencent Video and Skyworth Digital. An unauthorized access vulnerability exists in the Penguin Aurora Box. An attacker can use the vulnerability to gain unauthorized access to a specific link to remotely control the TV.
CategoryI_SmartHomeDeviceTypes.xlsx,smart TV,CVE-2015-5729,9.8,CRITICAL,CWE-200,CWE-200,"The Soft Access Point (AP) feature in Samsung Smart TVs X10P, X12, X14H, X14J, and NT14U and Xpress M288OFW printers generate weak WPA2 PSK keys, which makes it easier for remote attackers to obtain sensitive information or bypass authentication via a brute-force attack."
CategoryI_SmartHomeDeviceTypes.xlsx,smart TV,CVE-2019-11336,8.1,HIGH,CWE-532,CWE-532,"Sony Bravia Smart TV devices allow remote attackers to retrieve the static Wi-Fi password (used when the TV is acting as an access point) by using the Photo Sharing Plus application to execute a backdoor API command, a different vulnerability than CVE-2019-10886."
CategoryI_SmartHomeDeviceTypes.xlsx,smart TV,CVE-2019-11889,7.5,HIGH,NVD-CWE-noinfo,NVD-CWE-noinfo,Sony BRAVIA Smart TV devices allow remote attackers to cause a denial of service (device hang) via a crafted web page over HbbTV.
CategoryI_SmartHomeDeviceTypes.xlsx,smart TV,CVE-2019-11890,7.5,HIGH,CWE-400,CWE-400,Sony Bravia Smart TV devices allow remote attackers to cause a denial of service (device hang or reboot) via a SYN flood attack over a wired or Wi-Fi LAN.
CategoryI_SmartHomeDeviceTypes.xlsx,smart TV,CVE-2023-41270,3.5,LOW,CWE-307,CWE-307,Improper Restriction of Excessive Authentication Attempts vulnerability in Samsung Smart TV UE40D7000 version T-GAPDEUC-1033.2 and before allows attackers to cause a denial of service via WPS attack tools.
CategoryI_SmartHomeDeviceTypes.xlsx,smart TV,CVE-2025-55971,4.7,MEDIUM,CWE-918,CWE-918,"TCL 65C655 Smart TV, running firmware version V8-R75PT01-LF1V269.001116 (Android TV, Kernel 5.4.242+), is vulnerable to a blind, unauthenticated Server-Side Request Forgery (SSRF) vulnerability via the UPnP MediaRenderer service (AVTransport:1). The device accepts unauthenticated SetAVTransportURI SOAP requests over TCP/16398 and attempts to retrieve externally referenced URIs, including attacker-controlled payloads. The blind SSRF allows for sending requests on behalf of the TV, which can be leveraged to probe for other internal or external services accessible by the device (e.g., 127.0.0.1:16XXX, LAN services, or internet targets), potentially enabling additional exploit chains."
CategoryI_SmartHomeDeviceTypes.xlsx,smart TV,CVE-2025-55972,7.5,HIGH,CWE-400,CWE-400,"A TCL Smart TV running a vulnerable UPnP/DLNA MediaRenderer implementation is affected by a remote, unauthenticated Denial of Service (DoS) condition. By sending a flood of malformed or oversized SetAVTransportURI SOAP requests to the UPnP control endpoint, an attacker can cause the device to become unresponsive. This denial persists as long as the attack continues and affects all forms of TV operation. Manual user control and even reboots do not restore functionality unless the flood stops."
CategoryVIII_ProtocolDeviceTypes.xlsx,home automation,CVE-2021-21266,6.4,MEDIUM,CWE-611,CWE-611,"openHAB is a vendor and technology agnostic open source automation software for your home. In openHAB before versions 2.5.12 and 3.0.1 the XML external entity (XXE) attack allows attackers in the same network as the openHAB instance to retrieve internal information like the content of files from the file system. Responses to SSDP requests can be especially malicious. All add-ons that use SAX or JAXB parsing of externally received XML are potentially subject to this kind of attack. In openHAB, the following add-ons are potentially impacted: AvmFritz, BoseSoundtouch, DenonMarantz, DLinkSmarthome, Enigma2, FmiWeather, FSInternetRadio, Gce, Homematic, HPPrinter, IHC, Insteon, Onkyo, Roku, SamsungTV, Sonos, Roku, Tellstick, TR064, UPnPControl, Vitotronic, Wemo, YamahaReceiver and XPath Tranformation. The vulnerabilities have been fixed in versions 2.5.12 and 3.0.1 by a more strict configuration of the used XML parser."
CategoryVI_ApplianceDeviceTypes.xlsx,smart ac,CVE-2015-5729,9.8,CRITICAL,CWE-200,CWE-200,"The Soft Access Point (AP) feature in Samsung Smart TVs X10P, X12, X14H, X14J, and NT14U and Xpress M288OFW printers generate weak WPA2 PSK keys, which makes it easier for remote attackers to obtain sensitive information or bypass authentication via a brute-force attack."
CategoryVI_ApplianceDeviceTypes.xlsx,smart ac,CVE-2019-11336,8.1,HIGH,CWE-532,CWE-532,"Sony Bravia Smart TV devices allow remote attackers to retrieve the static Wi-Fi password (used when the TV is acting as an access point) by using the Photo Sharing Plus application to execute a backdoor API command, a different vulnerability than CVE-2019-10886."
CategoryVI_ApplianceDeviceTypes.xlsx,smart ac,CVE-2025-55971,4.7,MEDIUM,CWE-918,CWE-918,"TCL 65C655 Smart TV, running firmware version V8-R75PT01-LF1V269.001116 (Android TV, Kernel 5.4.242+), is vulnerable to a blind, unauthenticated Server-Side Request Forgery (SSRF) vulnerability via the UPnP MediaRenderer service (AVTransport:1). The device accepts unauthenticated SetAVTransportURI SOAP requests over TCP/16398 and attempts to retrieve externally referenced URIs, including attacker-controlled payloads. The blind SSRF allows for sending requests on behalf of the TV, which can be leveraged to probe for other internal or external services accessible by the device (e.g., 127.0.0.1:16XXX, LAN services, or internet targets), potentially enabling additional exploit chains."
