Difference Type,cve_id,published,description,cvss_score,cvss_version,cwe_ids,cpe_strings,Codex Judgment,Codex Confidence,Codex Reasoning
keyword_only,CVE-2024-43661,2025-01-09,"The <redacted>.so library, which is used by <redacted>, is
vulnerable to a buffer overflow in the code that handles the deletion
of certificates. This buffer overflow can be triggered by providing a
long file path to the <redacted> action of the <redacted>.exe CGI binary or
to the <redacted>.sh CGI script. This binary or script will write this
file path to <redacted>, which is then
read by <redacted>.so


This issue affects Iocharger firmware for AC models before version 24120701.

Likelihood: Moderate – An attacker will have to find this exploit by
either obtaining the binaries involved in this vulnerability, or by trial
and error. Furthermore, the attacker will need a (low privilege)
account to gain access to the <redacted>.exe CGI binary or <redacted>.sh
script to trigger the vulnerability, or convince a user with such access
send an HTTP request that triggers it.


Impact: High – The <redacted> process, which we assume is
responsible for OCPP communication, will keep crashing after
performing the exploit. This happens because the buffer overflow
causes the process to segfault before
<redacted> is removed. This means that,
even though <redacted> is automatically restarted, it will crash
again as soon as it tries to parse the text file.

CVSS clarification. The attack can be executed over any network connection the station is listening to and serves the web interface (AV:N), and there are no additional security measure sin place that need to be circumvented (AC:L), the attack does not rely on preconditions (AT:N). The attack does require authentication, but the level of authentication is irrelevant (PR:L), it does not require user interaction (UI:N). The attack leads to reducred availability of the device (VC:N/VI:N/VA:H). THere is not impact on subsequent systems. (SC:N/SI:N/SA:N). Alltough this device is an EV charger handing significant amounts of power, we do not forsee a safety impact. The attack can be automated (AU:Y). Because the DoS condition is written to disk persistantly, it cannot be recovered by the user (R:I).",9.8,3.1,CWE-121,,Yes,High,
keyword_only,CVE-2024-43662,2025-01-09,"The <redacted>.exe or <redacted>.exe CGI binary can be used to upload arbitrary files to /tmp/upload/ or /tmp/ respectively as any user, although the user interface for uploading files is only shown to the iocadmin user.

This issue affects Iocharger firmware for AC models before version 24120701.

Likelihood: Moderate – An attacker will need to have knowledge of this CGI binary, e.g. by finding it in firmware. Furthermore, the attacker will need a (low privilege) account to gain access to the <redacted>.exe or <redacted>.exe CGI binary and upload the file, or convince a user with such access to upload it.

Impact: Low – The attacker can upload arbitrary files to /tmp/upload/ or /tmp/. However, the attacker is unable to access or use these files without other vulnerabilities.

CVSS clarification. The attack can be executed over any network connection the station is listening to and serves the web interface (AV:N), and there are no additional security measure sin place that need to be circumvented (AC:L), the attack does not rely on preconditions (AT:N). The attack does require authentication, but the level of authentication is irrelevant (PR:L), it does not require user interaction (UI:N). Artitrary files can be uploaded, be these files will not be in a location where they can influence confidentiality or availability and have a minimal impact on device integrity (VC:N/VI:L/VA:N).  There is no impact on subsequent systems. (SC:N/SI:N/SA:N). While this device is an EV charger handing significant amounts of power, we do not expect this vulnerability to have a safety impact. The attack can be automated (AU:Y).",,,CWE-434|CWE-862,,Yes,High,
keyword_only,CVE-2024-43663,2025-01-09,"There are many buffer overflow vulnerabilities present in several CGI binaries of the charging station.This issue affects Iocharger firmware for AC model chargers beforeversion 24120701.

Likelihood: High – Given the prevalence of these buffer overflows, and the clear error message of the web server, an attacker is very likely to be able to find these vulnerabilities.

Impact: Low – Usually, overflowing one of these buffers just causes a segmentation fault of the CGI binary, which causes the web server to return a 502 Bad Gateway error. However the webserver itself is not affected, and no DoS can be achieved. Abusing these buffer overflows in a meaningful way requires highly technical knowledge, especially since ASLR also seems to be enabled on the charging station. However, a skilled attacker might be able to use one of these buffer overflows to obtain remote code execution.

CVSS clarification. The attack can be executed over any network connection the station is listening to and serves the web interface (AV:N), and there are no additional security measure sin place that need to be circumvented (AC:L), the attack does not rely on preconditions (AT:N). The attack does require authentication, but the level of authentication is irrelevant (PR:L), it does not require user interaction (UI:N). The attack has a small impact on the availability of the device (VC:N/VI:N/VA:L).  There is no impact on subsequent systems. (SC:N/SI:N/SA:N). While this device is an EV charger handing significant amounts of power, we do not expect  this vulnerability to have a safety impact. The attack can be automated (AU:Y).",9.8,3.1,CWE-121,,Yes,High,
keyword_only,CVE-2025-3881,2025-05-22,"eCharge Hardy Barth cPH2 check_req.php ntp Command Injection Remote Code Execution Vulnerability. This vulnerability allows network-adjacent attackers to execute arbitrary code on affected installations of eCharge Hardy Barth cPH2 charging stations. Authentication is not required to exploit this vulnerability.

The specific flaw exists within the handling of the ntp parameter provided to the check_req.php endpoint. The issue results from the lack of proper validation of a user-supplied string before using it to execute a system call. An attacker can leverage this vulnerability to execute code in the context of the www-data user. Was ZDI-CAN-23113.",8.8,3.0,CWE-78,cpe:2.3:o:hardy-barth:cph2_echarge_firmware:2.0.4:*:*:*:*:*:*:*|cpe:2.3:h:hardy-barth:cph2_echarge:-:*:*:*:*:*:*:*,,,
keyword_only,CVE-2025-3882,2025-05-22,"eCharge Hardy Barth cPH2 nwcheckexec.php dest Command Injection Remote Code Execution Vulnerability. This vulnerability allows network-adjacent attackers to execute arbitrary code on affected installations of eCharge Hardy Barth cPH2 charging stations. Authentication is not required to exploit this vulnerability.

The specific flaw exists within the handling of the dest parameter provided to the nwcheckexec.php endpoint. The issue results from the lack of proper validation of a user-supplied string before using it to execute a system call. An attacker can leverage this vulnerability to execute code in the context of the www-data user. Was ZDI-CAN-23114.",8.8,3.0,CWE-78,cpe:2.3:o:hardy-barth:cph2_echarge_firmware:2.0.4:*:*:*:*:*:*:*|cpe:2.3:h:hardy-barth:cph2_echarge:-:*:*:*:*:*:*:*,,,
keyword_only,CVE-2025-3883,2025-05-22,"eCharge Hardy Barth cPH2 index.php Command Injection Remote Code Execution Vulnerability. This vulnerability allows network-adjacent attackers to execute arbitrary code on affected installations of eCharge Hardy Barth cPH2 charging stations. Authentication is not required to exploit this vulnerability.

The specific flaw exists within the handling of GET parameters provided to the index.php endpoint. The issue results from the lack of proper validation of a user-supplied string before using it to execute a system call. An attacker can leverage this vulnerability to execute code in the context of the www-data user. Was ZDI-CAN-23115.",8.8,3.0,CWE-78,cpe:2.3:o:hardy-barth:cph2_echarge_firmware:2.0.4:*:*:*:*:*:*:*|cpe:2.3:h:hardy-barth:cph2_echarge:-:*:*:*:*:*:*:*,,,
keyword_only,CVE-2025-5741,2025-06-10,"CWE-22: Improper Limitation of a Pathname to a Restricted Directory ('Path Traversal') vulnerability exists that
could cause arbitrary file reads from the charging station. The exploitation of this vulnerability does require an
authenticated session of the web server.",4.9,3.1,CWE-22,,,,
keyword_only,CVE-2025-5743,2025-06-10,"CWE-78: Improper Neutralization of Special Elements used in an OS Command ('OS Command Injection')
vulnerability exists that could cause remote control over the charging station when an authenticated user
modifies configuration parameters on the web server.",5.5,3.1,CWE-78,,,,
keyword_only,CVE-2025-5822,2025-06-25,"Autel MaxiCharger AC Wallbox Commercial Technician API Incorrect Authorization Privilege Escalation Vulnerability. This vulnerability allows remote attackers to escalate privileges on affected installations of Autel MaxiCharger AC Wallbox Commercial charging stations. An attacker must first obtain a low-privileged authorization token in order to exploit this vulnerability.

The specific flaw exists within the implementation of the Autel Technician API. The issue results from incorrect authorization. An attacker can leverage this vulnerability to escalate privileges to resources normally protected from the user. Was ZDI-CAN-26325.",8.8,3.1,CWE-863,cpe:2.3:o:autel:maxicharger_ac_elite_business_c50_firmware:*:*:*:*:*:*:*:american_standard|cpe:2.3:o:autel:maxicharger_ac_elite_business_c50_firmware:*:*:*:*:*:*:*:european_standard|cpe:2.3:h:autel:maxicharger_ac_elite_business_c50:-:*:*:*:*:*:*:*|cpe:2.3:o:autel:maxicharger_ac_pro_firmware:*:*:*:*:*:*:*:american_standard|cpe:2.3:o:autel:maxicharger_ac_pro_firmware:*:*:*:*:*:*:*:european_standard|cpe:2.3:h:autel:maxicharger_ac_pro:-:*:*:*:*:*:*:*|cpe:2.3:o:autel:maxicharger_ac_ultra_firmware:*:*:*:*:*:*:*:american_standard|cpe:2.3:o:autel:maxicharger_ac_ultra_firmware:*:*:*:*:*:*:*:european_standard|cpe:2.3:h:autel:maxicharger_ac_ultra:-:*:*:*:*:*:*:*|cpe:2.3:o:autel:maxicharger_dc_compact_mobile_firmware:*:*:*:*:*:*:*:american_standard|cpe:2.3:o:autel:maxicharger_dc_compact_mobile_firmware:*:*:*:*:*:*:*:european_standard|cpe:2.3:h:autel:maxicharger_dc_compact_mobile:-:*:*:*:*:*:*:*|cpe:2.3:o:autel:maxicharger_dc_compact_pedestal_firmware:*:*:*:*:*:*:*:american_standard|cpe:2.3:o:autel:maxicharger_dc_compact_pedestal_firmware:*:*:*:*:*:*:*:european_standard|cpe:2.3:h:autel:maxicharger_dc_compact_pedestal:-:*:*:*:*:*:*:*|cpe:2.3:o:autel:maxicharger_dc_fast_firmware:*:*:*:*:*:*:*:american_standard|cpe:2.3:o:autel:maxicharger_dc_fast_firmware:*:*:*:*:*:*:*:european_standard|cpe:2.3:h:autel:maxicharger_dc_fast:-:*:*:*:*:*:*:*|cpe:2.3:o:autel:maxicharger_dc_hipower_firmware:*:*:*:*:*:*:*:american_standard|cpe:2.3:o:autel:maxicharger_dc_hipower_firmware:*:*:*:*:*:*:*:european_standard|cpe:2.3:h:autel:maxicharger_dc_hipower:-:*:*:*:*:*:*:*|cpe:2.3:o:autel:maxicharger_dh480_firmware:*:*:*:*:*:*:*:american_standard|cpe:2.3:o:autel:maxicharger_dh480_firmware:*:*:*:*:*:*:*:european_standard|cpe:2.3:h:autel:maxicharger_dh480:-:*:*:*:*:*:*:*|cpe:2.3:o:autel:maxicharger_single_charger_firmware:*:*:*:*:*:*:*:american_standard|cpe:2.3:o:autel:maxicharger_single_charger_firmware:*:*:*:*:*:*:*:european_standard|cpe:2.3:h:autel:maxicharger_single_charger:-:*:*:*:*:*:*:*,,,
keyword_only,CVE-2025-5823,2025-06-25,"Autel MaxiCharger AC Wallbox Commercial Serial Number Exposed Dangerous Method Information Disclosure Vulnerability. This vulnerability allows remote attackers to disclose sensitive information on affected installations of Autel MaxiCharger AC Wallbox Commercial EV chargers. Authentication is required to exploit this vulnerability.

The specific flaw exists within the implementation of the Autel Technician API. The issue results from an exposed dangerous method. An attacker can leverage this vulnerability to disclose credentials, leading to further compromise. Was ZDI-CAN-26351.",6.5,3.1,CWE-749,cpe:2.3:o:autel:maxicharger_ac_elite_business_c50_firmware:*:*:*:*:*:*:*:american_standard|cpe:2.3:o:autel:maxicharger_ac_elite_business_c50_firmware:*:*:*:*:*:*:*:european_standard|cpe:2.3:h:autel:maxicharger_ac_elite_business_c50:-:*:*:*:*:*:*:*|cpe:2.3:o:autel:maxicharger_ac_pro_firmware:*:*:*:*:*:*:*:american_standard|cpe:2.3:o:autel:maxicharger_ac_pro_firmware:*:*:*:*:*:*:*:european_standard|cpe:2.3:h:autel:maxicharger_ac_pro:-:*:*:*:*:*:*:*|cpe:2.3:o:autel:maxicharger_ac_ultra_firmware:*:*:*:*:*:*:*:american_standard|cpe:2.3:o:autel:maxicharger_ac_ultra_firmware:*:*:*:*:*:*:*:european_standard|cpe:2.3:h:autel:maxicharger_ac_ultra:-:*:*:*:*:*:*:*|cpe:2.3:o:autel:maxicharger_dc_compact_mobile_firmware:*:*:*:*:*:*:*:american_standard|cpe:2.3:o:autel:maxicharger_dc_compact_mobile_firmware:*:*:*:*:*:*:*:european_standard|cpe:2.3:h:autel:maxicharger_dc_compact_mobile:-:*:*:*:*:*:*:*|cpe:2.3:o:autel:maxicharger_dc_compact_pedestal_firmware:*:*:*:*:*:*:*:american_standard|cpe:2.3:o:autel:maxicharger_dc_compact_pedestal_firmware:*:*:*:*:*:*:*:european_standard|cpe:2.3:h:autel:maxicharger_dc_compact_pedestal:-:*:*:*:*:*:*:*|cpe:2.3:o:autel:maxicharger_dc_fast_firmware:*:*:*:*:*:*:*:american_standard|cpe:2.3:o:autel:maxicharger_dc_fast_firmware:*:*:*:*:*:*:*:european_standard|cpe:2.3:h:autel:maxicharger_dc_fast:-:*:*:*:*:*:*:*|cpe:2.3:o:autel:maxicharger_dc_hipower_firmware:*:*:*:*:*:*:*:american_standard|cpe:2.3:o:autel:maxicharger_dc_hipower_firmware:*:*:*:*:*:*:*:european_standard|cpe:2.3:h:autel:maxicharger_dc_hipower:-:*:*:*:*:*:*:*|cpe:2.3:o:autel:maxicharger_dh480_firmware:*:*:*:*:*:*:*:american_standard|cpe:2.3:o:autel:maxicharger_dh480_firmware:*:*:*:*:*:*:*:european_standard|cpe:2.3:h:autel:maxicharger_dh480:-:*:*:*:*:*:*:*|cpe:2.3:o:autel:maxicharger_single_charger_firmware:*:*:*:*:*:*:*:american_standard|cpe:2.3:o:autel:maxicharger_single_charger_firmware:*:*:*:*:*:*:*:european_standard|cpe:2.3:h:autel:maxicharger_single_charger:-:*:*:*:*:*:*:*,Yes,High,
keyword_only,CVE-2025-5824,2025-06-25,"Autel MaxiCharger AC Wallbox Commercial Origin Validation Error Authentication Bypass Vulnerability. This vulnerability allows network-adjacent attackers to bypass authentication on affected installations of Autel MaxiCharger AC Wallbox Commercial. An attacker must first obtain the ability to pair a malicious Bluetooth device with the target system in order to exploit this vulnerability.

The specific flaw exists within the handling of bluetooth pairing requests. The issue results from insufficient validation of the origin of commands. An attacker can leverage this vulnerability to bypass authentication on the system. Was ZDI-CAN-26353.",7.5,3.1,CWE-346,cpe:2.3:o:autel:maxicharger_ac_elite_business_c50_firmware:*:*:*:*:*:*:*:american_standard|cpe:2.3:o:autel:maxicharger_ac_elite_business_c50_firmware:*:*:*:*:*:*:*:european_standard|cpe:2.3:h:autel:maxicharger_ac_elite_business_c50:-:*:*:*:*:*:*:*|cpe:2.3:o:autel:maxicharger_ac_pro_firmware:*:*:*:*:*:*:*:american_standard|cpe:2.3:o:autel:maxicharger_ac_pro_firmware:*:*:*:*:*:*:*:european_standard|cpe:2.3:h:autel:maxicharger_ac_pro:-:*:*:*:*:*:*:*|cpe:2.3:o:autel:maxicharger_ac_ultra_firmware:*:*:*:*:*:*:*:american_standard|cpe:2.3:o:autel:maxicharger_ac_ultra_firmware:*:*:*:*:*:*:*:european_standard|cpe:2.3:h:autel:maxicharger_ac_ultra:-:*:*:*:*:*:*:*|cpe:2.3:o:autel:maxicharger_dc_compact_mobile_firmware:*:*:*:*:*:*:*:american_standard|cpe:2.3:o:autel:maxicharger_dc_compact_mobile_firmware:*:*:*:*:*:*:*:european_standard|cpe:2.3:h:autel:maxicharger_dc_compact_mobile:-:*:*:*:*:*:*:*|cpe:2.3:o:autel:maxicharger_dc_compact_pedestal_firmware:*:*:*:*:*:*:*:american_standard|cpe:2.3:o:autel:maxicharger_dc_compact_pedestal_firmware:*:*:*:*:*:*:*:european_standard|cpe:2.3:h:autel:maxicharger_dc_compact_pedestal:-:*:*:*:*:*:*:*|cpe:2.3:o:autel:maxicharger_dc_fast_firmware:*:*:*:*:*:*:*:american_standard|cpe:2.3:o:autel:maxicharger_dc_fast_firmware:*:*:*:*:*:*:*:european_standard|cpe:2.3:h:autel:maxicharger_dc_fast:-:*:*:*:*:*:*:*|cpe:2.3:o:autel:maxicharger_dc_hipower_firmware:*:*:*:*:*:*:*:american_standard|cpe:2.3:o:autel:maxicharger_dc_hipower_firmware:*:*:*:*:*:*:*:european_standard|cpe:2.3:h:autel:maxicharger_dc_hipower:-:*:*:*:*:*:*:*|cpe:2.3:o:autel:maxicharger_dh480_firmware:*:*:*:*:*:*:*:american_standard|cpe:2.3:o:autel:maxicharger_dh480_firmware:*:*:*:*:*:*:*:european_standard|cpe:2.3:h:autel:maxicharger_dh480:-:*:*:*:*:*:*:*|cpe:2.3:o:autel:maxicharger_single_charger_firmware:*:*:*:*:*:*:*:american_standard|cpe:2.3:o:autel:maxicharger_single_charger_firmware:*:*:*:*:*:*:*:european_standard|cpe:2.3:h:autel:maxicharger_single_charger:-:*:*:*:*:*:*:*,,,
keyword_only,CVE-2025-5825,2025-06-25,"Autel MaxiCharger AC Wallbox Commercial Firmware Downgrade Remote Code Execution Vulnerability. This vulnerability allows network-adjacent attackers to execute arbitrary code on affected installations of Autel MaxiCharger AC Wallbox Commercial charging stations. An attacker must first obtain the ability to pair a malicious Bluetooth device with the target system in order to exploit this vulnerability.

The specific flaw exists within the firmware update process. The issue results from the lack of proper validation of a firmware image before using it to perform an upgrade. An attacker can leverage this in conjunction with other vulnerabilities to execute arbitrary code in the context of the device. Was ZDI-CAN-26354.",7.5,3.0,CWE-1328,cpe:2.3:o:autel:maxicharger_ac_elite_business_c50_firmware:*:*:*:*:*:*:*:american_standard|cpe:2.3:o:autel:maxicharger_ac_elite_business_c50_firmware:*:*:*:*:*:*:*:european_standard|cpe:2.3:h:autel:maxicharger_ac_elite_business_c50:-:*:*:*:*:*:*:*|cpe:2.3:o:autel:maxicharger_ac_pro_firmware:*:*:*:*:*:*:*:american_standard|cpe:2.3:o:autel:maxicharger_ac_pro_firmware:*:*:*:*:*:*:*:european_standard|cpe:2.3:h:autel:maxicharger_ac_pro:-:*:*:*:*:*:*:*|cpe:2.3:o:autel:maxicharger_ac_ultra_firmware:*:*:*:*:*:*:*:american_standard|cpe:2.3:o:autel:maxicharger_ac_ultra_firmware:*:*:*:*:*:*:*:european_standard|cpe:2.3:h:autel:maxicharger_ac_ultra:-:*:*:*:*:*:*:*|cpe:2.3:o:autel:maxicharger_dc_compact_mobile_firmware:*:*:*:*:*:*:*:american_standard|cpe:2.3:o:autel:maxicharger_dc_compact_mobile_firmware:*:*:*:*:*:*:*:european_standard|cpe:2.3:h:autel:maxicharger_dc_compact_mobile:-:*:*:*:*:*:*:*|cpe:2.3:o:autel:maxicharger_dc_compact_pedestal_firmware:*:*:*:*:*:*:*:american_standard|cpe:2.3:o:autel:maxicharger_dc_compact_pedestal_firmware:*:*:*:*:*:*:*:european_standard|cpe:2.3:h:autel:maxicharger_dc_compact_pedestal:-:*:*:*:*:*:*:*|cpe:2.3:o:autel:maxicharger_dc_fast_firmware:*:*:*:*:*:*:*:american_standard|cpe:2.3:o:autel:maxicharger_dc_fast_firmware:*:*:*:*:*:*:*:european_standard|cpe:2.3:h:autel:maxicharger_dc_fast:-:*:*:*:*:*:*:*|cpe:2.3:o:autel:maxicharger_dc_hipower_firmware:*:*:*:*:*:*:*:american_standard|cpe:2.3:o:autel:maxicharger_dc_hipower_firmware:*:*:*:*:*:*:*:european_standard|cpe:2.3:h:autel:maxicharger_dc_hipower:-:*:*:*:*:*:*:*|cpe:2.3:o:autel:maxicharger_dh480_firmware:*:*:*:*:*:*:*:american_standard|cpe:2.3:o:autel:maxicharger_dh480_firmware:*:*:*:*:*:*:*:european_standard|cpe:2.3:h:autel:maxicharger_dh480:-:*:*:*:*:*:*:*|cpe:2.3:o:autel:maxicharger_single_charger_firmware:*:*:*:*:*:*:*:american_standard|cpe:2.3:o:autel:maxicharger_single_charger_firmware:*:*:*:*:*:*:*:european_standard|cpe:2.3:h:autel:maxicharger_single_charger:-:*:*:*:*:*:*:*,,,
keyword_only,CVE-2025-5826,2025-06-25,"Autel MaxiCharger AC Wallbox Commercial ble_process_esp32_msg Misinterpretation of Input Vulnerability. This vulnerability allows network-adjacent attackers to inject arbitrary AT commands on affected installations of Autel MaxiCharger AC Wallbox Commercial charging stations. Authentication is not required to exploit this vulnerability.

The specific flaw exists within the ble_process_esp32_msg function. The issue results from misinterpretation of input data. An attacker can leverage this vulnerability to execute AT commands in the context of the device. Was ZDI-CAN-26368.",6.3,3.0,CWE-115,cpe:2.3:o:autel:maxicharger_ac_elite_business_c50_firmware:*:*:*:*:*:*:*:american_standard|cpe:2.3:o:autel:maxicharger_ac_elite_business_c50_firmware:*:*:*:*:*:*:*:european_standard|cpe:2.3:h:autel:maxicharger_ac_elite_business_c50:-:*:*:*:*:*:*:*|cpe:2.3:o:autel:maxicharger_ac_pro_firmware:*:*:*:*:*:*:*:american_standard|cpe:2.3:o:autel:maxicharger_ac_pro_firmware:*:*:*:*:*:*:*:european_standard|cpe:2.3:h:autel:maxicharger_ac_pro:-:*:*:*:*:*:*:*|cpe:2.3:o:autel:maxicharger_ac_ultra_firmware:*:*:*:*:*:*:*:american_standard|cpe:2.3:o:autel:maxicharger_ac_ultra_firmware:*:*:*:*:*:*:*:european_standard|cpe:2.3:h:autel:maxicharger_ac_ultra:-:*:*:*:*:*:*:*|cpe:2.3:o:autel:maxicharger_dc_compact_mobile_firmware:*:*:*:*:*:*:*:american_standard|cpe:2.3:o:autel:maxicharger_dc_compact_mobile_firmware:*:*:*:*:*:*:*:european_standard|cpe:2.3:h:autel:maxicharger_dc_compact_mobile:-:*:*:*:*:*:*:*|cpe:2.3:o:autel:maxicharger_dc_compact_pedestal_firmware:*:*:*:*:*:*:*:american_standard|cpe:2.3:o:autel:maxicharger_dc_compact_pedestal_firmware:*:*:*:*:*:*:*:european_standard|cpe:2.3:h:autel:maxicharger_dc_compact_pedestal:-:*:*:*:*:*:*:*|cpe:2.3:o:autel:maxicharger_dc_fast_firmware:*:*:*:*:*:*:*:american_standard|cpe:2.3:o:autel:maxicharger_dc_fast_firmware:*:*:*:*:*:*:*:european_standard|cpe:2.3:h:autel:maxicharger_dc_fast:-:*:*:*:*:*:*:*|cpe:2.3:o:autel:maxicharger_dc_hipower_firmware:*:*:*:*:*:*:*:american_standard|cpe:2.3:o:autel:maxicharger_dc_hipower_firmware:*:*:*:*:*:*:*:european_standard|cpe:2.3:h:autel:maxicharger_dc_hipower:-:*:*:*:*:*:*:*|cpe:2.3:o:autel:maxicharger_dh480_firmware:*:*:*:*:*:*:*:american_standard|cpe:2.3:o:autel:maxicharger_dh480_firmware:*:*:*:*:*:*:*:european_standard|cpe:2.3:h:autel:maxicharger_dh480:-:*:*:*:*:*:*:*|cpe:2.3:o:autel:maxicharger_single_charger_firmware:*:*:*:*:*:*:*:american_standard|cpe:2.3:o:autel:maxicharger_single_charger_firmware:*:*:*:*:*:*:*:european_standard|cpe:2.3:h:autel:maxicharger_single_charger:-:*:*:*:*:*:*:*,,,
keyword_only,CVE-2025-5827,2025-06-25,"Autel MaxiCharger AC Wallbox Commercial ble_process_esp32_msg Stack-based Buffer Overflow Remote Code Execution Vulnerability. This vulnerability allows network-adjacent attackers to execute arbitrary code on affected installations of Autel MaxiCharger AC Wallbox Commercial EV chargers. Authentication is not required to exploit this vulnerability.

The specific flaw exists within the ble_process_esp32_msg function. The issue results from the lack of proper validation of the length of user-supplied data prior to copying it to a fixed-length stack-based buffer. An attacker can leverage this vulnerability to execute code in the context of the device. Was ZDI-CAN-26369.",8.8,3.0,CWE-121,cpe:2.3:o:autel:maxicharger_ac_elite_business_c50_firmware:*:*:*:*:*:*:*:american_standard|cpe:2.3:o:autel:maxicharger_ac_elite_business_c50_firmware:*:*:*:*:*:*:*:european_standard|cpe:2.3:h:autel:maxicharger_ac_elite_business_c50:-:*:*:*:*:*:*:*|cpe:2.3:o:autel:maxicharger_ac_pro_firmware:*:*:*:*:*:*:*:american_standard|cpe:2.3:o:autel:maxicharger_ac_pro_firmware:*:*:*:*:*:*:*:european_standard|cpe:2.3:h:autel:maxicharger_ac_pro:-:*:*:*:*:*:*:*|cpe:2.3:o:autel:maxicharger_ac_ultra_firmware:*:*:*:*:*:*:*:american_standard|cpe:2.3:o:autel:maxicharger_ac_ultra_firmware:*:*:*:*:*:*:*:european_standard|cpe:2.3:h:autel:maxicharger_ac_ultra:-:*:*:*:*:*:*:*|cpe:2.3:o:autel:maxicharger_dc_compact_mobile_firmware:*:*:*:*:*:*:*:american_standard|cpe:2.3:o:autel:maxicharger_dc_compact_mobile_firmware:*:*:*:*:*:*:*:european_standard|cpe:2.3:h:autel:maxicharger_dc_compact_mobile:-:*:*:*:*:*:*:*|cpe:2.3:o:autel:maxicharger_dc_compact_pedestal_firmware:*:*:*:*:*:*:*:american_standard|cpe:2.3:o:autel:maxicharger_dc_compact_pedestal_firmware:*:*:*:*:*:*:*:european_standard|cpe:2.3:h:autel:maxicharger_dc_compact_pedestal:-:*:*:*:*:*:*:*|cpe:2.3:o:autel:maxicharger_dc_fast_firmware:*:*:*:*:*:*:*:american_standard|cpe:2.3:o:autel:maxicharger_dc_fast_firmware:*:*:*:*:*:*:*:european_standard|cpe:2.3:h:autel:maxicharger_dc_fast:-:*:*:*:*:*:*:*|cpe:2.3:o:autel:maxicharger_dc_hipower_firmware:*:*:*:*:*:*:*:american_standard|cpe:2.3:o:autel:maxicharger_dc_hipower_firmware:*:*:*:*:*:*:*:european_standard|cpe:2.3:h:autel:maxicharger_dc_hipower:-:*:*:*:*:*:*:*|cpe:2.3:o:autel:maxicharger_dh480_firmware:*:*:*:*:*:*:*:american_standard|cpe:2.3:o:autel:maxicharger_dh480_firmware:*:*:*:*:*:*:*:european_standard|cpe:2.3:h:autel:maxicharger_dh480:-:*:*:*:*:*:*:*|cpe:2.3:o:autel:maxicharger_single_charger_firmware:*:*:*:*:*:*:*:american_standard|cpe:2.3:o:autel:maxicharger_single_charger_firmware:*:*:*:*:*:*:*:european_standard|cpe:2.3:h:autel:maxicharger_single_charger:-:*:*:*:*:*:*:*,Yes,High,
