Verdicts,Review Reason,cve_id,description,cpe_strings,Difference Type,published,cvss_score,cvss_version,cwe_ids,Claude Judgment,Claude Confidence,Claude Reasoning,Codex Judgment,Codex Confidence,Codex Reasoning,Gemini Judgment,Gemini Confidence,Gemini Reasoning,Human Verdict,Human Notes
C:Maybe/Low  X:No/High  G:Yes/High,judgments not unanimous,CVE-2018-17878,Buffer Overflow vulnerability in certain ABUS TVIP cameras allows attackers to gain control of the program via crafted string sent to sprintf() function.,cpe:2.3:o:abus:tvip_10000_firmware:-:*:*:*:*:*:*:*|cpe:2.3:h:abus:tvip_10000:-:*:*:*:*:*:*:*|cpe:2.3:o:abus:tvip_10001_firmware:-:*:*:*:*:*:*:*|cpe:2.3:h:abus:tvip_10001:-:*:*:*:*:*:*:*|cpe:2.3:o:abus:tvip_10005_firmware:-:*:*:*:*:*:*:*|cpe:2.3:h:abus:tvip_10005:-:*:*:*:*:*:*:*|cpe:2.3:o:abus:tvip_10005a_firmware:-:*:*:*:*:*:*:*|cpe:2.3:h:abus:tvip_10005a:-:*:*:*:*:*:*:*|cpe:2.3:o:abus:tvip_10005b_firmware:-:*:*:*:*:*:*:*|cpe:2.3:h:abus:tvip_10005b:-:*:*:*:*:*:*:*|cpe:2.3:o:abus:tvip_10050_firmware:-:*:*:*:*:*:*:*|cpe:2.3:h:abus:tvip_10050:-:*:*:*:*:*:*:*|cpe:2.3:o:abus:tvip_10051_firmware:-:*:*:*:*:*:*:*|cpe:2.3:h:abus:tvip_10051:-:*:*:*:*:*:*:*|cpe:2.3:o:abus:tvip_10055a_firmware:-:*:*:*:*:*:*:*|cpe:2.3:h:abus:tvip_10055a:-:*:*:*:*:*:*:*|cpe:2.3:o:abus:tvip_10055b_firmware:-:*:*:*:*:*:*:*|cpe:2.3:h:abus:tvip_10055b:-:*:*:*:*:*:*:*|cpe:2.3:o:abus:tvip_10500_firmware:-:*:*:*:*:*:*:*|cpe:2.3:h:abus:tvip_10500:-:*:*:*:*:*:*:*|cpe:2.3:o:abus:tvip_10550_firmware:-:*:*:*:*:*:*:*|cpe:2.3:h:abus:tvip_10550:-:*:*:*:*:*:*:*|cpe:2.3:o:abus:tvip_11000_firmware:-:*:*:*:*:*:*:*|cpe:2.3:h:abus:tvip_11000:-:*:*:*:*:*:*:*|cpe:2.3:o:abus:tvip_11050_firmware:-:*:*:*:*:*:*:*|cpe:2.3:h:abus:tvip_11050:-:*:*:*:*:*:*:*|cpe:2.3:o:abus:tvip_11500_firmware:-:*:*:*:*:*:*:*|cpe:2.3:h:abus:tvip_11500:-:*:*:*:*:*:*:*|cpe:2.3:o:abus:tvip_11501_firmware:-:*:*:*:*:*:*:*|cpe:2.3:h:abus:tvip_11501:-:*:*:*:*:*:*:*|cpe:2.3:o:abus:tvip_11502_firmware:-:*:*:*:*:*:*:*|cpe:2.3:h:abus:tvip_11502:-:*:*:*:*:*:*:*|cpe:2.3:o:abus:tvip_11550_firmware:-:*:*:*:*:*:*:*|cpe:2.3:h:abus:tvip_11550:-:*:*:*:*:*:*:*|cpe:2.3:o:abus:tvip_11551_firmware:-:*:*:*:*:*:*:*|cpe:2.3:h:abus:tvip_11551:-:*:*:*:*:*:*:*|cpe:2.3:o:abus:tvip_11552_firmware:-:*:*:*:*:*:*:*|cpe:2.3:h:abus:tvip_11552:-:*:*:*:*:*:*:*|cpe:2.3:o:abus:tvip_20000_firmware:-:*:*:*:*:*:*:*|cpe:2.3:h:abus:tvip_20000:-:*:*:*:*:*:*:*|cpe:2.3:o:abus:tvip_20050_firmware:-:*:*:*:*:*:*:*|cpe:2.3:h:abus:tvip_20050:-:*:*:*:*:*:*:*|cpe:2.3:o:abus:tvip_20500_firmware:-:*:*:*:*:*:*:*|cpe:2.3:h:abus:tvip_20500:-:*:*:*:*:*:*:*|cpe:2.3:o:abus:tvip_20550_firmware:-:*:*:*:*:*:*:*|cpe:2.3:h:abus:tvip_20550:-:*:*:*:*:*:*:*|cpe:2.3:o:abus:tvip_21000_firmware:-:*:*:*:*:*:*:*|cpe:2.3:h:abus:tvip_21000:-:*:*:*:*:*:*:*|cpe:2.3:o:abus:tvip_21050_firmware:-:*:*:*:*:*:*:*|cpe:2.3:h:abus:tvip_21050:-:*:*:*:*:*:*:*|cpe:2.3:o:abus:tvip_21500_firmware:-:*:*:*:*:*:*:*|cpe:2.3:h:abus:tvip_21500:-:*:*:*:*:*:*:*|cpe:2.3:o:abus:tvip_21501_firmware:-:*:*:*:*:*:*:*|cpe:2.3:h:abus:tvip_21501:-:*:*:*:*:*:*:*|cpe:2.3:o:abus:tvip_21502_firmware:-:*:*:*:*:*:*:*|cpe:2.3:h:abus:tvip_21502:-:*:*:*:*:*:*:*|cpe:2.3:o:abus:tvip_21550_firmware:-:*:*:*:*:*:*:*|cpe:2.3:h:abus:tvip_21550:-:*:*:*:*:*:*:*|cpe:2.3:o:abus:tvip_21551_firmware:-:*:*:*:*:*:*:*|cpe:2.3:h:abus:tvip_21551:-:*:*:*:*:*:*:*|cpe:2.3:o:abus:tvip_21552_firmware:-:*:*:*:*:*:*:*|cpe:2.3:h:abus:tvip_21552:-:*:*:*:*:*:*:*|cpe:2.3:o:abus:tvip_22500_firmware:-:*:*:*:*:*:*:*|cpe:2.3:h:abus:tvip_22500:-:*:*:*:*:*:*:*|cpe:2.3:o:abus:tvip_31000_firmware:-:*:*:*:*:*:*:*|cpe:2.3:h:abus:tvip_31000:-:*:*:*:*:*:*:*|cpe:2.3:o:abus:tvip_31001_firmware:-:*:*:*:*:*:*:*|cpe:2.3:h:abus:tvip_31001:-:*:*:*:*:*:*:*|cpe:2.3:o:abus:tvip_31050_firmware:-:*:*:*:*:*:*:*|cpe:2.3:h:abus:tvip_31050:-:*:*:*:*:*:*:*|cpe:2.3:o:abus:tvip_31500_firmware:-:*:*:*:*:*:*:*|cpe:2.3:h:abus:tvip_31500:-:*:*:*:*:*:*:*|cpe:2.3:o:abus:tvip_31501_firmware:-:*:*:*:*:*:*:*|cpe:2.3:h:abus:tvip_31501:-:*:*:*:*:*:*:*|cpe:2.3:o:abus:tvip_31550_firmware:-:*:*:*:*:*:*:*|cpe:2.3:h:abus:tvip_31550:-:*:*:*:*:*:*:*|cpe:2.3:o:abus:tvip_31551_firmware:-:*:*:*:*:*:*:*|cpe:2.3:h:abus:tvip_31551:-:*:*:*:*:*:*:*|cpe:2.3:o:abus:tvip_32500_firmware:-:*:*:*:*:*:*:*|cpe:2.3:h:abus:tvip_32500:-:*:*:*:*:*:*:*|cpe:2.3:o:abus:tvip_51500_firmware:-:*:*:*:*:*:*:*|cpe:2.3:h:abus:tvip_51500:-:*:*:*:*:*:*:*|cpe:2.3:o:abus:tvip_51550_firmware:-:*:*:*:*:*:*:*|cpe:2.3:h:abus:tvip_51550:-:*:*:*:*:*:*:*|cpe:2.3:o:abus:tvip_71500_firmware:-:*:*:*:*:*:*:*|cpe:2.3:h:abus:tvip_71500:-:*:*:*:*:*:*:*|cpe:2.3:o:abus:tvip_71501_firmware:-:*:*:*:*:*:*:*|cpe:2.3:h:abus:tvip_71501:-:*:*:*:*:*:*:*|cpe:2.3:o:abus:tvip_71550_firmware:-:*:*:*:*:*:*:*|cpe:2.3:h:abus:tvip_71550:-:*:*:*:*:*:*:*|cpe:2.3:o:abus:tvip_71551_firmware:-:*:*:*:*:*:*:*|cpe:2.3:h:abus:tvip_71551:-:*:*:*:*:*:*:*|cpe:2.3:o:abus:tvip_72500_firmware:-:*:*:*:*:*:*:*|cpe:2.3:h:abus:tvip_72500:-:*:*:*:*:*:*:*,vendor_only,2023-10-26,9.8,3.1,CWE-120,Maybe,Low,Unrecognized vendor but the description references a camera/surveillance device; home vs commercial deployment is unclear.,No,High,,Yes,High,,No,vendor makes stuff exclusively for professional deployments
C:Maybe/Low  X:No/High  G:Yes/High,judgments not unanimous,CVE-2018-17879,An issue was discovered on certain ABUS TVIP cameras. The CGI scripts allow remote attackers to execute code via system() as root. There are several injection points in various scripts.,cpe:2.3:o:abus:tvip_10000_firmware:-:*:*:*:*:*:*:*|cpe:2.3:h:abus:tvip_10000:-:*:*:*:*:*:*:*|cpe:2.3:o:abus:tvip_10001_firmware:-:*:*:*:*:*:*:*|cpe:2.3:h:abus:tvip_10001:-:*:*:*:*:*:*:*|cpe:2.3:o:abus:tvip_10005_firmware:-:*:*:*:*:*:*:*|cpe:2.3:h:abus:tvip_10005:-:*:*:*:*:*:*:*|cpe:2.3:o:abus:tvip_10005a_firmware:-:*:*:*:*:*:*:*|cpe:2.3:h:abus:tvip_10005a:-:*:*:*:*:*:*:*|cpe:2.3:o:abus:tvip_10005b_firmware:-:*:*:*:*:*:*:*|cpe:2.3:h:abus:tvip_10005b:-:*:*:*:*:*:*:*|cpe:2.3:o:abus:tvip_10050_firmware:-:*:*:*:*:*:*:*|cpe:2.3:h:abus:tvip_10050:-:*:*:*:*:*:*:*|cpe:2.3:o:abus:tvip_10051_firmware:-:*:*:*:*:*:*:*|cpe:2.3:h:abus:tvip_10051:-:*:*:*:*:*:*:*|cpe:2.3:o:abus:tvip_10055a_firmware:-:*:*:*:*:*:*:*|cpe:2.3:h:abus:tvip_10055a:-:*:*:*:*:*:*:*|cpe:2.3:o:abus:tvip_10055b_firmware:-:*:*:*:*:*:*:*|cpe:2.3:h:abus:tvip_10055b:-:*:*:*:*:*:*:*|cpe:2.3:o:abus:tvip_10500_firmware:-:*:*:*:*:*:*:*|cpe:2.3:h:abus:tvip_10500:-:*:*:*:*:*:*:*|cpe:2.3:o:abus:tvip_10550_firmware:-:*:*:*:*:*:*:*|cpe:2.3:h:abus:tvip_10550:-:*:*:*:*:*:*:*|cpe:2.3:o:abus:tvip_11000_firmware:-:*:*:*:*:*:*:*|cpe:2.3:h:abus:tvip_11000:-:*:*:*:*:*:*:*|cpe:2.3:o:abus:tvip_11050_firmware:-:*:*:*:*:*:*:*|cpe:2.3:h:abus:tvip_11050:-:*:*:*:*:*:*:*|cpe:2.3:o:abus:tvip_11500_firmware:-:*:*:*:*:*:*:*|cpe:2.3:h:abus:tvip_11500:-:*:*:*:*:*:*:*|cpe:2.3:o:abus:tvip_11501_firmware:-:*:*:*:*:*:*:*|cpe:2.3:h:abus:tvip_11501:-:*:*:*:*:*:*:*|cpe:2.3:o:abus:tvip_11502_firmware:-:*:*:*:*:*:*:*|cpe:2.3:h:abus:tvip_11502:-:*:*:*:*:*:*:*|cpe:2.3:o:abus:tvip_11550_firmware:-:*:*:*:*:*:*:*|cpe:2.3:h:abus:tvip_11550:-:*:*:*:*:*:*:*|cpe:2.3:o:abus:tvip_11551_firmware:-:*:*:*:*:*:*:*|cpe:2.3:h:abus:tvip_11551:-:*:*:*:*:*:*:*|cpe:2.3:o:abus:tvip_11552_firmware:-:*:*:*:*:*:*:*|cpe:2.3:h:abus:tvip_11552:-:*:*:*:*:*:*:*|cpe:2.3:o:abus:tvip_20000_firmware:-:*:*:*:*:*:*:*|cpe:2.3:h:abus:tvip_20000:-:*:*:*:*:*:*:*|cpe:2.3:o:abus:tvip_20050_firmware:-:*:*:*:*:*:*:*|cpe:2.3:h:abus:tvip_20050:-:*:*:*:*:*:*:*|cpe:2.3:o:abus:tvip_20500_firmware:-:*:*:*:*:*:*:*|cpe:2.3:h:abus:tvip_20500:-:*:*:*:*:*:*:*|cpe:2.3:o:abus:tvip_20550_firmware:-:*:*:*:*:*:*:*|cpe:2.3:h:abus:tvip_20550:-:*:*:*:*:*:*:*|cpe:2.3:o:abus:tvip_21000_firmware:-:*:*:*:*:*:*:*|cpe:2.3:h:abus:tvip_21000:-:*:*:*:*:*:*:*|cpe:2.3:o:abus:tvip_21050_firmware:-:*:*:*:*:*:*:*|cpe:2.3:h:abus:tvip_21050:-:*:*:*:*:*:*:*|cpe:2.3:o:abus:tvip_21500_firmware:-:*:*:*:*:*:*:*|cpe:2.3:h:abus:tvip_21500:-:*:*:*:*:*:*:*|cpe:2.3:o:abus:tvip_21501_firmware:-:*:*:*:*:*:*:*|cpe:2.3:h:abus:tvip_21501:-:*:*:*:*:*:*:*|cpe:2.3:o:abus:tvip_21502_firmware:-:*:*:*:*:*:*:*|cpe:2.3:h:abus:tvip_21502:-:*:*:*:*:*:*:*|cpe:2.3:o:abus:tvip_21550_firmware:-:*:*:*:*:*:*:*|cpe:2.3:h:abus:tvip_21550:-:*:*:*:*:*:*:*|cpe:2.3:o:abus:tvip_21551_firmware:-:*:*:*:*:*:*:*|cpe:2.3:h:abus:tvip_21551:-:*:*:*:*:*:*:*|cpe:2.3:o:abus:tvip_21552_firmware:-:*:*:*:*:*:*:*|cpe:2.3:h:abus:tvip_21552:-:*:*:*:*:*:*:*|cpe:2.3:o:abus:tvip_22500_firmware:-:*:*:*:*:*:*:*|cpe:2.3:h:abus:tvip_22500:-:*:*:*:*:*:*:*|cpe:2.3:o:abus:tvip_31000_firmware:-:*:*:*:*:*:*:*|cpe:2.3:h:abus:tvip_31000:-:*:*:*:*:*:*:*|cpe:2.3:o:abus:tvip_31001_firmware:-:*:*:*:*:*:*:*|cpe:2.3:h:abus:tvip_31001:-:*:*:*:*:*:*:*|cpe:2.3:o:abus:tvip_31050_firmware:-:*:*:*:*:*:*:*|cpe:2.3:h:abus:tvip_31050:-:*:*:*:*:*:*:*|cpe:2.3:o:abus:tvip_31500_firmware:-:*:*:*:*:*:*:*|cpe:2.3:h:abus:tvip_31500:-:*:*:*:*:*:*:*|cpe:2.3:o:abus:tvip_31501_firmware:-:*:*:*:*:*:*:*|cpe:2.3:h:abus:tvip_31501:-:*:*:*:*:*:*:*|cpe:2.3:o:abus:tvip_31550_firmware:-:*:*:*:*:*:*:*|cpe:2.3:h:abus:tvip_31550:-:*:*:*:*:*:*:*|cpe:2.3:o:abus:tvip_31551_firmware:-:*:*:*:*:*:*:*|cpe:2.3:h:abus:tvip_31551:-:*:*:*:*:*:*:*|cpe:2.3:o:abus:tvip_32500_firmware:-:*:*:*:*:*:*:*|cpe:2.3:h:abus:tvip_32500:-:*:*:*:*:*:*:*|cpe:2.3:o:abus:tvip_51500_firmware:-:*:*:*:*:*:*:*|cpe:2.3:h:abus:tvip_51500:-:*:*:*:*:*:*:*|cpe:2.3:o:abus:tvip_51550_firmware:-:*:*:*:*:*:*:*|cpe:2.3:h:abus:tvip_51550:-:*:*:*:*:*:*:*|cpe:2.3:o:abus:tvip_71500_firmware:-:*:*:*:*:*:*:*|cpe:2.3:h:abus:tvip_71500:-:*:*:*:*:*:*:*|cpe:2.3:o:abus:tvip_71501_firmware:-:*:*:*:*:*:*:*|cpe:2.3:h:abus:tvip_71501:-:*:*:*:*:*:*:*|cpe:2.3:o:abus:tvip_71550_firmware:-:*:*:*:*:*:*:*|cpe:2.3:h:abus:tvip_71550:-:*:*:*:*:*:*:*|cpe:2.3:o:abus:tvip_71551_firmware:-:*:*:*:*:*:*:*|cpe:2.3:h:abus:tvip_71551:-:*:*:*:*:*:*:*|cpe:2.3:o:abus:tvip_72500_firmware:-:*:*:*:*:*:*:*|cpe:2.3:h:abus:tvip_72500:-:*:*:*:*:*:*:*,vendor_only,2023-10-26,9.8,3.1,CWE-78,Maybe,Low,Unrecognized vendor but the description references a camera/surveillance device; home vs commercial deployment is unclear.,No,High,,Yes,High,,No,vendor makes stuff exclusively for professional deployments
C:Yes/High  X:No/High  G:Yes/High,judgments not unanimous,CVE-2018-20955,"Swann SWWHD-INTCAM-HD devices have the twipc root password, leading to FTP access as root. NOTE: all affected customers were migrated by 2020-08-31.",cpe:2.3:o:swann:swwhd-intcam-hd_firmware:-:*:*:*:*:*:*:*|cpe:2.3:h:swann:swwhd-intcam-hd:-:*:*:*:*:*:*:*,vendor_only,2019-08-08,9.8,3.0,CWE-798,Yes,High,Swann SWWHD-INTCAM-HD is a Swann consumer smart security camera; a hardcoded root password giving FTP access is in scope.,No,High,,Yes,High,,Yes,
C:Yes/High  X:No/High  G:Yes/High,judgments not unanimous,CVE-2018-20956,Swann SWWHD-INTCAM-HD devices leave the PSK in logs after a factory reset. NOTE: all affected customers were migrated by 2020-08-31.,cpe:2.3:o:swann:swwhd-intcam-hd_firmware:-:*:*:*:*:*:*:*|cpe:2.3:h:swann:swwhd-intcam-hd:-:*:*:*:*:*:*:*,vendor_only,2019-08-08,5.5,3.0,CWE-532,Yes,High,Swann SWWHD-INTCAM-HD is a Swann consumer smart security camera; PSK left in logs after factory reset is in scope.,No,High,,Yes,High,,Yes,
C:Maybe/Low  X:Yes/High  G:Yes/High,judgments not unanimous,CVE-2018-14494,"Vivotek FD8136 devices allow Remote Command Injection, related to BusyBox and wget. NOTE: the vendor sent a clarification on 2019-09-17 explaining that, although this CVE was first populated in July 2019, it is a historical vulnerability that does not apply to any current or recent Vivotek hardware or firmware",cpe:2.3:o:vivotek:fd8136_firmware:0301a:*:*:*:*:*:*:*|cpe:2.3:h:vivotek:fd8136:-:*:*:*:*:*:*:*,vendor_only,2019-07-10,9.8,3.0,CWE-78,Maybe,Low,Vendor produces both consumer and commercial/NVR-DVR camera lines; cannot tell from CPE/description whether this model is one a typical home user would deploy.,Yes,High,,Yes,High,,Yes,
C:Maybe/Low  X:Yes/High  G:Yes/High,judgments not unanimous,CVE-2018-14495,"Vivotek FD8136 devices allow Remote Command Injection, aka ""another command injection vulnerability in our target device,"" a different issue than CVE-2018-14494. NOTE: The vendor has disputed this as a vulnerability and states that the issue does not cause a web server crash or have any other affect on it's performance",cpe:2.3:o:vivotek:fd8136_firmware:0301a:*:*:*:*:*:*:*|cpe:2.3:h:vivotek:fd8136:-:*:*:*:*:*:*:*,vendor_only,2019-07-10,9.8,3.0,CWE-78,Maybe,Low,Vendor produces both consumer and commercial/NVR-DVR camera lines; cannot tell from CPE/description whether this model is one a typical home user would deploy.,Yes,High,,Yes,High,,Yes,
C:Maybe/Low  X:Yes/High  G:Yes/High,judgments not unanimous,CVE-2018-14496,"Vivotek FD8136 devices allow remote memory corruption and remote code execution because of a stack-based buffer overflow, related to sprintf, vlocal_buff_4326, and set_getparam.cgi. NOTE: The vendor has disputed this as a vulnerability and states that the issue does not cause a web server crash or have any other affect on it's performance",cpe:2.3:o:vivotek:fd8136_firmware:0301a:*:*:*:*:*:*:*|cpe:2.3:h:vivotek:fd8136:-:*:*:*:*:*:*:*,vendor_only,2019-07-10,9.8,3.0,CWE-787,Maybe,Low,Vendor produces both consumer and commercial/NVR-DVR camera lines; cannot tell from CPE/description whether this model is one a typical home user would deploy.,Yes,High,,Yes,High,,Yes,
C:Maybe/Low  X:No/High  G:Yes/High,judgments not unanimous,CVE-2018-20050,Mishandling of an empty string on the Jooan JA-Q1H Wi-Fi camera with firmware 21.0.0.91 allows remote attackers to cause a denial of service (crash and reboot) via the ONVIF GetStreamUri method and GetVideoEncoderConfigurationOptions method.,cpe:2.3:o:qacctv:jooan_ja-q1h_wi-fi_camera_firmware:21.0.0.91:*:*:*:*:*:*:*|cpe:2.3:h:qacctv:jooan_ja-q1h_wi-fi_camera:-:*:*:*:*:*:*:*,vendor_only,2018-12-10,7.5,3.0,,Maybe,Low,Unrecognized vendor but the description references a camera/surveillance device; home vs commercial deployment is unclear.,No,High,,Yes,High,,No,vendor makes stuff exclusively for professional deployments
C:Maybe/Low  X:No/High  G:Yes/High,judgments not unanimous,CVE-2018-20051,"Mishandling of '>' on the Jooan JA-Q1H Wi-Fi camera with firmware 21.0.0.91 allows remote attackers to cause a denial of service (crash and reboot) via certain ONVIF methods such as CreateUsers, SetImagingSettings, GetStreamUri, and so on.",cpe:2.3:o:qacctv:jooan_ja-q1h_wi-fi_camera_firmware:21.0.0.91:*:*:*:*:*:*:*|cpe:2.3:h:qacctv:jooan_ja-q1h_wi-fi_camera:-:*:*:*:*:*:*:*,vendor_only,2018-12-10,7.5,3.0,CWE-20,Maybe,Low,Unrecognized vendor but the description references a camera/surveillance device; home vs commercial deployment is unclear.,No,High,,Yes,High,,No,vendor makes stuff exclusively for professional deployments
C:No/Low  X:Yes/High  G:No/High,judgments not unanimous,CVE-2018-17064,An issue was discovered on D-Link DIR-816 A2 1.10 B05 devices. An HTTP request parameter is used in command string construction within the handler function of the /goform/sylogapply route. This could lead to command injection via the syslogIp parameter after /goform/clearlog is invoked.,cpe:2.3:o:dlink:dir-816_a2_firmware:1.10_b05:*:*:*:*:*:*:*|cpe:2.3:h:dlink:dir-816_a2:-:*:*:*:*:*:*:*,vendor_only,2018-09-15,9.8,3.0,CWE-78,No,Low,"Home-brand vendor matched, but the description is not about a camera (likely a different product line of the same brand).",Yes,High,,No,High,,No,This device is a router
C:Maybe/Low  X:Yes/High  G:Yes/High,judgments not unanimous,CVE-2018-14769,VIVOTEK FD8177 devices before XXXXXX-VVTK-xx06a allow CSRF.,cpe:2.3:h:vivotek:camera:-:*:*:*:*:*:*:*,vendor_only,2018-09-05,8.8,3.0,CWE-352,Maybe,Low,Vendor produces both consumer and commercial/NVR-DVR camera lines; cannot tell from CPE/description whether this model is one a typical home user would deploy.,Yes,High,,Yes,High,,Yes,
C:Maybe/Low  X:Yes/High  G:Yes/High,judgments not unanimous,CVE-2018-14770,"VIVOTEK FD8177 devices before XXXXXX-VVTK-xx06a allow remote attackers to execute arbitrary code (issue 1 of 2) via the ONVIF interface, (/onvif/device_service).",cpe:2.3:h:vivotek:camera:-:*:*:*:*:*:*:*,vendor_only,2018-09-05,8.8,3.0,,Maybe,Low,Vendor produces both consumer and commercial/NVR-DVR camera lines; cannot tell from CPE/description whether this model is one a typical home user would deploy.,Yes,High,,Yes,High,,Yes,
C:Maybe/Low  X:Yes/High  G:Yes/High,judgments not unanimous,CVE-2018-14771,VIVOTEK FD8177 devices before XXXXXX-VVTK-xx06a allow remote attackers to execute arbitrary code (issue 2 of 2) via eventscript.cgi.,cpe:2.3:h:vivotek:camera:-:*:*:*:*:*:*:*,vendor_only,2018-09-05,8.8,3.0,,Maybe,Low,Vendor produces both consumer and commercial/NVR-DVR camera lines; cannot tell from CPE/description whether this model is one a typical home user would deploy.,Yes,High,,Yes,High,,Yes,
C:Maybe/Low  X:Yes/High  G:Yes/High,judgments not unanimous,CVE-2018-14768,"Various VIVOTEK FD8*, FD9*, FE9*, IB8*, IB9*, IP9*, IZ9*, MS9*, SD9*, and other devices before XXXXXX-VVTK-xx06a allow remote attackers to execute arbitrary code.",cpe:2.3:h:vivotek:camera:-:*:*:*:*:*:*:*,vendor_only,2018-08-29,8.8,3.0,,Maybe,Low,Vendor produces both consumer and commercial/NVR-DVR camera lines; cannot tell from CPE/description whether this model is one a typical home user would deploy.,Yes,High,,Yes,High,,Yes,
C:Maybe/Low  X:No/High  G:No/High,judgments not unanimous,CVE-2018-14923,A vulnerability in uniview EZPlayer 1.0.6 could allow an attacker to execute arbitrary code on a targeted system via video playback.,cpe:2.3:a:uniview:ezplayer:1.0.6:*:*:*:*:*:*:*,vendor_only,2018-08-03,7.8,3.0,CWE-20,Maybe,Low,Vendor produces both consumer and commercial/NVR-DVR camera lines; cannot tell from CPE/description whether this model is one a typical home user would deploy.,No,High,,No,High,,Yes,
C:No/High  X:Yes/High  G:Yes/High,judgments not unanimous,CVE-2018-11689,Web Viewer for Hanwha DVR 2.17 and Smart Viewer in Samsung Web Viewer for Samsung DVR are vulnerable to XSS via the /cgi-bin/webviewer_login_page data3 parameter. (The same Web Viewer codebase was transitioned from Samsung to Hanwha.),cpe:2.3:a:samsung:smartviewer:-:*:*:*:*:*:*:*|cpe:2.3:o:hanwha-security:hrd-1642_firmware:*:*:*:*:*:*:*:*|cpe:2.3:h:hanwha-security:hrd-1642:-:*:*:*:*:*:*:*|cpe:2.3:o:hanwha-security:hrd-842_firmware:*:*:*:*:*:*:*:*|cpe:2.3:h:hanwha-security:hrd-842:-:*:*:*:*:*:*:*|cpe:2.3:o:hanwha-security:hrd-442_firmware:*:*:*:*:*:*:*:*|cpe:2.3:h:hanwha-security:hrd-442:-:*:*:*:*:*:*:*|cpe:2.3:o:hanwha-security:hrd-1641_firmware:*:*:*:*:*:*:*:*|cpe:2.3:h:hanwha-security:hrd-1641:-:*:*:*:*:*:*:*|cpe:2.3:o:hanwha-security:hrd-841_firmware:*:*:*:*:*:*:*:*|cpe:2.3:h:hanwha-security:hrd-841:-:*:*:*:*:*:*:*|cpe:2.3:o:hanwha-security:hrd-840_firmware:*:*:*:*:*:*:*:*|cpe:2.3:h:hanwha-security:hrd-840:-:*:*:*:*:*:*:*|cpe:2.3:o:hanwha-security:hrd-440_firmware:*:*:*:*:*:*:*:*|cpe:2.3:h:hanwha-security:hrd-440:-:*:*:*:*:*:*:*|cpe:2.3:o:hanwha-security:hrd-443_firmware:*:*:*:*:*:*:*:*|cpe:2.3:h:hanwha-security:hrd-443:-:*:*:*:*:*:*:*|cpe:2.3:o:hanwha-security:srd-1694u_firmware:*:*:*:*:*:*:*:*|cpe:2.3:h:hanwha-security:srd-1694u:-:*:*:*:*:*:*:*,vendor_only,2018-06-14,6.1,3.1,CWE-79,No,High,"The affected product is the Hanwha/Samsung DVR Web Viewer for professional/commercial DVR surveillance recorders, not a consumer home camera.",Yes,High,,Yes,High,,No,
C:No/Low  X:No/High  G:Yes/High,judgments not unanimous,CVE-2018-12258,"An issue was discovered on Momentum Axel 720P 5.1.8 devices. Custom Firmware Upgrade is possible via an SD Card. With physical access, an attacker can upgrade the firmware in under 60 seconds by inserting an SD card containing the firmware with name 'ezviz.dav' and rebooting.",cpe:2.3:o:apollotechnologiesinc:momentum_axel_720p_firmware:5.1.8:*:*:*:*:*:*:*|cpe:2.3:h:apollotechnologiesinc:momentum_axel_720p:-:*:*:*:*:*:*:*,vendor_only,2018-06-12,6.8,3.0,,No,Low,Unrecognized vendor and no camera signal in the description; likely a brand-keyword collision rather than a home camera.,No,High,,Yes,High,,Yes,Momentum does make cameras
C:Maybe/Low  X:Yes/High  G:Yes/High,judgments not unanimous,CVE-2018-10676,"CeNova, Night OWL, Novo, Pulnix, QSee, Securus, and TBK Vision DVR devices allow remote attackers to download a file and obtain sensitive credential information via a direct request for the download.rsp URI.",cpe:2.3:o:tbkvision:tbk-dvr4216_firmware:-:*:*:*:*:*:*:*|cpe:2.3:h:tbkvision:tbk-dvr4216:-:*:*:*:*:*:*:*|cpe:2.3:o:tbkvision:tbk-dvr4104_firmware:-:*:*:*:*:*:*:*|cpe:2.3:h:tbkvision:tbk-dvr4104:-:*:*:*:*:*:*:*,vendor_only,2018-05-02,9.8,3.0,,Maybe,Low,Unrecognized vendor but the description references a camera/surveillance device; home vs commercial deployment is unclear.,Yes,High,,Yes,High,,No,vendor makes stuff exclusively for professional deployments
C:Maybe/Low  X:Yes/High  G:Yes/High,judgments not unanimous,CVE-2018-9995,"TBK DVR4104 and DVR4216 devices, as well as Novo, CeNova, QSee, Pulnix, XVR 5 in 1, Securus, Night OWL, DVR Login, HVR Login, and MDVR Login, which run re-branded versions of the original TBK DVR4104 and DVR4216 series, allow remote attackers to bypass authentication via a ""Cookie: uid=admin"" header, as demonstrated by a device.rsp?opt=user&cmd=list request that provides credentials within JSON data in a response.",cpe:2.3:o:tbkvision:tbk-dvr4216_firmware:-:*:*:*:*:*:*:*|cpe:2.3:h:tbkvision:tbk-dvr4216:-:*:*:*:*:*:*:*|cpe:2.3:o:tbkvision:tbk-dvr4104_firmware:-:*:*:*:*:*:*:*|cpe:2.3:h:tbkvision:tbk-dvr4104:-:*:*:*:*:*:*:*,vendor_only,2018-04-10,9.8,3.0,,Maybe,Low,Unrecognized vendor but the description references a camera/surveillance device; home vs commercial deployment is unclear.,Yes,High,,Yes,High,,No,vendor makes stuff exclusively for professional deployments
C:No/High  X:Yes/High  G:No/Low,judgments not unanimous,CVE-2018-9156,"An issue was discovered on AXIS P1354 (IP camera) Firmware version 5.90.1.1 devices. The upload web page doesn't verify the file type, and an attacker can upload a webshell by making a fileUpload.shtml request for a custom .shtml file, which is interpreted by the Apache HTTP Server mod_include module with ""<!--#exec cmd="" support. The file needs to include a specific string to meet the internal system architecture. After the webshell upload, an attacker can use the webshell to perform remote code execution such as running a system command (ls, ping, cat /etc/passwd, etc.). NOTE: the vendor reportedly indicates that this is an intended feature or functionality",cpe:2.3:o:axis:p1354_firmware:5.90.1.1:*:*:*:*:*:*:*|cpe:2.3:h:axis:p1354:-:*:*:*:*:*:*:*,vendor_only,2018-04-01,7.5,3.0,CWE-434,No,High,AXIS P1354 is a professional/commercial network camera (and the vendor classifies the behavior as intended functionality).,Yes,High,,No,Low,"Axis Communications primarily produces professional/enterprise-grade network cameras for commercial security, rather than consumer home IoT devices.",No,
C:No/High  X:Yes/High  G:Yes/High,judgments not unanimous,CVE-2018-9157,"An issue was discovered on AXIS M1033-W (IP camera) Firmware version 5.40.5.1 devices. The upload web page doesn't verify the file type, and an attacker can upload a webshell by making a fileUpload.shtml request for a custom .shtml file, which is interpreted by the Apache HTTP Server mod_include module with ""<!--#exec cmd="" support. The file needs to include a specific string to meet the internal system architecture. After the webshell upload, an attacker can use the webshell to perform remote code execution such as running a system command (ls, ping, cat /etc/passwd, etc.). NOTE: the vendor reportedly indicates that this is an intended feature or functionality",cpe:2.3:o:axis:m1033-w_firmware:5.40.5.1:*:*:*:*:*:*:*|cpe:2.3:h:axis:m1033-w:-:*:*:*:*:*:*:*,vendor_only,2018-04-01,7.5,3.0,CWE-434,No,High,"AXIS M1033-W is a professional/commercial AXIS network camera, not a consumer home device.",Yes,High,,Yes,High,,No,
C:No/High  X:No/High  G:Yes/High,judgments not unanimous,CVE-2018-6294,Unsecured way of firmware update in Hanwha Techwin Smartcams,cpe:2.3:o:hanwha-security:snh-v6410pn_firmware:-:*:*:*:*:*:*:*|cpe:2.3:h:hanwha-security:snh-v6410pn:-:*:*:*:*:*:*:*|cpe:2.3:o:hanwha-security:snh-v6410pnw_firmware:-:*:*:*:*:*:*:*|cpe:2.3:h:hanwha-security:snh-v6410pnw:-:*:*:*:*:*:*:*,vendor_only,2018-03-13,9.8,3.0,CWE-287,No,High,Hanwha Techwin is primarily a professional surveillance brand and this one-line entry gives no residential context to confirm the SmartCam as a consumer home device.,No,High,,Yes,High,,No,
C:No/High  X:No/High  G:Yes/High,judgments not unanimous,CVE-2018-6295,Unencrypted way of remote control and communications in Hanwha Techwin Smartcams,cpe:2.3:o:hanwha-security:snh-v6410pn_firmware:-:*:*:*:*:*:*:*|cpe:2.3:h:hanwha-security:snh-v6410pn:-:*:*:*:*:*:*:*|cpe:2.3:o:hanwha-security:snh-v6410pnw_firmware:-:*:*:*:*:*:*:*|cpe:2.3:h:hanwha-security:snh-v6410pnw:-:*:*:*:*:*:*:*,vendor_only,2018-03-13,9.8,3.0,CWE-319,No,High,Hanwha Techwin is primarily a professional surveillance brand and this one-line entry gives no residential context to confirm the SmartCam as a consumer home device.,No,High,,Yes,High,,No,
C:No/High  X:No/High  G:Yes/High,judgments not unanimous,CVE-2018-6297,Buffer overflow in Hanwha Techwin Smartcams,cpe:2.3:o:hanwha-security:snh-v6410pn_firmware:-:*:*:*:*:*:*:*|cpe:2.3:h:hanwha-security:snh-v6410pn:-:*:*:*:*:*:*:*|cpe:2.3:o:hanwha-security:snh-v6410pnw_firmware:-:*:*:*:*:*:*:*|cpe:2.3:h:hanwha-security:snh-v6410pnw:-:*:*:*:*:*:*:*,vendor_only,2018-03-13,9.8,3.0,CWE-119,No,High,Hanwha Techwin is primarily a professional surveillance brand and this one-line entry gives no residential context to confirm the SmartCam as a consumer home device.,No,High,,Yes,High,,No,
