Verdicts,Review Reason,cve_id,description,cpe_strings,Difference Type,published,cvss_score,cvss_version,cwe_ids,Claude Judgment,Claude Confidence,Claude Reasoning,Codex Judgment,Codex Confidence,Codex Reasoning,Gemini Judgment,Gemini Confidence,Gemini Reasoning,Human Verdict,Human Notes
C:Maybe/Low  X:Yes/High  G:Yes/High,judgments not unanimous,CVE-2022-26259,"A buffer over flow in Xiongmai DVR devices NBD80X16S-KL, NBD80X09S-KL, NBD80X08S-KL, NBD80X09RA-KL, AHB80X04R-MH, AHB80X04R-MH-V2, AHB80X04-R-MH-V3, AHB80N16T-GS, AHB80N32F4-LME, and NBD90S0VT-QW allows attackers to cause a Denial of Service (DoS) via a crafted RSTP request.",cpe:2.3:o:xiongmaitech:nbd80x16s-kl_firmware:4.03.r11.nat.dss.onvifc.20210727:*:*:*:*:*:*:*|cpe:2.3:h:xiongmaitech:nbd80x16s-kl:-:*:*:*:*:*:*:*|cpe:2.3:o:xiongmaitech:nbd80x09s-kl_firmware:4.03.r11.nat.dss.onvifc.20210727:*:*:*:*:*:*:*|cpe:2.3:h:xiongmaitech:nbd80x09s-kl:-:*:*:*:*:*:*:*|cpe:2.3:o:xiongmaitech:nbd80x08s-kl_firmware:4.03.r11.nat.dss.onvifc.20210727:*:*:*:*:*:*:*|cpe:2.3:h:xiongmaitech:nbd80x08s-kl:-:*:*:*:*:*:*:*|cpe:2.3:o:xiongmaitech:nbd80x09ra-kl_firmware:4.03.r11.nat.dss.onvifc.20210727:*:*:*:*:*:*:*|cpe:2.3:h:xiongmaitech:nbd80x09ra-kl:-:*:*:*:*:*:*:*|cpe:2.3:o:xiongmaitech:ahb80x04r-mh_firmware:4.03.r11.nat.dss.onvifc.20210729:*:*:*:*:*:*:*|cpe:2.3:h:xiongmaitech:ahb80x04r-mh:-:*:*:*:*:*:*:*|cpe:2.3:o:xiongmaitech:ahb80x04r-mh-v2_firmware:4.03.r11.nat.dss.onvifc.20210729:*:*:*:*:*:*:*|cpe:2.3:h:xiongmaitech:ahb80x04r-mh-v2:-:*:*:*:*:*:*:*|cpe:2.3:o:xiongmaitech:ahb80x04-r-mh-v3_firmware:4.03.r11.nat.dss.onvifc.20210729:*:*:*:*:*:*:*|cpe:2.3:h:xiongmaitech:ahb80x04-r-mh-v3:-:*:*:*:*:*:*:*|cpe:2.3:o:xiongmaitech:ahb80n16t-gs_firmware:4.03.r11.7601.nat.onvifc.20211223:*:*:*:*:*:*:*|cpe:2.3:h:xiongmaitech:ahb80n16t-gs:-:*:*:*:*:*:*:*|cpe:2.3:o:xiongmaitech:ahb80n32f4-lme_firmware:4.03.r11.7601.nat.onvifc.20211228:*:*:*:*:*:*:*|cpe:2.3:h:xiongmaitech:ahb80n32f4-lme:-:*:*:*:*:*:*:*|cpe:2.3:o:xiongmaitech:nbd90s0vt-qw_firmware:4.03.r11.713g.nat.onvifc.2021:*:*:*:*:*:*:*|cpe:2.3:h:xiongmaitech:nbd90s0vt-qw:-:*:*:*:*:*:*:*,vendor_only,2022-03-28,7.8,3.1,CWE-120,Maybe,Low,Vendor produces both consumer and commercial/NVR-DVR camera lines; cannot tell from CPE/description whether this model is one a typical home user would deploy.,Yes,High,,Yes,High,,Yes,
C:Maybe/Low  X:No/High  G:Yes/High,judgments not unanimous,CVE-2023-34873,"On MOBOTIX P3 cameras before MX-V4.7.2.18 and Mx6 cameras before MX-V5.2.0.61, the tcpdump feature does not properly validate input, which allows authenticated users to execute code.",,vendor_only,2025-05-23,,,CWE-78,Maybe,Low,No CPE present and the description references a camera but does not establish home vs commercial deployment.,No,High,,Yes,High,,No,
C:Maybe/Low  X:Yes/High  G:Yes/High,judgments not unanimous,CVE-2023-47353,An issue in the com.oneed.dvr.service.DownloadFirmwareService component of IMOU GO v1.0.11 allows attackers to force the download of arbitrary files.,cpe:2.3:a:imoulife:imou_go:1.0.11:*:*:*:*:android:*:*,vendor_only,2024-02-06,8.8,3.1,CWE-494,Maybe,Low,Unrecognized vendor but the description references a camera/surveillance device; home vs commercial deployment is unclear.,Yes,High,,Yes,High,,No,vendor makes stuff exclusively for professional deployments
C:No/Low  X:Yes/High  G:Yes/High,judgments not unanimous,CVE-2023-27098,TP-Link Tapo APK up to v2.12.703 uses hardcoded credentials for access to the login panel.,cpe:2.3:a:tp-link:tapo:*:*:*:*:*:android:*:*|cpe:2.3:h:tp-link:tapo_c200:-:*:*:*:*:*:*:*,vendor_only,2024-01-09,7.5,3.1,CWE-312,No,Low,"Home-brand vendor matched, but the description is not about a camera (likely a different product line of the same brand).",Yes,High,,Yes,High,,Yes,
C:No/Low  X:No/High  G:Yes/High,judgments not unanimous,CVE-2023-34829,Incorrect access control in TP-Link Tapo before v3.1.315 allows attackers to access user credentials in plaintext.,cpe:2.3:a:tp-link:tapo:*:*:*:*:*:*:*:*,vendor_only,2023-12-28,6.5,3.1,CWE-319,No,Low,"Home-brand vendor matched, but the description is not about a camera (likely a different product line of the same brand).",No,High,,Yes,High,,Yes,
C:Maybe/Low  X:Yes/High  G:No/High,judgments not unanimous,CVE-2023-28812,"There is a buffer overflow vulnerability in a web browser plug-in could allow an attacker to exploit the vulnerability by sending crafted messages to computers installed with this plug-in, which could lead to arbitrary code execution or cause process exception of the plug-in.",cpe:2.3:a:hikvision:localservicecomponents:*:*:*:*:*:*:*:*,vendor_only,2023-11-23,9.8,3.1,CWE-120,Maybe,Low,Vendor produces both consumer and commercial/NVR-DVR camera lines; cannot tell from CPE/description whether this model is one a typical home user would deploy.,Yes,High,,No,High,,Yes,
C:Maybe/Low  X:Yes/High  G:No/High,judgments not unanimous,CVE-2023-28813,"An attacker could exploit a vulnerability by sending crafted messages to computers installed with this plug-in to modify plug-in parameters, which could cause affected computers to download malicious files. ",cpe:2.3:a:hikvision:localservicecomponents:*:*:*:*:*:*:*:*,vendor_only,2023-11-23,7.5,3.1,,Maybe,Low,Vendor produces both consumer and commercial/NVR-DVR camera lines; cannot tell from CPE/description whether this model is one a typical home user would deploy.,Yes,High,,No,High,,Yes,
C:No/Low  X:Yes/High  G:Yes/High,judgments not unanimous,CVE-2023-39610,An issue in TP-Link Tapo C100 v1.1.15 Build 211130 Rel.15378n(4555) and before allows attackers to cause a Denial of Service (DoS) via supplying a crafted web request.,cpe:2.3:o:tp-link:tapo_c100_firmware:*:*:*:*:*:*:*:*|cpe:2.3:h:tp-link:tapo_c100:-:*:*:*:*:*:*:*,vendor_only,2023-10-31,6.5,3.1,CWE-400,No,Low,"Home-brand vendor matched, but the description is not about a camera (likely a different product line of the same brand).",Yes,High,,Yes,High,,Yes,
C:No/High  X:Yes/High  G:Yes/High,judgments not unanimous,CVE-2023-21413,GoSecure on behalf of Genetec Inc. has found a flaw that allows for a remote code execution during the installation of ACAP applications on the Axis device. The application handling service in AXIS OS was vulnerable to command injection allowing an attacker to run arbitrary code. Axis has released patched AXIS OS versions for the highlighted flaw. Please refer to the Axis security advisory for more information and solution.,cpe:2.3:o:axis:axis_os:*:*:*:*:lts:*:*:*|cpe:2.3:o:axis:axis_os:*:*:*:*:active:*:*:*,vendor_only,2023-10-16,7.2,3.1,CWE-78|CWE-77,No,High,"AXIS OS / the ACAP application platform runs on professional AXIS surveillance devices, not consumer home cameras.",Yes,High,,Yes,High,,No,
C:Maybe/Low  X:No/High  G:Yes/High,judgments not unanimous,CVE-2023-39068,Buffer Overflow vulnerability in NBD80S09S-KLC v.YK_HZXM_NBD80S09S-KLC_V4.03.R11.7601.Nat.OnvifC.20230414.bin and NBD80N32RA-KL-V3 v.YK_HZXM_NBD80N32RA-KL_V4.03.R11.7601.Nat.OnvifC.20220120.bin allows a remote attacker to casue a denial of service via a crafted request to the service.XM component.,cpe:2.3:o:xiongmaitech:nb080s09s-klc_firmware:yk_hzxm_nbd80s09s-klc_v4.03.r11.7601.nat.onvifc.20230414:*:*:*:*:*:*:*|cpe:2.3:h:xiongmaitech:nb080s09s-klc:-:*:*:*:*:*:*:*|cpe:2.3:o:xiongmaitech:nbd80n32ra-kl-v3_firmware:yk_hzxm_nbd80n32ra-kl_v4.03.r11.7601.nat.onvifc.20220120:*:*:*:*:*:*:*|cpe:2.3:h:xiongmaitech:nbd80n32ra-kl-v3:-:*:*:*:*:*:*:*,vendor_only,2023-09-11,7.5,3.1,CWE-120,Maybe,Low,Vendor produces both consumer and commercial/NVR-DVR camera lines; cannot tell from CPE/description whether this model is one a typical home user would deploy.,No,High,,Yes,High,,Yes,
C:No/High  X:No/High  G:Yes/High,judgments not unanimous,CVE-2023-3638,"In GeoVision GV-ADR2701 cameras, an attacker could edit the login response to access the web application.

",cpe:2.3:o:geovision:gv-adr2701_firmware:1.00_2017_12_15:*:*:*:*:*:*:*|cpe:2.3:h:geovision:gv-adr2701:-:*:*:*:*:*:*:*,vendor_only,2023-07-19,9.8,3.1,CWE-287,No,High,"GeoVision GV-ADR2701 is a commercial surveillance camera, not a consumer home device.",No,High,,Yes,High,,No,
C:Maybe/Low  X:Yes/High  G:No/High,judgments not unanimous,CVE-2023-28809,"Some access control products are vulnerable to a session hijacking attack because the product does not update the session ID after a user successfully logs in. To exploit the vulnerability, attackers have to request the session ID at the same time as a valid user logs in, and gain device operation permissions by forging the IP and session ID of an authenticated user.",cpe:2.3:o:hikvision:ds-k1t320efwx_firmware:-:*:*:*:*:*:*:*|cpe:2.3:h:hikvision:ds-k1t320efwx:-:*:*:*:*:*:*:*|cpe:2.3:o:hikvision:ds-k1t320efx_firmware:-:*:*:*:*:*:*:*|cpe:2.3:h:hikvision:ds-k1t320efx:-:*:*:*:*:*:*:*|cpe:2.3:o:hikvision:ds-k1t320ewx_firmware:-:*:*:*:*:*:*:*|cpe:2.3:h:hikvision:ds-k1t320ewx:-:*:*:*:*:*:*:*|cpe:2.3:o:hikvision:ds-k1t320ex_firmware:-:*:*:*:*:*:*:*|cpe:2.3:h:hikvision:ds-k1t320ex:-:*:*:*:*:*:*:*|cpe:2.3:o:hikvision:ds-k1t320mfwx_firmware:-:*:*:*:*:*:*:*|cpe:2.3:h:hikvision:ds-k1t320mfwx:-:*:*:*:*:*:*:*|cpe:2.3:o:hikvision:ds-k1t320mfx_firmware:-:*:*:*:*:*:*:*|cpe:2.3:h:hikvision:ds-k1t320mfx:-:*:*:*:*:*:*:*|cpe:2.3:o:hikvision:ds-k1t320mwx_firmware:-:*:*:*:*:*:*:*|cpe:2.3:h:hikvision:ds-k1t320mwx:-:*:*:*:*:*:*:*|cpe:2.3:o:hikvision:ds-k1t320mx_firmware:-:*:*:*:*:*:*:*|cpe:2.3:h:hikvision:ds-k1t320mx:-:*:*:*:*:*:*:*|cpe:2.3:o:hikvision:ds-k1t341am_firmware:-:*:*:*:*:*:*:*|cpe:2.3:h:hikvision:ds-k1t341am:-:*:*:*:*:*:*:*|cpe:2.3:o:hikvision:ds-k1t341amf_firmware:-:*:*:*:*:*:*:*|cpe:2.3:h:hikvision:ds-k1t341amf:-:*:*:*:*:*:*:*|cpe:2.3:o:hikvision:ds-k1t341cm_firmware:-:*:*:*:*:*:*:*|cpe:2.3:h:hikvision:ds-k1t341cm:-:*:*:*:*:*:*:*|cpe:2.3:o:hikvision:ds-k1t343ewx_firmware:-:*:*:*:*:*:*:*|cpe:2.3:h:hikvision:ds-k1t343ewx:-:*:*:*:*:*:*:*|cpe:2.3:o:hikvision:ds-k1t343ex_firmware:-:*:*:*:*:*:*:*|cpe:2.3:h:hikvision:ds-k1t343ex:-:*:*:*:*:*:*:*|cpe:2.3:o:hikvision:ds-k1t343mwx_firmware:-:*:*:*:*:*:*:*|cpe:2.3:h:hikvision:ds-k1t343mwx:-:*:*:*:*:*:*:*|cpe:2.3:o:hikvision:ds-k1t343mx_firmware:-:*:*:*:*:*:*:*|cpe:2.3:h:hikvision:ds-k1t343mx:-:*:*:*:*:*:*:*|cpe:2.3:o:hikvision:ds-k1t671_firmware:-:*:*:*:*:*:*:*|cpe:2.3:h:hikvision:ds-k1t671:-:*:*:*:*:*:*:*|cpe:2.3:o:hikvision:ds-k1t671m_firmware:-:*:*:*:*:*:*:*|cpe:2.3:h:hikvision:ds-k1t671m:-:*:*:*:*:*:*:*|cpe:2.3:o:hikvision:ds-k1t671mf_firmware:-:*:*:*:*:*:*:*|cpe:2.3:h:hikvision:ds-k1t671mf:-:*:*:*:*:*:*:*|cpe:2.3:o:hikvision:ds-k1t671t_firmware:-:*:*:*:*:*:*:*|cpe:2.3:h:hikvision:ds-k1t671t:-:*:*:*:*:*:*:*|cpe:2.3:o:hikvision:ds-k1t671tm_firmware:-:*:*:*:*:*:*:*|cpe:2.3:h:hikvision:ds-k1t671tm:-:*:*:*:*:*:*:*|cpe:2.3:o:hikvision:ds-k1t671tm-3xf_firmware:-:*:*:*:*:*:*:*|cpe:2.3:h:hikvision:ds-k1t671tm-3xf:-:*:*:*:*:*:*:*|cpe:2.3:o:hikvision:ds-k1t671tmf_firmware:-:*:*:*:*:*:*:*|cpe:2.3:h:hikvision:ds-k1t671tmf:-:*:*:*:*:*:*:*|cpe:2.3:o:hikvision:ds-k1t671tmfw_firmware:-:*:*:*:*:*:*:*|cpe:2.3:h:hikvision:ds-k1t671tmfw:-:*:*:*:*:*:*:*|cpe:2.3:o:hikvision:ds-k1t671tmw_firmware:-:*:*:*:*:*:*:*|cpe:2.3:h:hikvision:ds-k1t671tmw:-:*:*:*:*:*:*:*|cpe:2.3:o:hikvision:ds-k1t804af_firmware:-:*:*:*:*:*:*:*|cpe:2.3:h:hikvision:ds-k1t804af:-:*:*:*:*:*:*:*|cpe:2.3:o:hikvision:ds-k1t804amf_firmware:-:*:*:*:*:*:*:*|cpe:2.3:h:hikvision:ds-k1t804amf:-:*:*:*:*:*:*:*,vendor_only,2023-06-15,7.5,3.1,CWE-284|CWE-384,Maybe,Low,Vendor produces both consumer and commercial/NVR-DVR camera lines; cannot tell from CPE/description whether this model is one a typical home user would deploy.,Yes,High,,No,High,,Yes,
C:Maybe/Low  X:Yes/High  G:No/High,judgments not unanimous,CVE-2023-28810,Some access control/intercom products have unauthorized modification of device network configuration vulnerabilities. Attackers can modify device network configuration by sending specific data packets to the vulnerable interface within the same local network.,cpe:2.3:o:hikvision:ds-k1t804af_firmware:*:*:*:*:*:*:*:*|cpe:2.3:h:hikvision:ds-k1t804af:-:*:*:*:*:*:*:*|cpe:2.3:o:hikvision:ds-k1t804amf_firmware:*:*:*:*:*:*:*:*|cpe:2.3:h:hikvision:ds-k1t804amf:-:*:*:*:*:*:*:*|cpe:2.3:o:hikvision:ds-k1t341am_firmware:*:*:*:*:*:*:*:*|cpe:2.3:h:hikvision:ds-k1t341am:-:*:*:*:*:*:*:*|cpe:2.3:o:hikvision:ds-k1t341amf_firmware:*:*:*:*:*:*:*:*|cpe:2.3:h:hikvision:ds-k1t341amf:-:*:*:*:*:*:*:*|cpe:2.3:o:hikvision:ds-k1t671m_firmware:*:*:*:*:*:*:*:*|cpe:2.3:h:hikvision:ds-k1t671m:-:*:*:*:*:*:*:*|cpe:2.3:o:hikvision:ds-k1t671mf_firmware:*:*:*:*:*:*:*:*|cpe:2.3:h:hikvision:ds-k1t671mf:-:*:*:*:*:*:*:*|cpe:2.3:o:hikvision:ds-k1t671_firmware:*:*:*:*:*:*:*:*|cpe:2.3:h:hikvision:ds-k1t671:-:*:*:*:*:*:*:*|cpe:2.3:o:hikvision:ds-k1t343efwx_firmware:*:*:*:*:*:*:*:*|cpe:2.3:h:hikvision:ds-k1t343efwx:-:*:*:*:*:*:*:*|cpe:2.3:o:hikvision:ds-k1t343efx_firmware:*:*:*:*:*:*:*:*|cpe:2.3:h:hikvision:ds-k1t343efx:-:*:*:*:*:*:*:*|cpe:2.3:o:hikvision:ds-k1t343ewx_firmware:*:*:*:*:*:*:*:*|cpe:2.3:h:hikvision:ds-k1t343ewx:-:*:*:*:*:*:*:*|cpe:2.3:o:hikvision:ds-k1t343ex_firmware:*:*:*:*:*:*:*:*|cpe:2.3:h:hikvision:ds-k1t343ex:-:*:*:*:*:*:*:*|cpe:2.3:o:hikvision:ds-k1t343mfwx_firmware:*:*:*:*:*:*:*:*|cpe:2.3:h:hikvision:ds-k1t343mfwx:-:*:*:*:*:*:*:*|cpe:2.3:o:hikvision:ds-k1t343mfx_firmware:*:*:*:*:*:*:*:*|cpe:2.3:h:hikvision:ds-k1t343mfx:-:*:*:*:*:*:*:*|cpe:2.3:o:hikvision:ds-k1t343mwx_firmware:*:*:*:*:*:*:*:*|cpe:2.3:h:hikvision:ds-k1t343mwx:-:*:*:*:*:*:*:*|cpe:2.3:o:hikvision:ds-k1t343mx_firmware:*:*:*:*:*:*:*:*|cpe:2.3:h:hikvision:ds-k1t343mx:-:*:*:*:*:*:*:*|cpe:2.3:o:hikvision:ds-k1t341c_firmware:*:*:*:*:*:*:*:*|cpe:2.3:h:hikvision:ds-k1t341c:-:*:*:*:*:*:*:*|cpe:2.3:o:hikvision:ds-k1t320efwx_firmware:*:*:*:*:*:*:*:*|cpe:2.3:h:hikvision:ds-k1t320efwx:-:*:*:*:*:*:*:*|cpe:2.3:o:hikvision:ds-k1t320efx_firmware:*:*:*:*:*:*:*:*|cpe:2.3:h:hikvision:ds-k1t320efx:-:*:*:*:*:*:*:*|cpe:2.3:o:hikvision:ds-k1t320ewx_firmware:*:*:*:*:*:*:*:*|cpe:2.3:h:hikvision:ds-k1t320ewx:-:*:*:*:*:*:*:*|cpe:2.3:o:hikvision:ds-k1t320ex_firmware:*:*:*:*:*:*:*:*|cpe:2.3:h:hikvision:ds-k1t320ex:-:*:*:*:*:*:*:*|cpe:2.3:o:hikvision:ds-k1t320mfwx_firmware:*:*:*:*:*:*:*:*|cpe:2.3:h:hikvision:ds-k1t320mfwx:-:*:*:*:*:*:*:*|cpe:2.3:o:hikvision:ds-k1t320mfx_firmware:*:*:*:*:*:*:*:*|cpe:2.3:h:hikvision:ds-k1t320mfx:-:*:*:*:*:*:*:*|cpe:2.3:o:hikvision:ds-k1t320mwx_firmware:*:*:*:*:*:*:*:*|cpe:2.3:h:hikvision:ds-k1t320mwx:-:*:*:*:*:*:*:*|cpe:2.3:o:hikvision:ds-k1t320mx_firmware:*:*:*:*:*:*:*:*|cpe:2.3:h:hikvision:ds-k1t320mx:-:*:*:*:*:*:*:*|cpe:2.3:o:hikvision:ds-kh6320-wte1_firmware:*:*:*:*:*:*:*:*|cpe:2.3:h:hikvision:ds-kh6320-wte1:-:*:*:*:*:*:*:*|cpe:2.3:o:hikvision:ds-kh6350-wte1_firmware:*:*:*:*:*:*:*:*|cpe:2.3:h:hikvision:ds-kh6350-wte1:-:*:*:*:*:*:*:*|cpe:2.3:o:hikvision:ds-kh6351-te1_firmware:*:*:*:*:*:*:*:*|cpe:2.3:h:hikvision:ds-kh6351-te1:-:*:*:*:*:*:*:*|cpe:2.3:o:hikvision:ds-kh6351-wte1_firmware:*:*:*:*:*:*:*:*|cpe:2.3:h:hikvision:ds-kh6351-wte1:-:*:*:*:*:*:*:*|cpe:2.3:o:hikvision:ds-kh6320-le1_firmware:*:*:*:*:*:*:*:*|cpe:2.3:h:hikvision:ds-kh6320-le1:-:*:*:*:*:*:*:*|cpe:2.3:o:hikvision:ds-kh63le1\(b\)_firmware:*:*:*:*:*:*:*:*|cpe:2.3:h:hikvision:ds-kh63le1\(b\):-:*:*:*:*:*:*:*|cpe:2.3:o:hikvision:ds-kh6320-tde1_firmware:*:*:*:*:*:*:*:*|cpe:2.3:h:hikvision:ds-kh6320-tde1:-:*:*:*:*:*:*:*|cpe:2.3:o:hikvision:ds-kh6320-te1_firmware:*:*:*:*:*:*:*:*|cpe:2.3:h:hikvision:ds-kh6320-te1:-:*:*:*:*:*:*:*|cpe:2.3:o:hikvision:ds-kh6320-wtde1_firmware:*:*:*:*:*:*:*:*|cpe:2.3:h:hikvision:ds-kh6320-wtde1:-:*:*:*:*:*:*:*|cpe:2.3:o:hikvision:ds-kh8520-wte1_firmware:*:*:*:*:*:*:*:*|cpe:2.3:h:hikvision:ds-kh8520-wte1:-:*:*:*:*:*:*:*|cpe:2.3:o:hikvision:ds-kh6220-le1_firmware:*:*:*:*:*:*:*:*|cpe:2.3:h:hikvision:ds-kh6220-le1:-:*:*:*:*:*:*:*|cpe:2.3:o:hikvision:ds-kh9310-wte1\(b\)_firmware:*:*:*:*:*:*:*:*|cpe:2.3:h:hikvision:ds-kh9310-wte1\(b\):-:*:*:*:*:*:*:*|cpe:2.3:o:hikvision:ds-kh9510-wte1\(b\)_firmware:*:*:*:*:*:*:*:*|cpe:2.3:h:hikvision:ds-kh9510-wte1\(b\):-:*:*:*:*:*:*:*,vendor_only,2023-06-15,4.3,3.1,CWE-284,Maybe,Low,Vendor produces both consumer and commercial/NVR-DVR camera lines; cannot tell from CPE/description whether this model is one a typical home user would deploy.,Yes,High,,No,High,,Yes,
C:No/High  X:No/High  G:Yes/High,judgments not unanimous,CVE-2023-32220,Milesight NCR/camera version 71.8.0.6-r5 allows authentication bypass through an unspecified method.,cpe:2.3:o:milesight:ncr\/camera_firmware:71.8.0.6-r5:*:*:*:*:*:*:*|cpe:2.3:h:milesight:ncr\/camera:-:*:*:*:*:*:*:*,vendor_only,2023-06-12,9.8,3.1,CWE-287|CWE-863,No,High,"Milesight NCR/camera is a professional/commercial network camera/recorder, not a consumer home device.",No,High,,Yes,High,,No,
C:Maybe/Low  X:No/High  G:No/Low,judgments not unanimous,CVE-2023-0954,A debug feature in Sensormatic Electronics Illustra Pro Gen 4 Dome and PTZ cameras allows a user to compromise credentials after a long period of sustained attack.,cpe:2.3:o:johnsoncontrols:illustra_pro_gen_4_dome_firmware:*:*:*:*:*:*:*:*|cpe:2.3:h:johnsoncontrols:illustra_pro_gen_4_dome:-:*:*:*:*:*:*:*|cpe:2.3:o:johnsoncontrols:illustra_pro_gen_4_ptz_firmware:*:*:*:*:*:*:*:*|cpe:2.3:h:johnsoncontrols:illustra_pro_gen_4_ptz:-:*:*:*:*:*:*:*,vendor_only,2023-06-08,9.8,3.1,CWE-489,Maybe,Low,Unrecognized vendor but the description references a camera/surveillance device; home vs commercial deployment is unclear.,No,High,,No,Low,"Sensormatic Electronics and Illustra Pro are enterprise-grade security systems typically deployed in commercial or industrial environments, not private residences.",No,vendor makes stuff exclusively for professional deployments
C:No/High  X:No/High  G:Yes/High,judgments not unanimous,CVE-2023-24505,"
Milesight NCR/camera version 71.8.0.6-r5 discloses sensitive information through an unspecified request. 

",cpe:2.3:o:milesight:ncr\/camera_firmware:71.8.0.6-r5:*:*:*:*:*:*:*|cpe:2.3:h:milesight:ncr\/camera:-:*:*:*:*:*:*:*,vendor_only,2023-05-08,7.5,3.1,CWE-200|CWE-863,No,High,"Milesight NCR/camera is a professional/commercial network camera/recorder, not a consumer home device.",No,High,,Yes,High,,No,
C:No/High  X:No/High  G:Yes/High,judgments not unanimous,CVE-2023-24506,"


Milesight NCR/camera version 71.8.0.6-r5 exposes credentials through an unspecified request. 

 

",cpe:2.3:o:milesight:ncr\/camera_firmware:71.8.0.6-r5:*:*:*:*:*:*:*|cpe:2.3:h:milesight:ncr\/camera:-:*:*:*:*:*:*:*,vendor_only,2023-05-08,7.5,3.1,CWE-522,No,High,"Milesight NCR/camera is a professional/commercial network camera/recorder, not a consumer home device.",No,High,,Yes,High,,No,
C:No/Low  X:No/High  G:Yes/High,judgments not unanimous,CVE-2024-51346,An issue in Eufy Homebase 2 version 3.3.4.1h allows a local attacker to obtain sensitive information via the cryptographic scheme.,,vendor_only,2026-03-25,7.7,3.1,CWE-330,No,Low,No CPE and no camera signal in the description; cannot tie this to a home camera.,No,High,,Yes,High,,Yes,
C:No/Low  X:No/High  G:Yes/High,judgments not unanimous,CVE-2024-56898,"Broken access control vulnerability in Geovision GV-ASWeb with version v6.1.0.0 or less. This vulnerability allows low privilege users perform actions that they aren't authorized to, which can be leveraged to escalate privileges, create, modify or delete accounts.",,vendor_only,2025-02-03,8.8,3.1,CWE-284,No,Low,No CPE and no camera signal in the description; cannot tie this to a home camera.,No,High,,Yes,High,,No,
C:No/Low  X:No/High  G:Yes/High,judgments not unanimous,CVE-2024-56901,A Cross-Site Request Forgery (CSRF) vulnerability in Geovision GV-ASWeb application with the version 6.1.1.0 or less that allows attackers to arbitrarily create Administrator accounts via a crafted GET request method. This vulnerability is used in chain with CVE-2024-56903 for a successful CSRF attack.,,vendor_only,2025-02-03,8.8,3.1,CWE-352,No,Low,No CPE and no camera signal in the description; cannot tie this to a home camera.,No,High,,Yes,High,,No,
C:No/Low  X:No/High  G:Yes/High,judgments not unanimous,CVE-2024-56903,"Geovision GV-ASWeb with the version 6.1.1.0 or less allows attackers to modify POST request method with the GET against critical functionalities, such as account management. This vulnerability is used in chain with CVE-2024-56901 for a successful CSRF attack.",,vendor_only,2025-02-03,8.1,3.1,CWE-352,No,Low,No CPE and no camera signal in the description; cannot tie this to a home camera.,No,High,,Yes,High,,No,
C:No/Low  X:No/High  G:Yes/High,judgments not unanimous,CVE-2024-12984,"A vulnerability classified as problematic has been found in Amcrest IP2M-841B, IP2M-841W, IPC-IP2M-841B, IPC-IP3M-943B, IPC-IP3M-943S, IPC-IP3M-HX2B and IPC-IPM-721S up to 20241211. This affects an unknown part of the file /web_caps/webCapsConfig of the component Web Interface. The manipulation leads to information disclosure. It is possible to initiate the attack remotely. The exploit has been disclosed to the public and may be used. The vendor was contacted early about this disclosure but did not respond in any way.",,vendor_only,2024-12-27,5.3,3.1,CWE-200|CWE-284,No,Low,No CPE and no camera signal in the description; cannot tie this to a home camera.,No,High,,Yes,High,,Yes,
C:No/High  X:No/High  G:Yes/High,judgments not unanimous,CVE-2024-11120,"Certain EOL GeoVision devices have an OS Command Injection vulnerability. Unauthenticated remote attackers can exploit this vulnerability to inject and execute arbitrary system commands on the device. Moreover, this vulnerability has already been exploited by attackers, and we have received related reports.",cpe:2.3:o:geovision:gv-vs12_firmware:-:*:*:*:*:*:*:*|cpe:2.3:h:geovision:gv-vs12:-:*:*:*:*:*:*:*|cpe:2.3:o:geovision:gv-vs11_firmware:-:*:*:*:*:*:*:*|cpe:2.3:h:geovision:gv-vs11:-:*:*:*:*:*:*:*|cpe:2.3:o:geovision:gv-dsp_lpr_firmware:-:*:*:*:*:*:*:*|cpe:2.3:h:geovision:gv-dsp_lpr:3.0:*:*:*:*:*:*:*|cpe:2.3:o:geovision:gvlx_4_firmware:-:*:*:*:*:*:*:*|cpe:2.3:h:geovision:gvlx_4:2.0:*:*:*:*:*:*:*|cpe:2.3:h:geovision:gvlx_4:3.0:*:*:*:*:*:*:*,vendor_only,2024-11-15,9.8,3.1,CWE-78,No,High,"The affected GeoVision EOL devices (GV-VS video servers, GV-DSP LPR units) are commercial/industrial surveillance gear, not consumer home cameras.",No,High,,Yes,High,,No,
C:Maybe/Low  X:Yes/High  G:No/High,judgments not unanimous,CVE-2024-47485,"There is a CSV injection vulnerability in some HikCentral Master Lite versions. If exploited, an attacker could build malicious data to generate executable commands in the CSV file.",cpe:2.3:a:hikvision:hikcentral_master:*:*:*:*:lite:*:*:*,vendor_only,2024-10-18,9.8,3.1,CWE-1236,Maybe,Low,Vendor produces both consumer and commercial/NVR-DVR camera lines; cannot tell from CPE/description whether this model is one a typical home user would deploy.,Yes,High,,No,High,,Yes,
C:Maybe/Low  X:Yes/High  G:No/High,judgments not unanimous,CVE-2024-47486,"There is an XSS vulnerability in some HikCentral Master Lite versions. If exploited, an attacker could inject scripts into certain pages by building malicious data.",cpe:2.3:a:hikvision:hikcentral_master:*:*:*:*:lite:*:*:*,vendor_only,2024-10-18,6.1,3.1,CWE-79,Maybe,Low,Vendor produces both consumer and commercial/NVR-DVR camera lines; cannot tell from CPE/description whether this model is one a typical home user would deploy.,Yes,High,,No,High,,Yes,
C:Maybe/Low  X:Yes/High  G:No/High,judgments not unanimous,CVE-2024-47487,There is a SQL injection vulnerability in some HikCentral Professional versions. This could allow an authenticated user to execute arbitrary SQL queries.,cpe:2.3:a:hikvision:hikcentral_professional:*:*:*:*:*:*:*:*,vendor_only,2024-10-18,8.8,3.1,CWE-89,Maybe,Low,Vendor produces both consumer and commercial/NVR-DVR camera lines; cannot tell from CPE/description whether this model is one a typical home user would deploy.,Yes,High,,No,High,,Yes,
C:No/Low  X:No/High  G:Yes/High,judgments not unanimous,CVE-2024-48799,An issue in LOREX TECHNOLOGY INC com.lorexcorp.lorexping 1.4.22 allows a remote attacker to obtain sensitive information via the firmware update process.,,vendor_only,2024-10-14,7.5,3.1,CWE-200,No,Low,No CPE and no camera signal in the description; cannot tie this to a home camera.,No,High,,Yes,High,,No,vendor used for professional deployments only
C:Maybe/Low  X:Yes/High  G:Yes/High,judgments not unanimous,CVE-2024-7439,** UNSUPPORTED WHEN ASSIGNED ** A vulnerability was found in Vivotek CC8160 VVTK-0100d and classified as critical. Affected by this issue is the function read of the component httpd. The manipulation of the argument Content-Length leads to stack-based buffer overflow. The attack may be launched remotely. The exploit has been disclosed to the public and may be used. The identifier of this vulnerability is VDB-273524. NOTE: This vulnerability only affects products that are no longer supported by the maintainer. NOTE: Vendor was contacted early and confirmed that the affected release tree is end-of-life.,cpe:2.3:o:vivotek:cc8160_firmware:-:*:*:*:*:*:*:*|cpe:2.3:h:vivotek:cc8160:-:*:*:*:*:*:*:*,vendor_only,2024-08-03,9.8,3.1,CWE-121|CWE-119,Maybe,Low,Vendor produces both consumer and commercial/NVR-DVR camera lines; cannot tell from CPE/description whether this model is one a typical home user would deploy.,Yes,High,,Yes,High,,Yes,
