Difference Type,cve_id,published,description,cvss_score,cvss_version,cwe_ids,cpe_strings
keyword_only,CVE-2020-14033,2020-06-15,An issue was discovered in janus-gateway (aka Janus WebRTC Server) through 0.10.0. janus_streaming_rtsp_parse_sdp in plugins/janus_streaming.c has a Buffer Overflow via a crafted RTSP server.,9.8,3.1,CWE-120,cpe:2.3:a:meetecho:janus:*:*:*:*:*:*:*:*
keyword_only,CVE-2020-16096,2020-09-15,"In Gallagher Command Centre versions 8.10 prior to 8.10.1134(MR4), 8.00 prior to 8.00.1161(MR5), 7.90 prior to 7.90.991(MR5), 7.80 prior to 7.80.960(MR2), 7.70 and earlier, any operator account has access to all data that would be replicated if the system were to be (or is) attached to a multi-server environment. This can include plain text credentials for DVR systems and card details used for physical access/alarm/perimeter components.",7.7,3.1,CWE-285,cpe:2.3:a:gallagher:command_centre:*:*:*:*:*:*:*:*|cpe:2.3:a:gallagher:command_centre:7.80.960:-:*:*:*:*:*:*|cpe:2.3:a:gallagher:command_centre:7.90.991:-:*:*:*:*:*:*|cpe:2.3:a:gallagher:command_centre:8.00.1161:-:*:*:*:*:*:*|cpe:2.3:a:gallagher:command_centre:8.10.1134:-:*:*:*:*:*:*
keyword_only,CVE-2020-15956,2020-08-04,ActiveMediaServer.exe in ACTi NVR3 Standard Server 3.0.12.42 allows remote unauthenticated attackers to trigger a buffer overflow and application termination via a malformed payload.,7.5,3.1,CWE-120,cpe:2.3:a:acti:nvr:2.3.04.07:*:*:*:professional:*:*:*|cpe:2.3:a:acti:nvr:3.0.12.42:*:*:*:standard:*:*:*
keyword_only,CVE-2020-24027,2021-01-11,"In Live Networks, Inc., liblivemedia version 20200625, there is a potential buffer overflow bug in the server handling of a RTSP ""PLAY"" command, when the command specifies seeking by absolute time.",9.8,3.1,CWE-787,cpe:2.3:a:live555:liblivemedia:20200625:*:*:*:*:*:*:*
keyword_only,CVE-2020-26097,2020-11-18,"The firmware of the PLANET Technology Corp NVR-915 and NVR-1615 before 2020-10-28 embeds default credentials for root access via telnet. By exposing telnet on the Internet, remote root access on the device is possible. NOTE: This vulnerability only affects products that are no longer supported by the maintainer",9.8,3.1,CWE-798,cpe:2.3:o:planet:nvr-915_firmware:-:*:*:*:*:*:*:*|cpe:2.3:h:planet:nvr-915:-:*:*:*:*:*:*:*|cpe:2.3:o:planet:nvr-1615_firmware:-:*:*:*:*:*:*:*|cpe:2.3:h:planet:nvr-1615:-:*:*:*:*:*:*:*
keyword_only,CVE-2020-29000,2021-01-26,"An issue was discovered on Geeni GNC-CW013 doorbell 1.8.1 devices. A vulnerability exists in the RTSP service that allows a remote attacker to take full control of the device with a high-privileged account. By sending a crafted message, an attacker is able to remotely deliver a telnet session. Any attacker that has the ability to control DNS can exploit this vulnerability to remotely login to the device and gain access to the camera system.",7.2,3.1,,cpe:2.3:o:mygeeni:gnc-cw013_firmware:1.8.1:*:*:*:*:*:*:*|cpe:2.3:h:mygeeni:gnc-cw013:-:*:*:*:*:*:*:*
keyword_only,CVE-2020-10858,2021-02-05,Zulip Desktop before 5.0.0 allows attackers to perform recording via the webcam and microphone due to a missing permission request handler.,5.3,3.1,CWE-862,cpe:2.3:a:zulip:zulip_desktop:*:*:*:*:*:*:*:*
keyword_only,CVE-2021-30002,2021-04-02,"An issue was discovered in the Linux kernel before 5.11.3 when a webcam device exists. video_usercopy in drivers/media/v4l2-core/v4l2-ioctl.c has a memory leak for large arguments, aka CID-fb18802a338b.",6.2,3.1,CWE-401,cpe:2.3:o:linux:linux_kernel:*:*:*:*:*:*:*:*|cpe:2.3:o:debian:debian_linux:9.0:*:*:*:*:*:*:*
keyword_only,CVE-2021-30165,2021-04-27,The default administrator account & password of the EDIMAX wireless network camera is hard-coded. Remote attackers can disassemble firmware to obtain the privileged permission and further control the devices.,8.1,3.1,CWE-798,cpe:2.3:o:edimax:ic-3140w_firmware:3.11:*:*:*:*:*:*:*|cpe:2.3:h:edimax:ic-3140w:-:*:*:*:*:*:*:*
keyword_only,CVE-2021-30167,2021-04-28,The manage users profile services of the network camera device allows an authenticated. Remote attackers can modify URL parameters and further amend user’s information and escalate privileges to control the devices.,9.8,3.1,CWE-522|CWE-306,cpe:2.3:o:meritlilin:p2r8852e2_firmware:*:*:*:*:*:*:*:*|cpe:2.3:h:meritlilin:p2r8852e2:-:*:*:*:*:*:*:*|cpe:2.3:o:meritlilin:p2r8852e4_firmware:*:*:*:*:*:*:*:*|cpe:2.3:h:meritlilin:p2r8852e4:-:*:*:*:*:*:*:*|cpe:2.3:o:meritlilin:p2r6852e2_firmware:*:*:*:*:*:*:*:*|cpe:2.3:h:meritlilin:p2r6852e2:-:*:*:*:*:*:*:*|cpe:2.3:o:meritlilin:p2r6852e4_firmware:*:*:*:*:*:*:*:*|cpe:2.3:h:meritlilin:p2r6852e4:-:*:*:*:*:*:*:*|cpe:2.3:o:meritlilin:p2r6552e2_firmware:*:*:*:*:*:*:*:*|cpe:2.3:h:meritlilin:p2r6552e2:-:*:*:*:*:*:*:*|cpe:2.3:o:meritlilin:p2r6552e4_firmware:*:*:*:*:*:*:*:*|cpe:2.3:h:meritlilin:p2r6552e4:-:*:*:*:*:*:*:*|cpe:2.3:o:meritlilin:p2r6352ae2_firmware:*:*:*:*:*:*:*:*|cpe:2.3:h:meritlilin:p2r6352ae2:-:*:*:*:*:*:*:*|cpe:2.3:o:meritlilin:p2r6352ae4_firmware:*:*:*:*:*:*:*:*|cpe:2.3:h:meritlilin:p2r6352ae4:-:*:*:*:*:*:*:*|cpe:2.3:o:meritlilin:p2r3052ae2_firmware:*:*:*:*:*:*:*:*|cpe:2.3:h:meritlilin:p2r3052ae2:-:*:*:*:*:*:*:*|cpe:2.3:o:meritlilin:p2g1052_firmware:*:*:*:*:*:*:*:*|cpe:2.3:h:meritlilin:p2g1052:-:*:*:*:*:*:*:*|cpe:2.3:o:meritlilin:p2r8822e2_firmware:*:*:*:*:*:*:*:*|cpe:2.3:h:meritlilin:p2r8822e2:-:*:*:*:*:*:*:*|cpe:2.3:o:meritlilin:p2r8822e4_firmware:*:*:*:*:*:*:*:*|cpe:2.3:h:meritlilin:p2r8822e4:-:*:*:*:*:*:*:*|cpe:2.3:o:meritlilin:p2r6822e2_firmware:*:*:*:*:*:*:*:*|cpe:2.3:h:meritlilin:p2r6822e2:-:*:*:*:*:*:*:*|cpe:2.3:o:meritlilin:p2r6822e4_firmware:*:*:*:*:*:*:*:*|cpe:2.3:h:meritlilin:p2r6822e4:-:*:*:*:*:*:*:*|cpe:2.3:o:meritlilin:p2r6522e2_firmware:*:*:*:*:*:*:*:*|cpe:2.3:h:meritlilin:p2r6522e2:-:*:*:*:*:*:*:*|cpe:2.3:o:meritlilin:p2r6522e4_firmware:*:*:*:*:*:*:*:*|cpe:2.3:h:meritlilin:p2r6522e4:-:*:*:*:*:*:*:*|cpe:2.3:o:meritlilin:p2r6322ae2_firmware:*:*:*:*:*:*:*:*|cpe:2.3:h:meritlilin:p2r6322ae2:-:*:*:*:*:*:*:*|cpe:2.3:o:meritlilin:p2r6322ae4_firmware:*:*:*:*:*:*:*:*|cpe:2.3:h:meritlilin:p2r6322ae4:-:*:*:*:*:*:*:*|cpe:2.3:o:meritlilin:p2r3022ae2_firmware:*:*:*:*:*:*:*:*|cpe:2.3:h:meritlilin:p2r3022ae2:-:*:*:*:*:*:*:*|cpe:2.3:o:meritlilin:p2g1022_firmware:*:*:*:*:*:*:*:*|cpe:2.3:h:meritlilin:p2g1022:-:*:*:*:*:*:*:*|cpe:2.3:o:meritlilin:p2g1022x_firmware:*:*:*:*:*:*:*:*|cpe:2.3:h:meritlilin:p2g1022x:-:*:*:*:*:*:*:*|cpe:2.3:o:meritlilin:z2r8852ax_firmware:*:*:*:*:*:*:*:*|cpe:2.3:h:meritlilin:z2r8852ax:-:*:*:*:*:*:*:*|cpe:2.3:o:meritlilin:z2r8152x-p_firmware:*:*:*:*:*:*:*:*|cpe:2.3:h:meritlilin:z2r8152x-p:-:*:*:*:*:*:*:*|cpe:2.3:o:meritlilin:z2r8152x2-p_firmware:*:*:*:*:*:*:*:*|cpe:2.3:h:meritlilin:z2r8152x2-p:-:*:*:*:*:*:*:*|cpe:2.3:o:meritlilin:z2r8052ex25_firmware:*:*:*:*:*:*:*:*|cpe:2.3:h:meritlilin:z2r8052ex25:-:*:*:*:*:*:*:*|cpe:2.3:o:meritlilin:z2r6552x_firmware:*:*:*:*:*:*:*:*|cpe:2.3:h:meritlilin:z2r6552x:-:*:*:*:*:*:*:*|cpe:2.3:o:meritlilin:z2r6452ax_firmware:*:*:*:*:*:*:*:*|cpe:2.3:h:meritlilin:z2r6452ax:-:*:*:*:*:*:*:*|cpe:2.3:o:meritlilin:z2r6452ax-p_firmware:*:*:*:*:*:*:*:*|cpe:2.3:h:meritlilin:z2r6452ax-p:-:*:*:*:*:*:*:*|cpe:2.3:o:meritlilin:z2r8822ax_firmware:*:*:*:*:*:*:*:*|cpe:2.3:h:meritlilin:z2r8822ax:-:*:*:*:*:*:*:*|cpe:2.3:o:meritlilin:z2r8122x-p_firmware:*:*:*:*:*:*:*:*|cpe:2.3:h:meritlilin:z2r8122x-p:-:*:*:*:*:*:*:*|cpe:2.3:o:meritlilin:z2r8122x2-p_firmware:*:*:*:*:*:*:*:*|cpe:2.3:h:meritlilin:z2r8122x2-p:-:*:*:*:*:*:*:*|cpe:2.3:o:meritlilin:z2r8022ex25_firmware:*:*:*:*:*:*:*:*|cpe:2.3:h:meritlilin:z2r8022ex25:-:*:*:*:*:*:*:*|cpe:2.3:o:meritlilin:z2r6522x_firmware:*:*:*:*:*:*:*:*|cpe:2.3:h:meritlilin:z2r6522x:-:*:*:*:*:*:*:*|cpe:2.3:o:meritlilin:z2r6422ax_firmware:*:*:*:*:*:*:*:*|cpe:2.3:h:meritlilin:z2r6422ax:-:*:*:*:*:*:*:*|cpe:2.3:o:meritlilin:z2r6422ax-p_firmware:*:*:*:*:*:*:*:*|cpe:2.3:h:meritlilin:z2r6422ax-p:-:*:*:*:*:*:*:*|cpe:2.3:o:meritlilin:p3r6322e2_firmware:*:*:*:*:*:*:*:*|cpe:2.3:h:meritlilin:p3r6322e2:-:*:*:*:*:*:*:*|cpe:2.3:o:meritlilin:p3r6522e2_firmware:*:*:*:*:*:*:*:*|cpe:2.3:h:meritlilin:p3r6522e2:-:*:*:*:*:*:*:*|cpe:2.3:o:meritlilin:p3r8822e2_firmware:*:*:*:*:*:*:*:*|cpe:2.3:h:meritlilin:p3r8822e2:-:*:*:*:*:*:*:*|cpe:2.3:o:meritlilin:z3r6422x3_firmware:*:*:*:*:*:*:*:*|cpe:2.3:h:meritlilin:z3r6422x3:-:*:*:*:*:*:*:*|cpe:2.3:o:meritlilin:z3r6522x_firmware:*:*:*:*:*:*:*:*|cpe:2.3:h:meritlilin:z3r6522x:-:*:*:*:*:*:*:*|cpe:2.3:o:meritlilin:z3r8922x3_firmware:*:*:*:*:*:*:*:*|cpe:2.3:h:meritlilin:z3r8922x3:-:*:*:*:*:*:*:*
keyword_only,CVE-2021-30168,2021-04-28,The sensitive information of webcam device is not properly protected. Remote attackers can unauthentically grant administrator’s credential and further control the devices.,9.8,3.1,CWE-200|CWE-522,cpe:2.3:o:meritlilin:p2r8852e2_firmware:*:*:*:*:*:*:*:*|cpe:2.3:h:meritlilin:p2r8852e2:-:*:*:*:*:*:*:*|cpe:2.3:o:meritlilin:p2r8852e4_firmware:*:*:*:*:*:*:*:*|cpe:2.3:h:meritlilin:p2r8852e4:-:*:*:*:*:*:*:*|cpe:2.3:o:meritlilin:p2r6852e2_firmware:*:*:*:*:*:*:*:*|cpe:2.3:h:meritlilin:p2r6852e2:-:*:*:*:*:*:*:*|cpe:2.3:o:meritlilin:p2r6852e4_firmware:*:*:*:*:*:*:*:*|cpe:2.3:h:meritlilin:p2r6852e4:-:*:*:*:*:*:*:*|cpe:2.3:o:meritlilin:p2r6552e2_firmware:*:*:*:*:*:*:*:*|cpe:2.3:h:meritlilin:p2r6552e2:-:*:*:*:*:*:*:*|cpe:2.3:o:meritlilin:p2r6552e4_firmware:*:*:*:*:*:*:*:*|cpe:2.3:h:meritlilin:p2r6552e4:-:*:*:*:*:*:*:*|cpe:2.3:o:meritlilin:p2r6352ae2_firmware:*:*:*:*:*:*:*:*|cpe:2.3:h:meritlilin:p2r6352ae2:-:*:*:*:*:*:*:*|cpe:2.3:o:meritlilin:p2r6352ae4_firmware:*:*:*:*:*:*:*:*|cpe:2.3:h:meritlilin:p2r6352ae4:-:*:*:*:*:*:*:*|cpe:2.3:o:meritlilin:p2r3052ae2_firmware:*:*:*:*:*:*:*:*|cpe:2.3:h:meritlilin:p2r3052ae2:-:*:*:*:*:*:*:*|cpe:2.3:o:meritlilin:p2g1052_firmware:*:*:*:*:*:*:*:*|cpe:2.3:h:meritlilin:p2g1052:-:*:*:*:*:*:*:*|cpe:2.3:o:meritlilin:p2r8822e2_firmware:*:*:*:*:*:*:*:*|cpe:2.3:h:meritlilin:p2r8822e2:-:*:*:*:*:*:*:*|cpe:2.3:o:meritlilin:p2r8822e4_firmware:*:*:*:*:*:*:*:*|cpe:2.3:h:meritlilin:p2r8822e4:-:*:*:*:*:*:*:*|cpe:2.3:o:meritlilin:p2r6822e2_firmware:*:*:*:*:*:*:*:*|cpe:2.3:h:meritlilin:p2r6822e2:-:*:*:*:*:*:*:*|cpe:2.3:o:meritlilin:p2r6822e4_firmware:*:*:*:*:*:*:*:*|cpe:2.3:h:meritlilin:p2r6822e4:-:*:*:*:*:*:*:*|cpe:2.3:o:meritlilin:p2r6522e2_firmware:*:*:*:*:*:*:*:*|cpe:2.3:h:meritlilin:p2r6522e2:-:*:*:*:*:*:*:*|cpe:2.3:o:meritlilin:p2r6522e4_firmware:*:*:*:*:*:*:*:*|cpe:2.3:h:meritlilin:p2r6522e4:-:*:*:*:*:*:*:*|cpe:2.3:o:meritlilin:p2r6322ae2_firmware:*:*:*:*:*:*:*:*|cpe:2.3:h:meritlilin:p2r6322ae2:-:*:*:*:*:*:*:*|cpe:2.3:o:meritlilin:p2r6322ae4_firmware:*:*:*:*:*:*:*:*|cpe:2.3:h:meritlilin:p2r6322ae4:-:*:*:*:*:*:*:*|cpe:2.3:o:meritlilin:p2r3022ae2_firmware:*:*:*:*:*:*:*:*|cpe:2.3:h:meritlilin:p2r3022ae2:-:*:*:*:*:*:*:*|cpe:2.3:o:meritlilin:p2g1022_firmware:*:*:*:*:*:*:*:*|cpe:2.3:h:meritlilin:p2g1022:-:*:*:*:*:*:*:*|cpe:2.3:o:meritlilin:p2g1022x_firmware:*:*:*:*:*:*:*:*|cpe:2.3:h:meritlilin:p2g1022x:-:*:*:*:*:*:*:*|cpe:2.3:o:meritlilin:z2r8852ax_firmware:*:*:*:*:*:*:*:*|cpe:2.3:h:meritlilin:z2r8852ax:-:*:*:*:*:*:*:*|cpe:2.3:o:meritlilin:z2r8152x-p_firmware:*:*:*:*:*:*:*:*|cpe:2.3:h:meritlilin:z2r8152x-p:-:*:*:*:*:*:*:*|cpe:2.3:o:meritlilin:z2r8152x2-p_firmware:*:*:*:*:*:*:*:*|cpe:2.3:h:meritlilin:z2r8152x2-p:-:*:*:*:*:*:*:*|cpe:2.3:o:meritlilin:z2r8052ex25_firmware:*:*:*:*:*:*:*:*|cpe:2.3:h:meritlilin:z2r8052ex25:-:*:*:*:*:*:*:*|cpe:2.3:o:meritlilin:z2r6552x_firmware:*:*:*:*:*:*:*:*|cpe:2.3:h:meritlilin:z2r6552x:-:*:*:*:*:*:*:*|cpe:2.3:o:meritlilin:z2r6452ax_firmware:*:*:*:*:*:*:*:*|cpe:2.3:h:meritlilin:z2r6452ax:-:*:*:*:*:*:*:*|cpe:2.3:o:meritlilin:z2r6452ax-p_firmware:*:*:*:*:*:*:*:*|cpe:2.3:h:meritlilin:z2r6452ax-p:-:*:*:*:*:*:*:*|cpe:2.3:o:meritlilin:z2r8822ax_firmware:*:*:*:*:*:*:*:*|cpe:2.3:h:meritlilin:z2r8822ax:-:*:*:*:*:*:*:*|cpe:2.3:o:meritlilin:z2r8122x-p_firmware:*:*:*:*:*:*:*:*|cpe:2.3:h:meritlilin:z2r8122x-p:-:*:*:*:*:*:*:*|cpe:2.3:o:meritlilin:z2r8122x2-p_firmware:*:*:*:*:*:*:*:*|cpe:2.3:h:meritlilin:z2r8122x2-p:-:*:*:*:*:*:*:*|cpe:2.3:o:meritlilin:z2r8022ex25_firmware:*:*:*:*:*:*:*:*|cpe:2.3:h:meritlilin:z2r8022ex25:-:*:*:*:*:*:*:*|cpe:2.3:o:meritlilin:z2r6522x_firmware:*:*:*:*:*:*:*:*|cpe:2.3:h:meritlilin:z2r6522x:-:*:*:*:*:*:*:*|cpe:2.3:o:meritlilin:z2r6422ax_firmware:*:*:*:*:*:*:*:*|cpe:2.3:h:meritlilin:z2r6422ax:-:*:*:*:*:*:*:*|cpe:2.3:o:meritlilin:z2r6422ax-p_firmware:*:*:*:*:*:*:*:*|cpe:2.3:h:meritlilin:z2r6422ax-p:-:*:*:*:*:*:*:*|cpe:2.3:o:meritlilin:p3r6322e2_firmware:*:*:*:*:*:*:*:*|cpe:2.3:h:meritlilin:p3r6322e2:-:*:*:*:*:*:*:*|cpe:2.3:o:meritlilin:p3r6522e2_firmware:*:*:*:*:*:*:*:*|cpe:2.3:h:meritlilin:p3r6522e2:-:*:*:*:*:*:*:*|cpe:2.3:o:meritlilin:p3r8822e2_firmware:*:*:*:*:*:*:*:*|cpe:2.3:h:meritlilin:p3r8822e2:-:*:*:*:*:*:*:*|cpe:2.3:o:meritlilin:z3r6422x3_firmware:*:*:*:*:*:*:*:*|cpe:2.3:h:meritlilin:z3r6422x3:-:*:*:*:*:*:*:*|cpe:2.3:o:meritlilin:z3r6522x_firmware:*:*:*:*:*:*:*:*|cpe:2.3:h:meritlilin:z3r6522x:-:*:*:*:*:*:*:*|cpe:2.3:o:meritlilin:z3r8922x3_firmware:*:*:*:*:*:*:*:*|cpe:2.3:h:meritlilin:z3r8922x3:-:*:*:*:*:*:*:*
keyword_only,CVE-2021-30169,2021-04-28,The sensitive information of webcam device is not properly protected. Remote attackers can unauthentically grant user’s credential.,7.5,3.1,CWE-200|CWE-522,cpe:2.3:o:meritlilin:p2r8852e2_firmware:*:*:*:*:*:*:*:*|cpe:2.3:h:meritlilin:p2r8852e2:-:*:*:*:*:*:*:*|cpe:2.3:o:meritlilin:p2r8852e4_firmware:*:*:*:*:*:*:*:*|cpe:2.3:h:meritlilin:p2r8852e4:-:*:*:*:*:*:*:*|cpe:2.3:o:meritlilin:p2r6852e2_firmware:*:*:*:*:*:*:*:*|cpe:2.3:h:meritlilin:p2r6852e2:-:*:*:*:*:*:*:*|cpe:2.3:o:meritlilin:p2r6852e4_firmware:*:*:*:*:*:*:*:*|cpe:2.3:h:meritlilin:p2r6852e4:-:*:*:*:*:*:*:*|cpe:2.3:o:meritlilin:p2r6552e2_firmware:*:*:*:*:*:*:*:*|cpe:2.3:h:meritlilin:p2r6552e2:-:*:*:*:*:*:*:*|cpe:2.3:o:meritlilin:p2r6552e4_firmware:*:*:*:*:*:*:*:*|cpe:2.3:h:meritlilin:p2r6552e4:-:*:*:*:*:*:*:*|cpe:2.3:o:meritlilin:p2r6352ae2_firmware:*:*:*:*:*:*:*:*|cpe:2.3:h:meritlilin:p2r6352ae2:-:*:*:*:*:*:*:*|cpe:2.3:o:meritlilin:p2r6352ae4_firmware:*:*:*:*:*:*:*:*|cpe:2.3:h:meritlilin:p2r6352ae4:-:*:*:*:*:*:*:*|cpe:2.3:o:meritlilin:p2r3052ae2_firmware:*:*:*:*:*:*:*:*|cpe:2.3:h:meritlilin:p2r3052ae2:-:*:*:*:*:*:*:*|cpe:2.3:o:meritlilin:p2g1052_firmware:*:*:*:*:*:*:*:*|cpe:2.3:h:meritlilin:p2g1052:-:*:*:*:*:*:*:*|cpe:2.3:o:meritlilin:p2r8822e2_firmware:*:*:*:*:*:*:*:*|cpe:2.3:h:meritlilin:p2r8822e2:-:*:*:*:*:*:*:*|cpe:2.3:o:meritlilin:p2r8822e4_firmware:*:*:*:*:*:*:*:*|cpe:2.3:h:meritlilin:p2r8822e4:-:*:*:*:*:*:*:*|cpe:2.3:o:meritlilin:p2r6822e2_firmware:*:*:*:*:*:*:*:*|cpe:2.3:h:meritlilin:p2r6822e2:-:*:*:*:*:*:*:*|cpe:2.3:o:meritlilin:p2r6822e4_firmware:*:*:*:*:*:*:*:*|cpe:2.3:h:meritlilin:p2r6822e4:-:*:*:*:*:*:*:*|cpe:2.3:o:meritlilin:p2r6522e2_firmware:*:*:*:*:*:*:*:*|cpe:2.3:h:meritlilin:p2r6522e2:-:*:*:*:*:*:*:*|cpe:2.3:o:meritlilin:p2r6522e4_firmware:*:*:*:*:*:*:*:*|cpe:2.3:h:meritlilin:p2r6522e4:-:*:*:*:*:*:*:*|cpe:2.3:o:meritlilin:p2r6322ae2_firmware:*:*:*:*:*:*:*:*|cpe:2.3:h:meritlilin:p2r6322ae2:-:*:*:*:*:*:*:*|cpe:2.3:o:meritlilin:p2r6322ae4_firmware:*:*:*:*:*:*:*:*|cpe:2.3:h:meritlilin:p2r6322ae4:-:*:*:*:*:*:*:*|cpe:2.3:o:meritlilin:p2r3022ae2_firmware:*:*:*:*:*:*:*:*|cpe:2.3:h:meritlilin:p2r3022ae2:-:*:*:*:*:*:*:*|cpe:2.3:o:meritlilin:p2g1022_firmware:*:*:*:*:*:*:*:*|cpe:2.3:h:meritlilin:p2g1022:-:*:*:*:*:*:*:*|cpe:2.3:o:meritlilin:p2g1022x_firmware:*:*:*:*:*:*:*:*|cpe:2.3:h:meritlilin:p2g1022x:-:*:*:*:*:*:*:*|cpe:2.3:o:meritlilin:z2r8852ax_firmware:*:*:*:*:*:*:*:*|cpe:2.3:h:meritlilin:z2r8852ax:-:*:*:*:*:*:*:*|cpe:2.3:o:meritlilin:z2r8152x-p_firmware:*:*:*:*:*:*:*:*|cpe:2.3:h:meritlilin:z2r8152x-p:-:*:*:*:*:*:*:*|cpe:2.3:o:meritlilin:z2r8152x2-p_firmware:*:*:*:*:*:*:*:*|cpe:2.3:h:meritlilin:z2r8152x2-p:-:*:*:*:*:*:*:*|cpe:2.3:o:meritlilin:z2r8052ex25_firmware:*:*:*:*:*:*:*:*|cpe:2.3:h:meritlilin:z2r8052ex25:-:*:*:*:*:*:*:*|cpe:2.3:o:meritlilin:z2r6552x_firmware:*:*:*:*:*:*:*:*|cpe:2.3:h:meritlilin:z2r6552x:-:*:*:*:*:*:*:*|cpe:2.3:o:meritlilin:z2r6452ax_firmware:*:*:*:*:*:*:*:*|cpe:2.3:h:meritlilin:z2r6452ax:-:*:*:*:*:*:*:*|cpe:2.3:o:meritlilin:z2r6452ax-p_firmware:*:*:*:*:*:*:*:*|cpe:2.3:h:meritlilin:z2r6452ax-p:-:*:*:*:*:*:*:*|cpe:2.3:o:meritlilin:z2r8822ax_firmware:*:*:*:*:*:*:*:*|cpe:2.3:h:meritlilin:z2r8822ax:-:*:*:*:*:*:*:*|cpe:2.3:o:meritlilin:z2r8122x-p_firmware:*:*:*:*:*:*:*:*|cpe:2.3:h:meritlilin:z2r8122x-p:-:*:*:*:*:*:*:*|cpe:2.3:o:meritlilin:z2r8122x2-p_firmware:*:*:*:*:*:*:*:*|cpe:2.3:h:meritlilin:z2r8122x2-p:-:*:*:*:*:*:*:*|cpe:2.3:o:meritlilin:z2r8022ex25_firmware:*:*:*:*:*:*:*:*|cpe:2.3:h:meritlilin:z2r8022ex25:-:*:*:*:*:*:*:*|cpe:2.3:o:meritlilin:z2r6522x_firmware:*:*:*:*:*:*:*:*|cpe:2.3:h:meritlilin:z2r6522x:-:*:*:*:*:*:*:*|cpe:2.3:o:meritlilin:z2r6422ax_firmware:*:*:*:*:*:*:*:*|cpe:2.3:h:meritlilin:z2r6422ax:-:*:*:*:*:*:*:*|cpe:2.3:o:meritlilin:z2r6422ax-p_firmware:*:*:*:*:*:*:*:*|cpe:2.3:h:meritlilin:z2r6422ax-p:-:*:*:*:*:*:*:*|cpe:2.3:o:meritlilin:p3r6322e2_firmware:*:*:*:*:*:*:*:*|cpe:2.3:h:meritlilin:p3r6322e2:-:*:*:*:*:*:*:*|cpe:2.3:o:meritlilin:p3r6522e2_firmware:*:*:*:*:*:*:*:*|cpe:2.3:h:meritlilin:p3r6522e2:-:*:*:*:*:*:*:*|cpe:2.3:o:meritlilin:p3r8822e2_firmware:*:*:*:*:*:*:*:*|cpe:2.3:h:meritlilin:p3r8822e2:-:*:*:*:*:*:*:*|cpe:2.3:o:meritlilin:z3r6422x3_firmware:*:*:*:*:*:*:*:*|cpe:2.3:h:meritlilin:z3r6422x3:-:*:*:*:*:*:*:*|cpe:2.3:o:meritlilin:z3r6522x_firmware:*:*:*:*:*:*:*:*|cpe:2.3:h:meritlilin:z3r6522x:-:*:*:*:*:*:*:*|cpe:2.3:o:meritlilin:z3r8922x3_firmware:*:*:*:*:*:*:*:*|cpe:2.3:h:meritlilin:z3r8922x3:-:*:*:*:*:*:*:*
keyword_only,CVE-2020-24918,2021-04-30,"A buffer overflow in the RTSP service of the Ambarella Oryx RTSP Server 2020-01-07 allows an unauthenticated attacker to send a crafted RTSP request, with a long digest authentication header, to execute arbitrary code in parse_authentication_header() in libamprotocol-rtsp.so.1 in rtsp_svc (or cause a crash). This allows remote takeover of a Furbo Dog Camera, for example. NOTE: The vendor states that the RTSP library is used for DEMO only, using it in product is a customer's behavior. Ambarella has emphasized that RTSP is DEMO only library, should NOT be used in product in our document. Because Ambarella's SDK is proprietary, we didn't publish our SDK source code in public network.",9.8,3.1,CWE-120,cpe:2.3:a:ambarella:oryx_rtsp_server:2020-01-07:*:*:*:*:*:*:*
keyword_only,CVE-2021-38381,2021-08-10,Live555 through 1.08 does not handle MPEG-1 or 2 files properly. Sending two successive RTSP SETUP commands for the same track causes a Use-After-Free and daemon crash.,6.5,3.1,CWE-416,cpe:2.3:a:live555:live555:*:*:*:*:*:*:*:*
keyword_only,CVE-2021-38382,2021-08-10,Live555 through 1.08 does not handle Matroska and Ogg files properly. Sending two successive RTSP SETUP commands for the same track causes a Use-After-Free and daemon crash.,6.5,3.1,CWE-416,cpe:2.3:a:live555:live555:*:*:*:*:*:*:*:*
keyword_only,CVE-2021-36199,2022-01-14,Running a vulnerability scanner against VideoEdge NVRs can cause some functionality to stop.,5.3,3.1,CWE-228,cpe:2.3:o:johnsoncontrols:videoedge:*:*:*:*:*:*:*:*
keyword_only,CVE-2022-24890,2022-05-17,"Nextcloud Talk is a video and audio conferencing app for Nextcloud. In versions prior to 13.0.5 and 14.0.0, a call moderator can indirectly enable user webcams by granting permissions, if they were enabled before removing the permissions. A patch is available in versions 13.0.5 and 14.0.0. There are currently no known workarounds.",4.3,3.1,CWE-200|CWE-359|CWE-276,cpe:2.3:a:nextcloud:talk:*:*:*:*:*:*:*:*|cpe:2.3:a:nextcloud:talk:14.0.0:beta1:*:*:*:*:*:*|cpe:2.3:a:nextcloud:talk:14.0.0:rc1:*:*:*:*:*:*|cpe:2.3:a:nextcloud:talk:14.0.0:rc2:*:*:*:*:*:*|cpe:2.3:a:nextcloud:talk:14.0.0:rc3:*:*:*:*:*:*|cpe:2.3:a:nextcloud:talk:14.0.0:rc4:*:*:*:*:*:*
keyword_only,CVE-2023-1186,2023-03-06,A vulnerability has been found in FabulaTech Webcam for Remote Desktop 2.8.42 and classified as problematic. This vulnerability affects the function 0x222010/0x222018 in the library ftwebcam.sys of the component IOCTL Handler. The manipulation leads to null pointer dereference. Attacking locally is a requirement. The exploit has been disclosed to the public and may be used. VDB-222358 is the identifier assigned to this vulnerability.,5.5,3.1,CWE-476,cpe:2.3:a:fabulatech:webcam_for_remote_desktop:2.8.42:*:*:*:*:*:*:*|cpe:2.3:o:microsoft:windows:-:*:*:*:*:*:*:*
keyword_only,CVE-2023-1187,2023-03-06,A vulnerability was found in FabulaTech Webcam for Remote Desktop 2.8.42 and classified as problematic. This issue affects some unknown processing in the library ftwebcam.sys of the component Global Variable Handler. The manipulation leads to denial of service. It is possible to launch the attack on the local host. The exploit has been disclosed to the public and may be used. The associated identifier of this vulnerability is VDB-222359.,5.5,3.1,CWE-404,cpe:2.3:a:fabulatech:webcam_for_remote_desktop:2.8.42:*:*:*:*:*:*:*|cpe:2.3:o:microsoft:windows:-:*:*:*:*:*:*:*
keyword_only,CVE-2023-1188,2023-03-06,A vulnerability was found in FabulaTech Webcam for Remote Desktop 2.8.42. It has been classified as problematic. Affected is the function 0x222018 in the library ftwebcam.sys of the component IoControlCode Handler. The manipulation leads to denial of service. The attack needs to be approached locally. The exploit has been disclosed to the public and may be used. The identifier of this vulnerability is VDB-222360.,5.5,3.1,CWE-404,cpe:2.3:a:fabulatech:webcam_for_remote_desktop:2.8.42:*:*:*:*:*:*:*|cpe:2.3:o:microsoft:windows:-:*:*:*:*:*:*:*
keyword_only,CVE-2023-30466,2023-04-28,"This vulnerability exists in Milesight 4K/H.265 Series NVR models (MS-Nxxxx-xxG, MS-Nxxxx-xxE, MS-Nxxxx-xxT, MS-Nxxxx-xxH and MS-Nxxxx-xxC), due to a weak password reset mechanism at the Milesight NVR web-based management interface. A remote attacker could exploit this vulnerability by sending a specially crafted http requests on the targeted device.

Successful exploitation of this vulnerability could allow remote attacker to account takeover on the targeted device.










",9.8,3.1,CWE-640,cpe:2.3:o:milesight:ms-n5008-uc_firmware:*:*:*:*:*:*:*:*|cpe:2.3:h:milesight:ms-n5008-uc:-:*:*:*:*:*:*:*|cpe:2.3:o:milesight:ms-n1008-unc_firmware:*:*:*:*:*:*:*:*|cpe:2.3:h:milesight:ms-n1008-unc:-:*:*:*:*:*:*:*|cpe:2.3:o:milesight:ms-n1008-uc_firmware:*:*:*:*:*:*:*:*|cpe:2.3:h:milesight:ms-n1008-uc:-:*:*:*:*:*:*:*|cpe:2.3:o:milesight:ms-n1004-uc_firmware:*:*:*:*:*:*:*:*|cpe:2.3:h:milesight:ms-n1004-uc:-:*:*:*:*:*:*:*|cpe:2.3:o:milesight:ms-n5016-e_firmware:*:*:*:*:*:*:*:*|cpe:2.3:h:milesight:ms-n5016-e:-:*:*:*:*:*:*:*|cpe:2.3:o:milesight:ms-n5008-e_firmware:*:*:*:*:*:*:*:*|cpe:2.3:h:milesight:ms-n5008-e:-:*:*:*:*:*:*:*|cpe:2.3:o:milesight:ms-n7016-uh_firmware:*:*:*:*:*:*:*:*|cpe:2.3:h:milesight:ms-n7016-uh:-:*:*:*:*:*:*:*|cpe:2.3:o:milesight:ms-n7032-uh_firmware:*:*:*:*:*:*:*:*|cpe:2.3:h:milesight:ms-n7032-uh:-:*:*:*:*:*:*:*|cpe:2.3:o:milesight:ms-n8064-uh_firmware:*:*:*:*:*:*:*:*|cpe:2.3:h:milesight:ms-n8064-uh:-:*:*:*:*:*:*:*|cpe:2.3:o:milesight:ms-n8032-uh_firmware:*:*:*:*:*:*:*:*|cpe:2.3:h:milesight:ms-n8032-uh:-:*:*:*:*:*:*:*|cpe:2.3:o:milesight:ms-n1004-upc_firmware:*:*:*:*:*:*:*:*|cpe:2.3:h:milesight:ms-n1004-upc:-:*:*:*:*:*:*:*|cpe:2.3:o:milesight:ms-n1008-upc_firmware:*:*:*:*:*:*:*:*|cpe:2.3:h:milesight:ms-n1008-upc:-:*:*:*:*:*:*:*|cpe:2.3:o:milesight:ms-n1008-unpc_firmware:*:*:*:*:*:*:*:*|cpe:2.3:h:milesight:ms-n1008-unpc:-:*:*:*:*:*:*:*|cpe:2.3:o:milesight:ms-n5008-upc_firmware:*:*:*:*:*:*:*:*|cpe:2.3:h:milesight:ms-n5008-upc:-:*:*:*:*:*:*:*|cpe:2.3:o:milesight:ms-n5016-pe_firmware:*:*:*:*:*:*:*:*|cpe:2.3:h:milesight:ms-n5016-pe:-:*:*:*:*:*:*:*|cpe:2.3:o:milesight:ms-n5008-pe_firmware:*:*:*:*:*:*:*:*|cpe:2.3:h:milesight:ms-n5008-pe:-:*:*:*:*:*:*:*|cpe:2.3:o:milesight:ms-n7016-uph_firmware:*:*:*:*:*:*:*:*|cpe:2.3:h:milesight:ms-n7016-uph:-:*:*:*:*:*:*:*|cpe:2.3:o:milesight:ms-n7032-uph_firmware:*:*:*:*:*:*:*:*|cpe:2.3:h:milesight:ms-n7032-uph:-:*:*:*:*:*:*:*|cpe:2.3:o:milesight:ms-n7048-uph_firmware:*:*:*:*:*:*:*:*|cpe:2.3:h:milesight:ms-n7048-uph:-:*:*:*:*:*:*:*|cpe:2.3:o:milesight:ms-nxxxx-xxg_firmware:*:*:*:*:*:*:*:*|cpe:2.3:o:milesight:ms-nxxxx-xxt_firmware:*:*:*:*:*:*:*:*
