Difference Type,cve_id,published,description,cvss_score,cvss_version,cwe_ids,cpe_strings
keyword_only,CVE-2000-0836,2000-11-14,Buffer overflow in CamShot WebCam Trial2.6 allows remote attackers to execute arbitrary commands via a long Authorization header.,7.5,2.0,,cpe:2.3:a:broadgun_software:camshot_webcam:2.6trial_version:*:*:*:*:*:*:*
keyword_only,CVE-2000-1170,2001-01-09,Buffer overflow in Netsnap webcam HTTP server before 1.2.9 allows remote attackers to execute arbitrary commands via a long GET request.,7.5,2.0,,cpe:2.3:a:pelesoft:netsnap:1.2:*:*:*:*:*:*:*
keyword_only,CVE-2001-1543,2001-12-31,"Axis network camera 2120, 2110, 2100, 200+ and 200 contains a default administration password ""pass"", which allows remote attackers to gain access to the camera.",7.5,2.0,,cpe:2.3:h:axis:2100_network_camera:*:*:*:*:*:*:*:*|cpe:2.3:h:axis:2110_network_camera:*:*:*:*:*:*:*:*|cpe:2.3:h:axis:2120_network_camera:*:*:*:*:*:*:*:*|cpe:2.3:h:axis:neteye_200:*:*:*:*:*:*:*:*|cpe:2.3:h:axis:neteye_200\+:*:*:*:*:*:*:*:*
keyword_only,CVE-2002-0781,2002-08-12,"RTSP proxy for Novell BorderManager 3.6 SP 1a allows remote attackers to cause a denial of service via a GET request to port 9090 followed by a series of carriage returns, which causes proxy.nlm to ABEND.",5.0,2.0,,cpe:2.3:a:novell:bordermanager:3.6:sp1a:*:*:*:*:*:*
keyword_only,CVE-2002-1321,2002-12-11,"Multiple buffer overflows in RealOne and RealPlayer allow remote attackers to execute arbitrary code via (1) a Synchronized Multimedia Integration Language (SMIL) file with a long parameter, (2) a long long filename in a rtsp:// request, e.g. from a .m3u file, or (3) certain ""Now Playing"" options on a downloaded file with a long filename.",7.5,2.0,,cpe:2.3:a:realnetworks:realone_player:2.0:*:*:*:*:*:*:*|cpe:2.3:a:realnetworks:realplayer:*:g2:*:*:*:*:*:*|cpe:2.3:a:realnetworks:realplayer:6.0:*:win32:*:*:*:*:*|cpe:2.3:a:realnetworks:realplayer:7.0:*:win32:*:*:*:*:*|cpe:2.3:a:realnetworks:realplayer:8.0:*:win32:*:*:*:*:*
keyword_only,CVE-2002-1643,2002-12-19,"Multiple buffer overflows in RealNetworks Helix Universal Server 9.0 (9.0.2.768) allow remote attackers to execute arbitrary code via (1) a long Transport field in a SETUP RTSP request, (2) a DESCRIBE RTSP request with a long URL argument, or (3) two simultaneous HTTP GET requests with long arguments.",7.5,2.0,,cpe:2.3:a:realnetworks:helix_universal_server:9.0:*:*:*:*:*:*:*|cpe:2.3:a:realnetworks:helix_universal_server:9.0.2.768:*:*:*:*:*:*:*
keyword_only,CVE-2003-0054,2003-03-07,"Apple Darwin Streaming Administration Server 4.1.2 and QuickTime Streaming Server 4.1.1 allows remote attackers to execute certain code via a request to port 7070 with the script in an argument to the rtsp DESCRIBE method, which is inserted into a log file and executed when the log is viewed using a browser.",7.5,2.0,,cpe:2.3:a:apple:darwin_streaming_server:4.1.2:*:*:*:*:*:*:*|cpe:2.3:a:apple:quicktime_streaming_server:4.1.1:*:*:*:*:*:*:*
keyword_only,CVE-2003-0240,2003-06-09,The web-based administration capability for various Axis Network Camera products allows remote attackers to bypass access restrictions and modify configuration via an HTTP request to the admin/admin.shtml containing a leading // (double slash).,10.0,2.0,,cpe:2.3:h:axis:2100_network_camera:*:*:*:*:*:*:*:*|cpe:2.3:h:axis:2110_network_camera:*:*:*:*:*:*:*:*|cpe:2.3:h:axis:2120_network_camera:*:*:*:*:*:*:*:*|cpe:2.3:h:axis:2130_ptz_network_camera:*:*:*:*:*:*:*:*|cpe:2.3:h:axis:2400_video_server:*:*:*:*:*:*:*:*|cpe:2.3:h:axis:2401_video_server:*:*:*:*:*:*:*:*|cpe:2.3:h:axis:2420_network_camera:*:*:*:*:*:*:*:*|cpe:2.3:h:axis:2460_network_dvr:*:*:*:*:*:*:*:*|cpe:2.3:h:axis:250s_video_server:*:*:*:*:*:*:*:*
keyword_only,CVE-2003-0725,2003-10-20,"Buffer overflow in the RTSP protocol parser for the View Source plug-in (vsrcplin.so or vsrcplin3260.dll) for RealNetworks Helix Universal Server 9 and RealSystem Server 8, 7 and RealServer G2 allows remote attackers to execute arbitrary code.",7.5,2.0,,cpe:2.3:a:realnetworks:helix_universal_server:8.0.1:*:*:*:*:*:*:*|cpe:2.3:a:realnetworks:helix_universal_server:9.0:*:*:*:*:*:*:*|cpe:2.3:a:realnetworks:helix_universal_server:9.0.1:*:*:*:*:*:*:*|cpe:2.3:a:realnetworks:helix_universal_server:9.0.2.794:*:*:*:*:*:*:*|cpe:2.3:a:realnetworks:realserver:7.0:*:*:*:*:*:*:*|cpe:2.3:a:realnetworks:realserver:7.0.1:*:*:*:*:*:*:*|cpe:2.3:a:realnetworks:realserver:7.0.2:*:*:*:*:*:*:*|cpe:2.3:a:realnetworks:realserver:8.0:*:*:*:*:*:*:*|cpe:2.3:a:realnetworks:realserver:8.0.1:*:*:*:*:*:*:*|cpe:2.3:a:realnetworks:realserver:8.0.2:*:*:*:*:*:*:*|cpe:2.3:a:realnetworks:realserver:8.0_beta:*:*:*:*:*:*:*|cpe:2.3:a:realnetworks:realserver:g2_1.0:*:*:*:*:*:*:*
keyword_only,CVE-2003-1479,2003-12-31,Cross-site scripting (XSS) vulnerability in webcamXP 1.02.432 and 1.02.535 allows remote attackers to inject arbitrary web script or HTML via the message field.,4.3,2.0,CWE-79,cpe:2.3:a:darkwet:webcam_xp:1.02.432:*:*:*:*:*:*:*|cpe:2.3:a:darkwet:webcam_xp:1.02.535:*:*:*:*:*:*:*
keyword_only,CVE-2004-1784,2004-01-03,Buffer overflow in the web server of Webcam Watchdog 3.63 allows remote attackers to execute arbitrary code via a long HTTP GET request.,7.5,2.0,,cpe:2.3:a:webcam_corp:webcam_watchdog:1.0:*:*:*:*:*:*:*|cpe:2.3:a:webcam_corp:webcam_watchdog:1.1:*:*:*:*:*:*:*|cpe:2.3:a:webcam_corp:webcam_watchdog:3.63:*:*:*:*:*:*:*
keyword_only,CVE-2004-0433,2004-08-18,"Multiple buffer overflows in the Real-Time Streaming Protocol (RTSP) client for (1) MPlayer before 1.0pre4 and (2) xine lib (xine-lib) before 1-rc4, when playing Real RTSP (realrtsp) streams, allow remote attackers to cause a denial of service (crash) and possibly execute arbitrary code via (a) long URLs, (b) long Real server responses, or (c) long Real Data Transport (RDT) packets.",10.0,2.0,,cpe:2.3:a:mplayer:mplayer:1.0_pre3try2:*:*:*:*:*:*:*|cpe:2.3:a:xine:xine-lib:1_beta1:*:*:*:*:*:*:*|cpe:2.3:a:xine:xine-lib:1_beta2:*:*:*:*:*:*:*|cpe:2.3:a:xine:xine-lib:1_beta3:*:*:*:*:*:*:*|cpe:2.3:a:xine:xine-lib:1_beta4:*:*:*:*:*:*:*|cpe:2.3:a:xine:xine-lib:1_beta5:*:*:*:*:*:*:*|cpe:2.3:a:xine:xine-lib:1_beta6:*:*:*:*:*:*:*|cpe:2.3:a:xine:xine-lib:1_beta7:*:*:*:*:*:*:*|cpe:2.3:a:xine:xine-lib:1_beta8:*:*:*:*:*:*:*|cpe:2.3:a:xine:xine-lib:1_beta9:*:*:*:*:*:*:*|cpe:2.3:a:xine:xine-lib:1_beta10:*:*:*:*:*:*:*|cpe:2.3:a:xine:xine-lib:1_beta11:*:*:*:*:*:*:*|cpe:2.3:a:xine:xine-lib:1_rc2:*:*:*:*:*:*:*|cpe:2.3:a:xine:xine-lib:1_rc3a:*:*:*:*:*:*:*|cpe:2.3:a:xine:xine-lib:1_rc3b:*:*:*:*:*:*:*|cpe:2.3:a:xine:xine-lib:1_rc3c:*:*:*:*:*:*:*
keyword_only,CVE-2004-0334,2004-11-23,"InnoMedia VideoPhone allows remote attackers to bypass Basic Authorization via an HTTP request to (1) videophone_admindetail.asp, (2) videophone_syscfg.asp, (3) videophone_upgrade.asp, or (4) videophone_sysctrl.asp that contains a trailing / (slash).  NOTE: the original report mentioned AXIS 2100 Network Camera, but this was likely a cut-and-paste error.",5.0,2.0,,cpe:2.3:h:innomedia:innomedia_videophone:au75200xvi04010x:*:*:*:*:*:*:*
keyword_only,CVE-2004-0789,2004-12-31,"Multiple implementations of the DNS protocol, including (1) Poslib 1.0.2-1 and earlier as used by Posadis, (2) Axis Network products before firmware 3.13, and (3) Men & Mice Suite 2.2x before 2.2.3 and 3.5.x before 3.5.2, allow remote attackers to cause a denial of service (CPU and network bandwidth consumption) by triggering a communications loop via (a) DNS query packets with localhost as a spoofed source address, or (b) a response packet that triggers a response packet.",5.0,2.0,,cpe:2.3:a:delegate:delegate:7.7.0:*:*:*:*:*:*:*|cpe:2.3:a:delegate:delegate:7.7.1:*:*:*:*:*:*:*|cpe:2.3:a:delegate:delegate:7.8.0:*:*:*:*:*:*:*|cpe:2.3:a:delegate:delegate:7.8.1:*:*:*:*:*:*:*|cpe:2.3:a:delegate:delegate:7.8.2:*:*:*:*:*:*:*|cpe:2.3:a:delegate:delegate:7.9.11:*:*:*:*:*:*:*|cpe:2.3:a:delegate:delegate:8.3.3:*:*:*:*:*:*:*|cpe:2.3:a:delegate:delegate:8.3.4:*:*:*:*:*:*:*|cpe:2.3:a:delegate:delegate:8.4.0:*:*:*:*:*:*:*|cpe:2.3:a:delegate:delegate:8.5.0:*:*:*:*:*:*:*|cpe:2.3:a:delegate:delegate:8.9:*:*:*:*:*:*:*|cpe:2.3:a:delegate:delegate:8.9.1:*:*:*:*:*:*:*|cpe:2.3:a:delegate:delegate:8.9.2:*:*:*:*:*:*:*|cpe:2.3:a:delegate:delegate:8.9.3:*:*:*:*:*:*:*|cpe:2.3:a:delegate:delegate:8.9.4:*:*:*:*:*:*:*|cpe:2.3:a:delegate:delegate:8.9.5:*:*:*:*:*:*:*|cpe:2.3:a:dnrd:dnrd:1.0:*:*:*:*:*:*:*|cpe:2.3:a:dnrd:dnrd:1.1:*:*:*:*:*:*:*|cpe:2.3:a:dnrd:dnrd:1.2:*:*:*:*:*:*:*|cpe:2.3:a:dnrd:dnrd:1.3:*:*:*:*:*:*:*|cpe:2.3:a:dnrd:dnrd:1.4:*:*:*:*:*:*:*|cpe:2.3:a:dnrd:dnrd:2.0:*:*:*:*:*:*:*|cpe:2.3:a:dnrd:dnrd:2.1:*:*:*:*:*:*:*|cpe:2.3:a:dnrd:dnrd:2.2:*:*:*:*:*:*:*|cpe:2.3:a:dnrd:dnrd:2.3:*:*:*:*:*:*:*|cpe:2.3:a:dnrd:dnrd:2.4:*:*:*:*:*:*:*|cpe:2.3:a:dnrd:dnrd:2.5:*:*:*:*:*:*:*|cpe:2.3:a:dnrd:dnrd:2.6:*:*:*:*:*:*:*|cpe:2.3:a:dnrd:dnrd:2.7:*:*:*:*:*:*:*|cpe:2.3:a:dnrd:dnrd:2.8:*:*:*:*:*:*:*|cpe:2.3:a:dnrd:dnrd:2.9:*:*:*:*:*:*:*|cpe:2.3:a:dnrd:dnrd:2.10:*:*:*:*:*:*:*|cpe:2.3:a:don_moore:mydns:0.6:*:*:*:*:*:*:*|cpe:2.3:a:don_moore:mydns:0.7:*:*:*:*:*:*:*|cpe:2.3:a:don_moore:mydns:0.8:*:*:*:*:*:*:*|cpe:2.3:a:don_moore:mydns:0.9:*:*:*:*:*:*:*|cpe:2.3:a:don_moore:mydns:0.10.0:*:*:*:*:*:*:*|cpe:2.3:a:maradns:maradns:0.5.28:*:*:*:*:*:*:*|cpe:2.3:a:maradns:maradns:0.5.29:*:*:*:*:*:*:*|cpe:2.3:a:maradns:maradns:0.5.30:*:*:*:*:*:*:*|cpe:2.3:a:maradns:maradns:0.5.31:*:*:*:*:*:*:*|cpe:2.3:a:maradns:maradns:0.8.05:*:*:*:*:*:*:*|cpe:2.3:a:pliant:pliant_dns_server:*:*:*:*:*:*:*:*|cpe:2.3:a:posadis:posadis:0.50.4:*:*:*:*:*:*:*|cpe:2.3:a:posadis:posadis:0.50.5:*:*:*:*:*:*:*|cpe:2.3:a:posadis:posadis:0.50.6:*:*:*:*:*:*:*|cpe:2.3:a:posadis:posadis:0.50.7:*:*:*:*:*:*:*|cpe:2.3:a:posadis:posadis:0.50.8:*:*:*:*:*:*:*|cpe:2.3:a:posadis:posadis:0.50.9:*:*:*:*:*:*:*|cpe:2.3:a:posadis:posadis:0.60.0:*:*:*:*:*:*:*|cpe:2.3:a:posadis:posadis:0.60.1:*:*:*:*:*:*:*|cpe:2.3:a:posadis:posadis:m5pre1:*:*:*:*:*:*:*|cpe:2.3:a:posadis:posadis:m5pre2:*:*:*:*:*:*:*|cpe:2.3:a:qbik:wingate:3.0:*:*:*:*:*:*:*|cpe:2.3:a:qbik:wingate:4.0.1:*:*:*:*:*:*:*|cpe:2.3:a:qbik:wingate:4.1_beta_a:*:*:*:*:*:*:*|cpe:2.3:a:qbik:wingate:6.0:*:*:*:*:*:*:*|cpe:2.3:a:qbik:wingate:6.0.1_build_993:*:*:*:*:*:*:*|cpe:2.3:a:qbik:wingate:6.0.1_build_995:*:*:*:*:*:*:*|cpe:2.3:a:team_johnlong:raidendnsd:*:*:*:*:*:*:*:*|cpe:2.3:h:axis:2100_network_camera:2.0:*:*:*:*:*:*:*|cpe:2.3:h:axis:2100_network_camera:2.01:*:*:*:*:*:*:*|cpe:2.3:h:axis:2100_network_camera:2.02:*:*:*:*:*:*:*|cpe:2.3:h:axis:2100_network_camera:2.03:*:*:*:*:*:*:*|cpe:2.3:h:axis:2100_network_camera:2.12:*:*:*:*:*:*:*|cpe:2.3:h:axis:2100_network_camera:2.30:*:*:*:*:*:*:*|cpe:2.3:h:axis:2100_network_camera:2.31:*:*:*:*:*:*:*|cpe:2.3:h:axis:2100_network_camera:2.32:*:*:*:*:*:*:*|cpe:2.3:h:axis:2100_network_camera:2.33:*:*:*:*:*:*:*|cpe:2.3:h:axis:2100_network_camera:2.34:*:*:*:*:*:*:*|cpe:2.3:h:axis:2100_network_camera:2.40:*:*:*:*:*:*:*|cpe:2.3:h:axis:2100_network_camera:2.41:*:*:*:*:*:*:*|cpe:2.3:h:axis:2110_network_camera:2.12:*:*:*:*:*:*:*|cpe:2.3:h:axis:2110_network_camera:2.30:*:*:*:*:*:*:*|cpe:2.3:h:axis:2110_network_camera:2.31:*:*:*:*:*:*:*|cpe:2.3:h:axis:2110_network_camera:2.32:*:*:*:*:*:*:*|cpe:2.3:h:axis:2110_network_camera:2.34:*:*:*:*:*:*:*|cpe:2.3:h:axis:2110_network_camera:2.40:*:*:*:*:*:*:*|cpe:2.3:h:axis:2110_network_camera:2.41:*:*:*:*:*:*:*|cpe:2.3:h:axis:2120_network_camera:2.12:*:*:*:*:*:*:*|cpe:2.3:h:axis:2120_network_camera:2.30:*:*:*:*:*:*:*|cpe:2.3:h:axis:2120_network_camera:2.31:*:*:*:*:*:*:*|cpe:2.3:h:axis:2120_network_camera:2.32:*:*:*:*:*:*:*|cpe:2.3:h:axis:2120_network_camera:2.34:*:*:*:*:*:*:*|cpe:2.3:h:axis:2120_network_camera:2.40:*:*:*:*:*:*:*|cpe:2.3:h:axis:2120_network_camera:2.41:*:*:*:*:*:*:*|cpe:2.3:h:axis:2400_video_server:3.11:*:*:*:*:*:*:*|cpe:2.3:h:axis:2400_video_server:3.12:*:*:*:*:*:*:*|cpe:2.3:h:axis:2401_video_server:3.12:*:*:*:*:*:*:*|cpe:2.3:h:axis:2420_network_camera:2.12:*:*:*:*:*:*:*|cpe:2.3:h:axis:2420_network_camera:2.30:*:*:*:*:*:*:*|cpe:2.3:h:axis:2420_network_camera:2.31:*:*:*:*:*:*:*|cpe:2.3:h:axis:2420_network_camera:2.32:*:*:*:*:*:*:*|cpe:2.3:h:axis:2420_network_camera:2.33:*:*:*:*:*:*:*|cpe:2.3:h:axis:2420_network_camera:2.34:*:*:*:*:*:*:*|cpe:2.3:h:axis:2420_network_camera:2.40:*:*:*:*:*:*:*|cpe:2.3:h:axis:2420_network_camera:2.41:*:*:*:*:*:*:*|cpe:2.3:h:axis:2460_network_dvr:3.12:*:*:*:*:*:*:*
keyword_only,CVE-2004-2094,2004-12-31,Cross-site scripting (XSS) vulnerability in WebcamXP 1.06.945 allows remote attackers to inject arbitrary HTML or web script as other users via a URL that contains the script.,4.3,2.0,,cpe:2.3:a:darkwet:webcam_xp:1.6.945:*:*:*:*:*:*:*
keyword_only,CVE-2004-2425,2004-12-31,"Axis Network Camera 2.40 and earlier, and Video Server 3.12 and earlier, allows remote attackers to execute arbitrary commands via accent (`) and possibly other shell metacharacters in the query string to virtualinput.cgi.",7.5,2.0,,cpe:2.3:h:axis:2100_network_camera:2.12:*:*:*:*:*:*:*|cpe:2.3:h:axis:2100_network_camera:2.30:*:*:*:*:*:*:*|cpe:2.3:h:axis:2100_network_camera:2.31:*:*:*:*:*:*:*|cpe:2.3:h:axis:2100_network_camera:2.32:*:*:*:*:*:*:*|cpe:2.3:h:axis:2100_network_camera:2.33:*:*:*:*:*:*:*|cpe:2.3:h:axis:2100_network_camera:2.34:*:*:*:*:*:*:*|cpe:2.3:h:axis:2100_network_camera:2.40:*:*:*:*:*:*:*|cpe:2.3:h:axis:2100_network_camera:2.41:*:*:*:*:*:*:*|cpe:2.3:h:axis:2110_network_camera:2.12:*:*:*:*:*:*:*|cpe:2.3:h:axis:2110_network_camera:2.30:*:*:*:*:*:*:*|cpe:2.3:h:axis:2110_network_camera:2.31:*:*:*:*:*:*:*|cpe:2.3:h:axis:2110_network_camera:2.32:*:*:*:*:*:*:*|cpe:2.3:h:axis:2110_network_camera:2.34:*:*:*:*:*:*:*|cpe:2.3:h:axis:2110_network_camera:2.40:*:*:*:*:*:*:*|cpe:2.3:h:axis:2110_network_camera:2.41:*:*:*:*:*:*:*|cpe:2.3:h:axis:2120_network_camera:2.12:*:*:*:*:*:*:*|cpe:2.3:h:axis:2120_network_camera:2.30:*:*:*:*:*:*:*|cpe:2.3:h:axis:2120_network_camera:2.31:*:*:*:*:*:*:*|cpe:2.3:h:axis:2120_network_camera:2.32:*:*:*:*:*:*:*|cpe:2.3:h:axis:2120_network_camera:2.34:*:*:*:*:*:*:*|cpe:2.3:h:axis:2120_network_camera:2.40:*:*:*:*:*:*:*|cpe:2.3:h:axis:2120_network_camera:2.41:*:*:*:*:*:*:*|cpe:2.3:h:axis:2130_ptz_network_camera:2.30:*:*:*:*:*:*:*|cpe:2.3:h:axis:2130_ptz_network_camera:2.31:*:*:*:*:*:*:*|cpe:2.3:h:axis:2130_ptz_network_camera:2.32:*:*:*:*:*:*:*|cpe:2.3:h:axis:2130_ptz_network_camera:2.34:*:*:*:*:*:*:*|cpe:2.3:h:axis:2130_ptz_network_camera:2.40:*:*:*:*:*:*:*|cpe:2.3:h:axis:230_mpeg2_video_server:3.11:*:*:*:*:*:*:*|cpe:2.3:h:axis:2400_video_server:1.1:*:*:*:*:*:*:*|cpe:2.3:h:axis:2400_video_server:1.2:*:*:*:*:*:*:*|cpe:2.3:h:axis:2400_video_server:1.10:*:*:*:*:*:*:*|cpe:2.3:h:axis:2400_video_server:1.11:*:*:*:*:*:*:*|cpe:2.3:h:axis:2400_video_server:1.12:*:*:*:*:*:*:*|cpe:2.3:h:axis:2400_video_server:1.15:*:*:*:*:*:*:*|cpe:2.3:h:axis:2400_video_server:2.0:*:*:*:*:*:*:*|cpe:2.3:h:axis:2400_video_server:2.20:*:*:*:*:*:*:*|cpe:2.3:h:axis:2400_video_server:2.30:*:*:*:*:*:*:*|cpe:2.3:h:axis:2400_video_server:2.31:*:*:*:*:*:*:*|cpe:2.3:h:axis:2400_video_server:2.32:*:*:*:*:*:*:*|cpe:2.3:h:axis:2400_video_server:2.33:*:*:*:*:*:*:*|cpe:2.3:h:axis:2400_video_server:2.34:*:*:*:*:*:*:*|cpe:2.3:h:axis:2400_video_server:3.11:*:*:*:*:*:*:*|cpe:2.3:h:axis:2400_video_server:3.12:*:*:*:*:*:*:*|cpe:2.3:h:axis:2401_video_server:1.0_1:*:*:*:*:*:*:*|cpe:2.3:h:axis:2401_video_server:1.15:*:*:*:*:*:*:*|cpe:2.3:h:axis:2401_video_server:2.20:*:*:*:*:*:*:*|cpe:2.3:h:axis:2401_video_server:2.30:*:*:*:*:*:*:*|cpe:2.3:h:axis:2401_video_server:2.31:*:*:*:*:*:*:*|cpe:2.3:h:axis:2401_video_server:2.32:*:*:*:*:*:*:*|cpe:2.3:h:axis:2401_video_server:2.33:*:*:*:*:*:*:*|cpe:2.3:h:axis:2401_video_server:2.34:*:*:*:*:*:*:*|cpe:2.3:h:axis:2401_video_server:3.12:*:*:*:*:*:*:*|cpe:2.3:h:axis:2401_video_server:3.13:*:*:*:*:*:*:*|cpe:2.3:h:axis:2411_video_server:3.12:*:*:*:*:*:*:*|cpe:2.3:h:axis:2411_video_server:3.13:*:*:*:*:*:*:*|cpe:2.3:h:axis:2420_network_camera:2.12:*:*:*:*:*:*:*|cpe:2.3:h:axis:2420_network_camera:2.30:*:*:*:*:*:*:*|cpe:2.3:h:axis:2420_network_camera:2.31:*:*:*:*:*:*:*|cpe:2.3:h:axis:2420_network_camera:2.32:*:*:*:*:*:*:*|cpe:2.3:h:axis:2420_network_camera:2.33:*:*:*:*:*:*:*|cpe:2.3:h:axis:2420_network_camera:2.34:*:*:*:*:*:*:*|cpe:2.3:h:axis:2420_network_camera:2.40:*:*:*:*:*:*:*|cpe:2.3:h:axis:2420_network_camera:2.41:*:*:*:*:*:*:*|cpe:2.3:h:axis:2420_video_server:2.32:*:*:*:*:*:*:*|cpe:2.3:h:axis:2420_video_server:2.34:*:*:*:*:*:*:*|cpe:2.3:h:axis:2460_network_dvr:*:*:*:*:*:*:*:*|cpe:2.3:h:axis:2460_network_dvr:3.10:*:*:*:*:*:*:*|cpe:2.3:h:axis:2460_network_dvr:3.11:*:*:*:*:*:*:*|cpe:2.3:h:axis:2490_serial_server:*:*:*:*:*:*:*:*|cpe:2.3:h:axis:2490_serial_server:2.11.3:*:*:*:*:*:*:*|cpe:2.3:h:axis:250s_video_server:*:*:*:*:*:*:*:*|cpe:2.3:h:axis:250s_video_server:3.03:*:*:*:*:*:*:*|cpe:2.3:h:axis:250s_video_server:3.10:*:*:*:*:*:*:*|cpe:2.3:h:axis:storpoint_cd:*:*:*:*:*:*:*:*
keyword_only,CVE-2004-2426,2004-12-31,"Directory traversal vulnerability in Axis Network Camera 2.40 and earlier, and Video Server 3.12 and earlier, allows remote attackers to bypass authentication via a ..  (dot dot) in an HTTP POST request to ServerManager.srv, then use these privileges to conduct other activities, such as modifying files using editcgi.cgi.",5.0,2.0,,cpe:2.3:h:axis:2100_network_camera:2.12:*:*:*:*:*:*:*|cpe:2.3:h:axis:2100_network_camera:2.30:*:*:*:*:*:*:*|cpe:2.3:h:axis:2100_network_camera:2.31:*:*:*:*:*:*:*|cpe:2.3:h:axis:2100_network_camera:2.32:*:*:*:*:*:*:*|cpe:2.3:h:axis:2100_network_camera:2.33:*:*:*:*:*:*:*|cpe:2.3:h:axis:2100_network_camera:2.34:*:*:*:*:*:*:*|cpe:2.3:h:axis:2100_network_camera:2.40:*:*:*:*:*:*:*|cpe:2.3:h:axis:2100_network_camera:2.41:*:*:*:*:*:*:*|cpe:2.3:h:axis:2110_network_camera:2.12:*:*:*:*:*:*:*|cpe:2.3:h:axis:2110_network_camera:2.30:*:*:*:*:*:*:*|cpe:2.3:h:axis:2110_network_camera:2.31:*:*:*:*:*:*:*|cpe:2.3:h:axis:2110_network_camera:2.32:*:*:*:*:*:*:*|cpe:2.3:h:axis:2110_network_camera:2.34:*:*:*:*:*:*:*|cpe:2.3:h:axis:2110_network_camera:2.40:*:*:*:*:*:*:*|cpe:2.3:h:axis:2110_network_camera:2.41:*:*:*:*:*:*:*|cpe:2.3:h:axis:2120_network_camera:2.12:*:*:*:*:*:*:*|cpe:2.3:h:axis:2120_network_camera:2.30:*:*:*:*:*:*:*|cpe:2.3:h:axis:2120_network_camera:2.31:*:*:*:*:*:*:*|cpe:2.3:h:axis:2120_network_camera:2.32:*:*:*:*:*:*:*|cpe:2.3:h:axis:2120_network_camera:2.34:*:*:*:*:*:*:*|cpe:2.3:h:axis:2120_network_camera:2.40:*:*:*:*:*:*:*|cpe:2.3:h:axis:2120_network_camera:2.41:*:*:*:*:*:*:*|cpe:2.3:h:axis:2130_ptz_network_camera:2.30:*:*:*:*:*:*:*|cpe:2.3:h:axis:2130_ptz_network_camera:2.31:*:*:*:*:*:*:*|cpe:2.3:h:axis:2130_ptz_network_camera:2.32:*:*:*:*:*:*:*|cpe:2.3:h:axis:2130_ptz_network_camera:2.34:*:*:*:*:*:*:*|cpe:2.3:h:axis:2130_ptz_network_camera:2.40:*:*:*:*:*:*:*|cpe:2.3:h:axis:230_mpeg2_video_server:3.11:*:*:*:*:*:*:*|cpe:2.3:h:axis:2400_video_server:1.1:*:*:*:*:*:*:*|cpe:2.3:h:axis:2400_video_server:1.2:*:*:*:*:*:*:*|cpe:2.3:h:axis:2400_video_server:1.10:*:*:*:*:*:*:*|cpe:2.3:h:axis:2400_video_server:1.11:*:*:*:*:*:*:*|cpe:2.3:h:axis:2400_video_server:1.12:*:*:*:*:*:*:*|cpe:2.3:h:axis:2400_video_server:1.15:*:*:*:*:*:*:*|cpe:2.3:h:axis:2400_video_server:2.0:*:*:*:*:*:*:*|cpe:2.3:h:axis:2400_video_server:2.20:*:*:*:*:*:*:*|cpe:2.3:h:axis:2400_video_server:2.30:*:*:*:*:*:*:*|cpe:2.3:h:axis:2400_video_server:2.31:*:*:*:*:*:*:*|cpe:2.3:h:axis:2400_video_server:2.32:*:*:*:*:*:*:*|cpe:2.3:h:axis:2400_video_server:2.33:*:*:*:*:*:*:*|cpe:2.3:h:axis:2400_video_server:2.34:*:*:*:*:*:*:*|cpe:2.3:h:axis:2400_video_server:3.11:*:*:*:*:*:*:*|cpe:2.3:h:axis:2400_video_server:3.12:*:*:*:*:*:*:*|cpe:2.3:h:axis:2401_video_server:1.0_1:*:*:*:*:*:*:*|cpe:2.3:h:axis:2401_video_server:1.15:*:*:*:*:*:*:*|cpe:2.3:h:axis:2401_video_server:2.20:*:*:*:*:*:*:*|cpe:2.3:h:axis:2401_video_server:2.30:*:*:*:*:*:*:*|cpe:2.3:h:axis:2401_video_server:2.31:*:*:*:*:*:*:*|cpe:2.3:h:axis:2401_video_server:2.32:*:*:*:*:*:*:*|cpe:2.3:h:axis:2401_video_server:2.33:*:*:*:*:*:*:*|cpe:2.3:h:axis:2401_video_server:2.34:*:*:*:*:*:*:*|cpe:2.3:h:axis:2401_video_server:3.12:*:*:*:*:*:*:*|cpe:2.3:h:axis:2401_video_server:3.13:*:*:*:*:*:*:*|cpe:2.3:h:axis:2411_video_server:3.12:*:*:*:*:*:*:*|cpe:2.3:h:axis:2411_video_server:3.13:*:*:*:*:*:*:*|cpe:2.3:h:axis:2420_network_camera:2.12:*:*:*:*:*:*:*|cpe:2.3:h:axis:2420_network_camera:2.30:*:*:*:*:*:*:*|cpe:2.3:h:axis:2420_network_camera:2.31:*:*:*:*:*:*:*|cpe:2.3:h:axis:2420_network_camera:2.32:*:*:*:*:*:*:*|cpe:2.3:h:axis:2420_network_camera:2.33:*:*:*:*:*:*:*|cpe:2.3:h:axis:2420_network_camera:2.34:*:*:*:*:*:*:*|cpe:2.3:h:axis:2420_network_camera:2.40:*:*:*:*:*:*:*|cpe:2.3:h:axis:2420_network_camera:2.41:*:*:*:*:*:*:*|cpe:2.3:h:axis:2420_video_server:2.32:*:*:*:*:*:*:*|cpe:2.3:h:axis:2420_video_server:2.34:*:*:*:*:*:*:*|cpe:2.3:h:axis:2460_network_dvr:*:*:*:*:*:*:*:*|cpe:2.3:h:axis:2460_network_dvr:3.10:*:*:*:*:*:*:*|cpe:2.3:h:axis:2460_network_dvr:3.11:*:*:*:*:*:*:*|cpe:2.3:h:axis:2490_serial_server:*:*:*:*:*:*:*:*|cpe:2.3:h:axis:2490_serial_server:2.11.3:*:*:*:*:*:*:*|cpe:2.3:h:axis:250s_video_server:*:*:*:*:*:*:*:*|cpe:2.3:h:axis:250s_video_server:3.03:*:*:*:*:*:*:*|cpe:2.3:h:axis:250s_video_server:3.10:*:*:*:*:*:*:*|cpe:2.3:h:axis:storpoint_cd:*:*:*:*:*:*:*:*
keyword_only,CVE-2004-2427,2004-12-31,"Axis Network Camera 2.40 and earlier, and Video Server 3.12 and earlier, allows remote attackers to obtain sensitive information via direct requests to (1) admin/getparam.cgi, (2) admin/systemlog.cgi, (3) admin/serverreport.cgi, and (4) admin/paramlist.cgi, modify system information via (5) setparam.cgi and (6) factorydefault.cgi, or (7) cause a denial of service (reboot) via restart.cgi.",10.0,2.0,,cpe:2.3:h:axis:2100_network_camera:2.12:*:*:*:*:*:*:*|cpe:2.3:h:axis:2100_network_camera:2.30:*:*:*:*:*:*:*|cpe:2.3:h:axis:2100_network_camera:2.31:*:*:*:*:*:*:*|cpe:2.3:h:axis:2100_network_camera:2.32:*:*:*:*:*:*:*|cpe:2.3:h:axis:2100_network_camera:2.33:*:*:*:*:*:*:*|cpe:2.3:h:axis:2100_network_camera:2.34:*:*:*:*:*:*:*|cpe:2.3:h:axis:2100_network_camera:2.40:*:*:*:*:*:*:*|cpe:2.3:h:axis:2100_network_camera:2.41:*:*:*:*:*:*:*|cpe:2.3:h:axis:2110_network_camera:2.12:*:*:*:*:*:*:*|cpe:2.3:h:axis:2110_network_camera:2.30:*:*:*:*:*:*:*|cpe:2.3:h:axis:2110_network_camera:2.31:*:*:*:*:*:*:*|cpe:2.3:h:axis:2110_network_camera:2.32:*:*:*:*:*:*:*|cpe:2.3:h:axis:2110_network_camera:2.34:*:*:*:*:*:*:*|cpe:2.3:h:axis:2110_network_camera:2.40:*:*:*:*:*:*:*|cpe:2.3:h:axis:2110_network_camera:2.41:*:*:*:*:*:*:*|cpe:2.3:h:axis:2120_network_camera:2.12:*:*:*:*:*:*:*|cpe:2.3:h:axis:2120_network_camera:2.30:*:*:*:*:*:*:*|cpe:2.3:h:axis:2120_network_camera:2.31:*:*:*:*:*:*:*|cpe:2.3:h:axis:2120_network_camera:2.32:*:*:*:*:*:*:*|cpe:2.3:h:axis:2120_network_camera:2.34:*:*:*:*:*:*:*|cpe:2.3:h:axis:2120_network_camera:2.40:*:*:*:*:*:*:*|cpe:2.3:h:axis:2120_network_camera:2.41:*:*:*:*:*:*:*|cpe:2.3:h:axis:2130_ptz_network_camera:2.30:*:*:*:*:*:*:*|cpe:2.3:h:axis:2130_ptz_network_camera:2.31:*:*:*:*:*:*:*|cpe:2.3:h:axis:2130_ptz_network_camera:2.32:*:*:*:*:*:*:*|cpe:2.3:h:axis:2130_ptz_network_camera:2.34:*:*:*:*:*:*:*|cpe:2.3:h:axis:2130_ptz_network_camera:2.40:*:*:*:*:*:*:*|cpe:2.3:h:axis:230_mpeg2_video_server:3.11:*:*:*:*:*:*:*|cpe:2.3:h:axis:2400_video_server:1.1:*:*:*:*:*:*:*|cpe:2.3:h:axis:2400_video_server:1.2:*:*:*:*:*:*:*|cpe:2.3:h:axis:2400_video_server:1.10:*:*:*:*:*:*:*|cpe:2.3:h:axis:2400_video_server:1.11:*:*:*:*:*:*:*|cpe:2.3:h:axis:2400_video_server:1.12:*:*:*:*:*:*:*|cpe:2.3:h:axis:2400_video_server:1.15:*:*:*:*:*:*:*|cpe:2.3:h:axis:2400_video_server:2.0:*:*:*:*:*:*:*|cpe:2.3:h:axis:2400_video_server:2.20:*:*:*:*:*:*:*|cpe:2.3:h:axis:2400_video_server:2.30:*:*:*:*:*:*:*|cpe:2.3:h:axis:2400_video_server:2.31:*:*:*:*:*:*:*|cpe:2.3:h:axis:2400_video_server:2.32:*:*:*:*:*:*:*|cpe:2.3:h:axis:2400_video_server:2.33:*:*:*:*:*:*:*|cpe:2.3:h:axis:2400_video_server:2.34:*:*:*:*:*:*:*|cpe:2.3:h:axis:2400_video_server:3.11:*:*:*:*:*:*:*|cpe:2.3:h:axis:2400_video_server:3.12:*:*:*:*:*:*:*|cpe:2.3:h:axis:2401_video_server:1.0_1:*:*:*:*:*:*:*|cpe:2.3:h:axis:2401_video_server:1.15:*:*:*:*:*:*:*|cpe:2.3:h:axis:2401_video_server:2.20:*:*:*:*:*:*:*|cpe:2.3:h:axis:2401_video_server:2.30:*:*:*:*:*:*:*|cpe:2.3:h:axis:2401_video_server:2.31:*:*:*:*:*:*:*|cpe:2.3:h:axis:2401_video_server:2.32:*:*:*:*:*:*:*|cpe:2.3:h:axis:2401_video_server:2.33:*:*:*:*:*:*:*|cpe:2.3:h:axis:2401_video_server:2.34:*:*:*:*:*:*:*|cpe:2.3:h:axis:2401_video_server:3.12:*:*:*:*:*:*:*|cpe:2.3:h:axis:2401_video_server:3.13:*:*:*:*:*:*:*|cpe:2.3:h:axis:2411_video_server:3.12:*:*:*:*:*:*:*|cpe:2.3:h:axis:2411_video_server:3.13:*:*:*:*:*:*:*|cpe:2.3:h:axis:2420_network_camera:2.12:*:*:*:*:*:*:*|cpe:2.3:h:axis:2420_network_camera:2.30:*:*:*:*:*:*:*|cpe:2.3:h:axis:2420_network_camera:2.31:*:*:*:*:*:*:*|cpe:2.3:h:axis:2420_network_camera:2.32:*:*:*:*:*:*:*|cpe:2.3:h:axis:2420_network_camera:2.33:*:*:*:*:*:*:*|cpe:2.3:h:axis:2420_network_camera:2.34:*:*:*:*:*:*:*|cpe:2.3:h:axis:2420_network_camera:2.40:*:*:*:*:*:*:*|cpe:2.3:h:axis:2420_network_camera:2.41:*:*:*:*:*:*:*|cpe:2.3:h:axis:2420_video_server:2.32:*:*:*:*:*:*:*|cpe:2.3:h:axis:2420_video_server:2.34:*:*:*:*:*:*:*|cpe:2.3:h:axis:2460_network_dvr:*:*:*:*:*:*:*:*|cpe:2.3:h:axis:2460_network_dvr:3.10:*:*:*:*:*:*:*|cpe:2.3:h:axis:2460_network_dvr:3.11:*:*:*:*:*:*:*|cpe:2.3:h:axis:2490_serial_server:*:*:*:*:*:*:*:*|cpe:2.3:h:axis:2490_serial_server:2.11.3:*:*:*:*:*:*:*|cpe:2.3:h:axis:250s_video_server:*:*:*:*:*:*:*:*|cpe:2.3:h:axis:250s_video_server:3.03:*:*:*:*:*:*:*|cpe:2.3:h:axis:250s_video_server:3.10:*:*:*:*:*:*:*|cpe:2.3:h:axis:storpoint_cd:*:*:*:*:*:*:*:*
keyword_only,CVE-2004-2528,2004-12-31,Cross-site scripting (XSS) vulnerability in sresult.exe in Webcam Watchdog 4.0.1a allows remote attackers to inject arbitrary web script or HTML via the cam parameter.,4.3,2.0,,cpe:2.3:a:webcam_corp:webcam_watchdog:4.0.1a:*:*:*:*:*:*:*
